No.     Time           Source                Destination           Protocol Length Info
   3499 2.652291       host                  1.9.0                 USB      36     SET CONFIGURATION Request

Frame 3499: 36 bytes on wire (288 bits), 36 bytes captured (288 bits) on interface \\.\USBPcap1, id 0
    Section number: 1
    Interface id: 0 (\\.\USBPcap1)
        Interface name: \\.\USBPcap1
        Interface description: USBPcap1
    Encapsulation type: USB packets with USBPcap header (152)
    Arrival Time: Jun 22, 2025 18:49:57.663274000 Central Europe Daylight Time
    UTC Arrival Time: Jun 22, 2025 16:49:57.663274000 UTC
    Epoch Arrival Time: 1750610997.663274000
    [Time shift for this packet: 0.000000000 seconds]
    [Time delta from previous captured frame: 0.014645000 seconds]
    [Time delta from previous displayed frame: 0.014645000 seconds]
    [Time since reference or first frame: 2.652291000 seconds]
    Frame Number: 3499
    Frame Length: 36 bytes (288 bits)
    Capture Length: 36 bytes (288 bits)
    [Frame is marked: False]
    [Frame is ignored: False]
    [Protocols in frame: usb]
USB URB
    [Source: host]
    [Destination: 1.9.0]
    USBPcap pseudoheader length: 28
    IRP ID: 0xffffde073e8c7010
    IRP USBD_STATUS: USBD_STATUS_SUCCESS (0x00000000)
    URB Function: URB_FUNCTION_SELECT_CONFIGURATION (0x0000)
    IRP information: 0x00, Direction: FDO -> PDO
        0000 000. = Reserved: 0x00
        .... ...0 = Direction: FDO -> PDO (0x0)
    URB bus id: 1
    Device address: 9
    Endpoint: 0x00, Direction: OUT
        0... .... = Direction: OUT (0)
        .... 0000 = Endpoint number: 0
    URB transfer type: URB_CONTROL (0x02)
    Packet Data Length: 8
    [Response in: 3500]
    Control transfer stage: Setup (0)
Setup Data
    bmRequestType: 0x00
        0... .... = Direction: Host-to-device
        .00. .... = Type: Standard (0x0)
        ...0 0000 = Recipient: Device (0x00)
    bRequest: SET CONFIGURATION (9)
    bConfigurationValue: 0
    wIndex: 0 (0x0000)
    wLength: 0

No.     Time           Source                Destination           Protocol Length Info
   3500 2.652771       1.9.0                 host                  USB      28     SET CONFIGURATION Response

Frame 3500: 28 bytes on wire (224 bits), 28 bytes captured (224 bits) on interface \\.\USBPcap1, id 0
    Section number: 1
    Interface id: 0 (\\.\USBPcap1)
        Interface name: \\.\USBPcap1
        Interface description: USBPcap1
    Encapsulation type: USB packets with USBPcap header (152)
    Arrival Time: Jun 22, 2025 18:49:57.663754000 Central Europe Daylight Time
    UTC Arrival Time: Jun 22, 2025 16:49:57.663754000 UTC
    Epoch Arrival Time: 1750610997.663754000
    [Time shift for this packet: 0.000000000 seconds]
    [Time delta from previous captured frame: 0.000480000 seconds]
    [Time delta from previous displayed frame: 0.000480000 seconds]
    [Time since reference or first frame: 2.652771000 seconds]
    Frame Number: 3500
    Frame Length: 28 bytes (224 bits)
    Capture Length: 28 bytes (224 bits)
    [Frame is marked: False]
    [Frame is ignored: False]
    [Protocols in frame: usb]
USB URB
    [Source: 1.9.0]
    [Destination: host]
    USBPcap pseudoheader length: 28
    IRP ID: 0xffffde073e8c7010
    IRP USBD_STATUS: USBD_STATUS_SUCCESS (0x00000000)
    URB Function: URB_FUNCTION_SELECT_CONFIGURATION (0x0000)
    IRP information: 0x01, Direction: PDO -> FDO
        0000 000. = Reserved: 0x00
        .... ...1 = Direction: PDO -> FDO (0x1)
    URB bus id: 1
    Device address: 9
    Endpoint: 0x00, Direction: OUT
        0... .... = Direction: OUT (0)
        .... 0000 = Endpoint number: 0
    URB transfer type: URB_CONTROL (0x02)
    Packet Data Length: 0
    [Request in: 3499]
    [Time from request: 0.000480000 seconds]
    Control transfer stage: Complete (3)

No.     Time           Source                Destination           Protocol Length Info
   3501 2.652788       host                  1.9.0                 USB      36     GET DESCRIPTOR Request DEVICE

Frame 3501: 36 bytes on wire (288 bits), 36 bytes captured (288 bits) on interface \\.\USBPcap1, id 0
    Section number: 1
    Interface id: 0 (\\.\USBPcap1)
        Interface name: \\.\USBPcap1
        Interface description: USBPcap1
    Encapsulation type: USB packets with USBPcap header (152)
    Arrival Time: Jun 22, 2025 18:49:57.663771000 Central Europe Daylight Time
    UTC Arrival Time: Jun 22, 2025 16:49:57.663771000 UTC
    Epoch Arrival Time: 1750610997.663771000
    [Time shift for this packet: 0.000000000 seconds]
    [Time delta from previous captured frame: 0.000017000 seconds]
    [Time delta from previous displayed frame: 0.000017000 seconds]
    [Time since reference or first frame: 2.652788000 seconds]
    Frame Number: 3501
    Frame Length: 36 bytes (288 bits)
    Capture Length: 36 bytes (288 bits)
    [Frame is marked: False]
    [Frame is ignored: False]
    [Protocols in frame: usb]
USB URB
    [Source: host]
    [Destination: 1.9.0]
    USBPcap pseudoheader length: 28
    IRP ID: 0xffffde073e8c7010
    IRP USBD_STATUS: USBD_STATUS_SUCCESS (0x00000000)
    URB Function: URB_FUNCTION_GET_DESCRIPTOR_FROM_DEVICE (0x000b)
    IRP information: 0x00, Direction: FDO -> PDO
        0000 000. = Reserved: 0x00
        .... ...0 = Direction: FDO -> PDO (0x0)
    URB bus id: 1
    Device address: 9
    Endpoint: 0x80, Direction: IN
        1... .... = Direction: IN (1)
        .... 0000 = Endpoint number: 0
    URB transfer type: URB_CONTROL (0x02)
    Packet Data Length: 8
    [Response in: 3502]
    Control transfer stage: Setup (0)
Setup Data
    bmRequestType: 0x80
        1... .... = Direction: Device-to-host
        .00. .... = Type: Standard (0x0)
        ...0 0000 = Recipient: Device (0x00)
    bRequest: GET DESCRIPTOR (6)
    Descriptor Index: 0x00
    bDescriptorType: DEVICE (0x01)
    Language Id: no language specified (0x0000)
    wLength: 18

No.     Time           Source                Destination           Protocol Length Info
   3502 2.652880       1.9.0                 host                  USB      46     GET DESCRIPTOR Response DEVICE

Frame 3502: 46 bytes on wire (368 bits), 46 bytes captured (368 bits) on interface \\.\USBPcap1, id 0
    Section number: 1
    Interface id: 0 (\\.\USBPcap1)
        Interface name: \\.\USBPcap1
        Interface description: USBPcap1
    Encapsulation type: USB packets with USBPcap header (152)
    Arrival Time: Jun 22, 2025 18:49:57.663863000 Central Europe Daylight Time
    UTC Arrival Time: Jun 22, 2025 16:49:57.663863000 UTC
    Epoch Arrival Time: 1750610997.663863000
    [Time shift for this packet: 0.000000000 seconds]
    [Time delta from previous captured frame: 0.000092000 seconds]
    [Time delta from previous displayed frame: 0.000092000 seconds]
    [Time since reference or first frame: 2.652880000 seconds]
    Frame Number: 3502
    Frame Length: 46 bytes (368 bits)
    Capture Length: 46 bytes (368 bits)
    [Frame is marked: False]
    [Frame is ignored: False]
    [Protocols in frame: usb]
USB URB
    [Source: 1.9.0]
    [Destination: host]
    USBPcap pseudoheader length: 28
    IRP ID: 0xffffde073e8c7010
    IRP USBD_STATUS: USBD_STATUS_SUCCESS (0x00000000)
    URB Function: URB_FUNCTION_CONTROL_TRANSFER (0x0008)
    IRP information: 0x01, Direction: PDO -> FDO
        0000 000. = Reserved: 0x00
        .... ...1 = Direction: PDO -> FDO (0x1)
    URB bus id: 1
    Device address: 9
    Endpoint: 0x80, Direction: IN
        1... .... = Direction: IN (1)
        .... 0000 = Endpoint number: 0
    URB transfer type: URB_CONTROL (0x02)
    Packet Data Length: 18
    [Request in: 3501]
    [Time from request: 0.000092000 seconds]
    Control transfer stage: Complete (3)
DEVICE DESCRIPTOR
    bLength: 18
    bDescriptorType: 0x01 (DEVICE)
    bcdUSB: 0x0200
    bDeviceClass: Vendor Specific (0xff)
    bDeviceSubClass: 255
    bDeviceProtocol: 255
    bMaxPacketSize0: 64
    idVendor: TEAC Corp. (0x0644)
    idProduct: Unknown (0x8020)
    bcdDevice: 0x0100
    iManufacturer: 1
    iProduct: 2
    iSerialNumber: 3
    bNumConfigurations: 1

No.     Time           Source                Destination           Protocol Length Info
   3503 2.654433       host                  1.9.0                 USB      36     URB_CONTROL in

Frame 3503: 36 bytes on wire (288 bits), 36 bytes captured (288 bits) on interface \\.\USBPcap1, id 0
    Section number: 1
    Interface id: 0 (\\.\USBPcap1)
        Interface name: \\.\USBPcap1
        Interface description: USBPcap1
    Encapsulation type: USB packets with USBPcap header (152)
    Arrival Time: Jun 22, 2025 18:49:57.665416000 Central Europe Daylight Time
    UTC Arrival Time: Jun 22, 2025 16:49:57.665416000 UTC
    Epoch Arrival Time: 1750610997.665416000
    [Time shift for this packet: 0.000000000 seconds]
    [Time delta from previous captured frame: 0.001553000 seconds]
    [Time delta from previous displayed frame: 0.001553000 seconds]
    [Time since reference or first frame: 2.654433000 seconds]
    Frame Number: 3503
    Frame Length: 36 bytes (288 bits)
    Capture Length: 36 bytes (288 bits)
    [Frame is marked: False]
    [Frame is ignored: False]
    [Protocols in frame: usb]
USB URB
    [Source: host]
    [Destination: 1.9.0]
    USBPcap pseudoheader length: 28
    IRP ID: 0xffffde073ea70560
    IRP USBD_STATUS: USBD_STATUS_SUCCESS (0x00000000)
    URB Function: URB_FUNCTION_VENDOR_DEVICE (0x0017)
    IRP information: 0x00, Direction: FDO -> PDO
        0000 000. = Reserved: 0x00
        .... ...0 = Direction: FDO -> PDO (0x0)
    URB bus id: 1
    Device address: 9
    Endpoint: 0x80, Direction: IN
        1... .... = Direction: IN (1)
        .... 0000 = Endpoint number: 0
    URB transfer type: URB_CONTROL (0x02)
    Packet Data Length: 8
    [Response in: 3504]
    Control transfer stage: Setup (0)
    [bInterfaceClass: Unknown (0xffff)]
Setup Data
    bmRequestType: 0xc0
        1... .... = Direction: Device-to-host
        .10. .... = Type: Vendor (0x2)
        ...0 0000 = Recipient: Device (0x00)
    bRequest: 86
    wValue: 0x0000
    wIndex: 0 (0x0000)
    wLength: 15

No.     Time           Source                Destination           Protocol Length Info
   3504 2.654566       1.9.0                 host                  USB      43     URB_CONTROL in

Frame 3504: 43 bytes on wire (344 bits), 43 bytes captured (344 bits) on interface \\.\USBPcap1, id 0
    Section number: 1
    Interface id: 0 (\\.\USBPcap1)
        Interface name: \\.\USBPcap1
        Interface description: USBPcap1
    Encapsulation type: USB packets with USBPcap header (152)
    Arrival Time: Jun 22, 2025 18:49:57.665549000 Central Europe Daylight Time
    UTC Arrival Time: Jun 22, 2025 16:49:57.665549000 UTC
    Epoch Arrival Time: 1750610997.665549000
    [Time shift for this packet: 0.000000000 seconds]
    [Time delta from previous captured frame: 0.000133000 seconds]
    [Time delta from previous displayed frame: 0.000133000 seconds]
    [Time since reference or first frame: 2.654566000 seconds]
    Frame Number: 3504
    Frame Length: 43 bytes (344 bits)
    Capture Length: 43 bytes (344 bits)
    [Frame is marked: False]
    [Frame is ignored: False]
    [Protocols in frame: usb]
USB URB
    [Source: 1.9.0]
    [Destination: host]
    USBPcap pseudoheader length: 28
    IRP ID: 0xffffde073ea70560
    IRP USBD_STATUS: USBD_STATUS_SUCCESS (0x00000000)
    URB Function: URB_FUNCTION_CONTROL_TRANSFER (0x0008)
    IRP information: 0x01, Direction: PDO -> FDO
        0000 000. = Reserved: 0x00
        .... ...1 = Direction: PDO -> FDO (0x1)
    URB bus id: 1
    Device address: 9
    Endpoint: 0x80, Direction: IN
        1... .... = Direction: IN (1)
        .... 0000 = Endpoint number: 0
    URB transfer type: URB_CONTROL (0x02)
    Packet Data Length: 15
    [Request in: 3503]
    [Time from request: 0.000133000 seconds]
    Control transfer stage: Complete (3)
    [bInterfaceClass: Unknown (0xffff)]
CONTROL response data: 31020356322e30332020202000ffff

No.     Time           Source                Destination           Protocol Length Info
   3505 2.654583       host                  1.9.0                 USB      36     URB_CONTROL in

Frame 3505: 36 bytes on wire (288 bits), 36 bytes captured (288 bits) on interface \\.\USBPcap1, id 0
    Section number: 1
    Interface id: 0 (\\.\USBPcap1)
        Interface name: \\.\USBPcap1
        Interface description: USBPcap1
    Encapsulation type: USB packets with USBPcap header (152)
    Arrival Time: Jun 22, 2025 18:49:57.665566000 Central Europe Daylight Time
    UTC Arrival Time: Jun 22, 2025 16:49:57.665566000 UTC
    Epoch Arrival Time: 1750610997.665566000
    [Time shift for this packet: 0.000000000 seconds]
    [Time delta from previous captured frame: 0.000017000 seconds]
    [Time delta from previous displayed frame: 0.000017000 seconds]
    [Time since reference or first frame: 2.654583000 seconds]
    Frame Number: 3505
    Frame Length: 36 bytes (288 bits)
    Capture Length: 36 bytes (288 bits)
    [Frame is marked: False]
    [Frame is ignored: False]
    [Protocols in frame: usb]
USB URB
    [Source: host]
    [Destination: 1.9.0]
    USBPcap pseudoheader length: 28
    IRP ID: 0xffffde073ea70560
    IRP USBD_STATUS: USBD_STATUS_SUCCESS (0x00000000)
    URB Function: URB_FUNCTION_VENDOR_DEVICE (0x0017)
    IRP information: 0x00, Direction: FDO -> PDO
        0000 000. = Reserved: 0x00
        .... ...0 = Direction: FDO -> PDO (0x0)
    URB bus id: 1
    Device address: 9
    Endpoint: 0x80, Direction: IN
        1... .... = Direction: IN (1)
        .... 0000 = Endpoint number: 0
    URB transfer type: URB_CONTROL (0x02)
    Packet Data Length: 8
    [Response in: 3506]
    Control transfer stage: Setup (0)
    [bInterfaceClass: Unknown (0xffff)]
Setup Data
    bmRequestType: 0xc0
        1... .... = Direction: Device-to-host
        .10. .... = Type: Vendor (0x2)
        ...0 0000 = Recipient: Device (0x00)
    bRequest: 86
    wValue: 0x0000
    wIndex: 0 (0x0000)
    wLength: 15

No.     Time           Source                Destination           Protocol Length Info
   3506 2.654699       1.9.0                 host                  USB      43     URB_CONTROL in

Frame 3506: 43 bytes on wire (344 bits), 43 bytes captured (344 bits) on interface \\.\USBPcap1, id 0
    Section number: 1
    Interface id: 0 (\\.\USBPcap1)
        Interface name: \\.\USBPcap1
        Interface description: USBPcap1
    Encapsulation type: USB packets with USBPcap header (152)
    Arrival Time: Jun 22, 2025 18:49:57.665682000 Central Europe Daylight Time
    UTC Arrival Time: Jun 22, 2025 16:49:57.665682000 UTC
    Epoch Arrival Time: 1750610997.665682000
    [Time shift for this packet: 0.000000000 seconds]
    [Time delta from previous captured frame: 0.000116000 seconds]
    [Time delta from previous displayed frame: 0.000116000 seconds]
    [Time since reference or first frame: 2.654699000 seconds]
    Frame Number: 3506
    Frame Length: 43 bytes (344 bits)
    Capture Length: 43 bytes (344 bits)
    [Frame is marked: False]
    [Frame is ignored: False]
    [Protocols in frame: usb]
USB URB
    [Source: 1.9.0]
    [Destination: host]
    USBPcap pseudoheader length: 28
    IRP ID: 0xffffde073ea70560
    IRP USBD_STATUS: USBD_STATUS_SUCCESS (0x00000000)
    URB Function: URB_FUNCTION_CONTROL_TRANSFER (0x0008)
    IRP information: 0x01, Direction: PDO -> FDO
        0000 000. = Reserved: 0x00
        .... ...1 = Direction: PDO -> FDO (0x1)
    URB bus id: 1
    Device address: 9
    Endpoint: 0x80, Direction: IN
        1... .... = Direction: IN (1)
        .... 0000 = Endpoint number: 0
    URB transfer type: URB_CONTROL (0x02)
    Packet Data Length: 15
    [Request in: 3505]
    [Time from request: 0.000116000 seconds]
    Control transfer stage: Complete (3)
    [bInterfaceClass: Unknown (0xffff)]
CONTROL response data: 31020356322e30332020202000ffff

No.     Time           Source                Destination           Protocol Length Info
   3507 2.654705       host                  1.9.0                 USB      36     GET DESCRIPTOR Request STRING

Frame 3507: 36 bytes on wire (288 bits), 36 bytes captured (288 bits) on interface \\.\USBPcap1, id 0
    Section number: 1
    Interface id: 0 (\\.\USBPcap1)
        Interface name: \\.\USBPcap1
        Interface description: USBPcap1
    Encapsulation type: USB packets with USBPcap header (152)
    Arrival Time: Jun 22, 2025 18:49:57.665688000 Central Europe Daylight Time
    UTC Arrival Time: Jun 22, 2025 16:49:57.665688000 UTC
    Epoch Arrival Time: 1750610997.665688000
    [Time shift for this packet: 0.000000000 seconds]
    [Time delta from previous captured frame: 0.000006000 seconds]
    [Time delta from previous displayed frame: 0.000006000 seconds]
    [Time since reference or first frame: 2.654705000 seconds]
    Frame Number: 3507
    Frame Length: 36 bytes (288 bits)
    Capture Length: 36 bytes (288 bits)
    [Frame is marked: False]
    [Frame is ignored: False]
    [Protocols in frame: usb]
USB URB
    [Source: host]
    [Destination: 1.9.0]
    USBPcap pseudoheader length: 28
    IRP ID: 0xffffde073ea70560
    IRP USBD_STATUS: Unknown (0xffffde07)
    URB Function: URB_FUNCTION_GET_DESCRIPTOR_FROM_DEVICE (0x000b)
    IRP information: 0x00, Direction: FDO -> PDO
        0000 000. = Reserved: 0x00
        .... ...0 = Direction: FDO -> PDO (0x0)
    URB bus id: 1
    Device address: 9
    Endpoint: 0x80, Direction: IN
        1... .... = Direction: IN (1)
        .... 0000 = Endpoint number: 0
    URB transfer type: URB_CONTROL (0x02)
    Packet Data Length: 8
    [Response in: 3508]
    Control transfer stage: Setup (0)
Setup Data
    bmRequestType: 0x80
        1... .... = Direction: Device-to-host
        .00. .... = Type: Standard (0x0)
        ...0 0000 = Recipient: Device (0x00)
    bRequest: GET DESCRIPTOR (6)
    Descriptor Index: 0x01
    bDescriptorType: STRING (0x03)
    Language Id: no language specified (0x0000)
    wLength: 514

No.     Time           Source                Destination           Protocol Length Info
   3508 2.654818       1.9.0                 host                  USB      42     GET DESCRIPTOR Response STRING

Frame 3508: 42 bytes on wire (336 bits), 42 bytes captured (336 bits) on interface \\.\USBPcap1, id 0
    Section number: 1
    Interface id: 0 (\\.\USBPcap1)
        Interface name: \\.\USBPcap1
        Interface description: USBPcap1
    Encapsulation type: USB packets with USBPcap header (152)
    Arrival Time: Jun 22, 2025 18:49:57.665801000 Central Europe Daylight Time
    UTC Arrival Time: Jun 22, 2025 16:49:57.665801000 UTC
    Epoch Arrival Time: 1750610997.665801000
    [Time shift for this packet: 0.000000000 seconds]
    [Time delta from previous captured frame: 0.000113000 seconds]
    [Time delta from previous displayed frame: 0.000113000 seconds]
    [Time since reference or first frame: 2.654818000 seconds]
    Frame Number: 3508
    Frame Length: 42 bytes (336 bits)
    Capture Length: 42 bytes (336 bits)
    [Frame is marked: False]
    [Frame is ignored: False]
    [Protocols in frame: usb]
USB URB
    [Source: 1.9.0]
    [Destination: host]
    USBPcap pseudoheader length: 28
    IRP ID: 0xffffde073ea70560
    IRP USBD_STATUS: USBD_STATUS_SUCCESS (0x00000000)
    URB Function: URB_FUNCTION_CONTROL_TRANSFER (0x0008)
    IRP information: 0x01, Direction: PDO -> FDO
        0000 000. = Reserved: 0x00
        .... ...1 = Direction: PDO -> FDO (0x1)
    URB bus id: 1
    Device address: 9
    Endpoint: 0x80, Direction: IN
        1... .... = Direction: IN (1)
        .... 0000 = Endpoint number: 0
    URB transfer type: URB_CONTROL (0x02)
    Packet Data Length: 14
    [Request in: 3507]
    [Time from request: 0.000113000 seconds]
    Control transfer stage: Complete (3)
STRING DESCRIPTOR
    bLength: 14
    bDescriptorType: 0x03 (STRING)
    bString: TASCAM

No.     Time           Source                Destination           Protocol Length Info
   3509 2.654832       host                  1.9.0                 USB      36     GET DESCRIPTOR Request STRING

Frame 3509: 36 bytes on wire (288 bits), 36 bytes captured (288 bits) on interface \\.\USBPcap1, id 0
    Section number: 1
    Interface id: 0 (\\.\USBPcap1)
        Interface name: \\.\USBPcap1
        Interface description: USBPcap1
    Encapsulation type: USB packets with USBPcap header (152)
    Arrival Time: Jun 22, 2025 18:49:57.665815000 Central Europe Daylight Time
    UTC Arrival Time: Jun 22, 2025 16:49:57.665815000 UTC
    Epoch Arrival Time: 1750610997.665815000
    [Time shift for this packet: 0.000000000 seconds]
    [Time delta from previous captured frame: 0.000014000 seconds]
    [Time delta from previous displayed frame: 0.000014000 seconds]
    [Time since reference or first frame: 2.654832000 seconds]
    Frame Number: 3509
    Frame Length: 36 bytes (288 bits)
    Capture Length: 36 bytes (288 bits)
    [Frame is marked: False]
    [Frame is ignored: False]
    [Protocols in frame: usb]
USB URB
    [Source: host]
    [Destination: 1.9.0]
    USBPcap pseudoheader length: 28
    IRP ID: 0xffffde07304f09f0
    IRP USBD_STATUS: USBD_STATUS_SUCCESS (0x00000000)
    URB Function: URB_FUNCTION_GET_DESCRIPTOR_FROM_DEVICE (0x000b)
    IRP information: 0x00, Direction: FDO -> PDO
        0000 000. = Reserved: 0x00
        .... ...0 = Direction: FDO -> PDO (0x0)
    URB bus id: 1
    Device address: 9
    Endpoint: 0x80, Direction: IN
        1... .... = Direction: IN (1)
        .... 0000 = Endpoint number: 0
    URB transfer type: URB_CONTROL (0x02)
    Packet Data Length: 8
    [Response in: 3510]
    Control transfer stage: Setup (0)
Setup Data
    bmRequestType: 0x80
        1... .... = Direction: Device-to-host
        .00. .... = Type: Standard (0x0)
        ...0 0000 = Recipient: Device (0x00)
    bRequest: GET DESCRIPTOR (6)
    Descriptor Index: 0x02
    bDescriptorType: STRING (0x03)
    Language Id: no language specified (0x0000)
    wLength: 514

No.     Time           Source                Destination           Protocol Length Info
   3510 2.654981       1.9.0                 host                  USB      52     GET DESCRIPTOR Response STRING

Frame 3510: 52 bytes on wire (416 bits), 52 bytes captured (416 bits) on interface \\.\USBPcap1, id 0
    Section number: 1
    Interface id: 0 (\\.\USBPcap1)
        Interface name: \\.\USBPcap1
        Interface description: USBPcap1
    Encapsulation type: USB packets with USBPcap header (152)
    Arrival Time: Jun 22, 2025 18:49:57.665964000 Central Europe Daylight Time
    UTC Arrival Time: Jun 22, 2025 16:49:57.665964000 UTC
    Epoch Arrival Time: 1750610997.665964000
    [Time shift for this packet: 0.000000000 seconds]
    [Time delta from previous captured frame: 0.000149000 seconds]
    [Time delta from previous displayed frame: 0.000149000 seconds]
    [Time since reference or first frame: 2.654981000 seconds]
    Frame Number: 3510
    Frame Length: 52 bytes (416 bits)
    Capture Length: 52 bytes (416 bits)
    [Frame is marked: False]
    [Frame is ignored: False]
    [Protocols in frame: usb]
USB URB
    [Source: 1.9.0]
    [Destination: host]
    USBPcap pseudoheader length: 28
    IRP ID: 0xffffde07304f09f0
    IRP USBD_STATUS: USBD_STATUS_SUCCESS (0x00000000)
    URB Function: URB_FUNCTION_CONTROL_TRANSFER (0x0008)
    IRP information: 0x01, Direction: PDO -> FDO
        0000 000. = Reserved: 0x00
        .... ...1 = Direction: PDO -> FDO (0x1)
    URB bus id: 1
    Device address: 9
    Endpoint: 0x80, Direction: IN
        1... .... = Direction: IN (1)
        .... 0000 = Endpoint number: 0
    URB transfer type: URB_CONTROL (0x02)
    Packet Data Length: 24
    [Request in: 3509]
    [Time from request: 0.000149000 seconds]
    Control transfer stage: Complete (3)
STRING DESCRIPTOR
    bLength: 24
    bDescriptorType: 0x03 (STRING)
    bString: US-144 MKII

No.     Time           Source                Destination           Protocol Length Info
   3511 2.654989       host                  1.9.0                 USB      36     GET DESCRIPTOR Request STRING

Frame 3511: 36 bytes on wire (288 bits), 36 bytes captured (288 bits) on interface \\.\USBPcap1, id 0
    Section number: 1
    Interface id: 0 (\\.\USBPcap1)
        Interface name: \\.\USBPcap1
        Interface description: USBPcap1
    Encapsulation type: USB packets with USBPcap header (152)
    Arrival Time: Jun 22, 2025 18:49:57.665972000 Central Europe Daylight Time
    UTC Arrival Time: Jun 22, 2025 16:49:57.665972000 UTC
    Epoch Arrival Time: 1750610997.665972000
    [Time shift for this packet: 0.000000000 seconds]
    [Time delta from previous captured frame: 0.000008000 seconds]
    [Time delta from previous displayed frame: 0.000008000 seconds]
    [Time since reference or first frame: 2.654989000 seconds]
    Frame Number: 3511
    Frame Length: 36 bytes (288 bits)
    Capture Length: 36 bytes (288 bits)
    [Frame is marked: False]
    [Frame is ignored: False]
    [Protocols in frame: usb]
USB URB
    [Source: host]
    [Destination: 1.9.0]
    USBPcap pseudoheader length: 28
    IRP ID: 0xffffde073ea70560
    IRP USBD_STATUS: USBD_STATUS_SUCCESS (0x00000000)
    URB Function: URB_FUNCTION_GET_DESCRIPTOR_FROM_DEVICE (0x000b)
    IRP information: 0x00, Direction: FDO -> PDO
        0000 000. = Reserved: 0x00
        .... ...0 = Direction: FDO -> PDO (0x0)
    URB bus id: 1
    Device address: 9
    Endpoint: 0x80, Direction: IN
        1... .... = Direction: IN (1)
        .... 0000 = Endpoint number: 0
    URB transfer type: URB_CONTROL (0x02)
    Packet Data Length: 8
    [Response in: 3512]
    Control transfer stage: Setup (0)
Setup Data
    bmRequestType: 0x80
        1... .... = Direction: Device-to-host
        .00. .... = Type: Standard (0x0)
        ...0 0000 = Recipient: Device (0x00)
    bRequest: GET DESCRIPTOR (6)
    Descriptor Index: 0x03
    bDescriptorType: STRING (0x03)
    Language Id: no language specified (0x0000)
    wLength: 514

No.     Time           Source                Destination           Protocol Length Info
   3512 2.655127       1.9.0                 host                  USB      62     GET DESCRIPTOR Response STRING

Frame 3512: 62 bytes on wire (496 bits), 62 bytes captured (496 bits) on interface \\.\USBPcap1, id 0
    Section number: 1
    Interface id: 0 (\\.\USBPcap1)
        Interface name: \\.\USBPcap1
        Interface description: USBPcap1
    Encapsulation type: USB packets with USBPcap header (152)
    Arrival Time: Jun 22, 2025 18:49:57.666110000 Central Europe Daylight Time
    UTC Arrival Time: Jun 22, 2025 16:49:57.666110000 UTC
    Epoch Arrival Time: 1750610997.666110000
    [Time shift for this packet: 0.000000000 seconds]
    [Time delta from previous captured frame: 0.000138000 seconds]
    [Time delta from previous displayed frame: 0.000138000 seconds]
    [Time since reference or first frame: 2.655127000 seconds]
    Frame Number: 3512
    Frame Length: 62 bytes (496 bits)
    Capture Length: 62 bytes (496 bits)
    [Frame is marked: False]
    [Frame is ignored: False]
    [Protocols in frame: usb]
USB URB
    [Source: 1.9.0]
    [Destination: host]
    USBPcap pseudoheader length: 28
    IRP ID: 0xffffde073ea70560
    IRP USBD_STATUS: USBD_STATUS_SUCCESS (0x00000000)
    URB Function: URB_FUNCTION_CONTROL_TRANSFER (0x0008)
    IRP information: 0x01, Direction: PDO -> FDO
        0000 000. = Reserved: 0x00
        .... ...1 = Direction: PDO -> FDO (0x1)
    URB bus id: 1
    Device address: 9
    Endpoint: 0x80, Direction: IN
        1... .... = Direction: IN (1)
        .... 0000 = Endpoint number: 0
    URB transfer type: URB_CONTROL (0x02)
    Packet Data Length: 34
    [Request in: 3511]
    [Time from request: 0.000138000 seconds]
    Control transfer stage: Complete (3)
STRING DESCRIPTOR
    bLength: 34
    bDescriptorType: 0x03 (STRING)
    bString: no serial number

No.     Time           Source                Destination           Protocol Length Info
   3513 2.655135       host                  1.9.0                 USB      36     GET DESCRIPTOR Request CONFIGURATION

Frame 3513: 36 bytes on wire (288 bits), 36 bytes captured (288 bits) on interface \\.\USBPcap1, id 0
    Section number: 1
    Interface id: 0 (\\.\USBPcap1)
        Interface name: \\.\USBPcap1
        Interface description: USBPcap1
    Encapsulation type: USB packets with USBPcap header (152)
    Arrival Time: Jun 22, 2025 18:49:57.666118000 Central Europe Daylight Time
    UTC Arrival Time: Jun 22, 2025 16:49:57.666118000 UTC
    Epoch Arrival Time: 1750610997.666118000
    [Time shift for this packet: 0.000000000 seconds]
    [Time delta from previous captured frame: 0.000008000 seconds]
    [Time delta from previous displayed frame: 0.000008000 seconds]
    [Time since reference or first frame: 2.655135000 seconds]
    Frame Number: 3513
    Frame Length: 36 bytes (288 bits)
    Capture Length: 36 bytes (288 bits)
    [Frame is marked: False]
    [Frame is ignored: False]
    [Protocols in frame: usb]
USB URB
    [Source: host]
    [Destination: 1.9.0]
    USBPcap pseudoheader length: 28
    IRP ID: 0xffffde073ea70560
    IRP USBD_STATUS: USBD_STATUS_SUCCESS (0x00000000)
    URB Function: URB_FUNCTION_GET_DESCRIPTOR_FROM_DEVICE (0x000b)
    IRP information: 0x00, Direction: FDO -> PDO
        0000 000. = Reserved: 0x00
        .... ...0 = Direction: FDO -> PDO (0x0)
    URB bus id: 1
    Device address: 9
    Endpoint: 0x80, Direction: IN
        1... .... = Direction: IN (1)
        .... 0000 = Endpoint number: 0
    URB transfer type: URB_CONTROL (0x02)
    Packet Data Length: 8
    [Response in: 3514]
    Control transfer stage: Setup (0)
Setup Data
    bmRequestType: 0x80
        1... .... = Direction: Device-to-host
        .00. .... = Type: Standard (0x0)
        ...0 0000 = Recipient: Device (0x00)
    bRequest: GET DESCRIPTOR (6)
    Descriptor Index: 0x00
    bDescriptorType: CONFIGURATION (0x02)
    Language Id: no language specified (0x0000)
    wLength: 1033

No.     Time           Source                Destination           Protocol Length Info
   3514 2.655400       1.9.0                 host                  USB      108    GET DESCRIPTOR Response CONFIGURATION

Frame 3514: 108 bytes on wire (864 bits), 108 bytes captured (864 bits) on interface \\.\USBPcap1, id 0
    Section number: 1
    Interface id: 0 (\\.\USBPcap1)
        Interface name: \\.\USBPcap1
        Interface description: USBPcap1
    Encapsulation type: USB packets with USBPcap header (152)
    Arrival Time: Jun 22, 2025 18:49:57.666383000 Central Europe Daylight Time
    UTC Arrival Time: Jun 22, 2025 16:49:57.666383000 UTC
    Epoch Arrival Time: 1750610997.666383000
    [Time shift for this packet: 0.000000000 seconds]
    [Time delta from previous captured frame: 0.000265000 seconds]
    [Time delta from previous displayed frame: 0.000265000 seconds]
    [Time since reference or first frame: 2.655400000 seconds]
    Frame Number: 3514
    Frame Length: 108 bytes (864 bits)
    Capture Length: 108 bytes (864 bits)
    [Frame is marked: False]
    [Frame is ignored: False]
    [Protocols in frame: usb]
USB URB
    [Source: 1.9.0]
    [Destination: host]
    USBPcap pseudoheader length: 28
    IRP ID: 0xffffde073ea70560
    IRP USBD_STATUS: USBD_STATUS_SUCCESS (0x00000000)
    URB Function: URB_FUNCTION_CONTROL_TRANSFER (0x0008)
    IRP information: 0x01, Direction: PDO -> FDO
        0000 000. = Reserved: 0x00
        .... ...1 = Direction: PDO -> FDO (0x1)
    URB bus id: 1
    Device address: 9
    Endpoint: 0x80, Direction: IN
        1... .... = Direction: IN (1)
        .... 0000 = Endpoint number: 0
    URB transfer type: URB_CONTROL (0x02)
    Packet Data Length: 80
    [Request in: 3513]
    [Time from request: 0.000265000 seconds]
    Control transfer stage: Complete (3)
CONFIGURATION DESCRIPTOR
    bLength: 9
    bDescriptorType: 0x02 (CONFIGURATION)
    wTotalLength: 80
    bNumInterfaces: 2
    bConfigurationValue: 1
    iConfiguration: 0
    Configuration bmAttributes: 0x80  NOT SELF-POWERED  NO REMOTE-WAKEUP
        1... .... = Must be 1: Must be 1 for USB 1.1 and higher
        .0.. .... = Self-Powered: This device is powered from the USB bus
        ..0. .... = Remote Wakeup: This device does NOT support remote wakeup
    bMaxPower: 240  (480mA)
INTERFACE DESCRIPTOR (0.0): class Vendor Specific
    bLength: 9
    bDescriptorType: 0x04 (INTERFACE)
    bInterfaceNumber: 0
    bAlternateSetting: 0
    bNumEndpoints: 0
    bInterfaceClass: Vendor Specific (0xff)
    bInterfaceSubClass: 0x00
    bInterfaceProtocol: 0x00
    iInterface: 0
INTERFACE DESCRIPTOR (0.1): class Vendor Specific
    bLength: 9
    bDescriptorType: 0x04 (INTERFACE)
    bInterfaceNumber: 0
    bAlternateSetting: 1
    bNumEndpoints: 3
    bInterfaceClass: Vendor Specific (0xff)
    bInterfaceSubClass: 0x00
    bInterfaceProtocol: 0x00
    iInterface: 0
ENDPOINT DESCRIPTOR
    bLength: 7
    bDescriptorType: 0x05 (ENDPOINT)
    bEndpointAddress: 0x02  OUT  Endpoint:2
        0... .... = Direction: OUT Endpoint
        .... 0010 = Endpoint Number: 0x2
    bmAttributes: 0x05
        .... ..01 = Transfertype: Isochronous-Transfer (0x1)
        .... 01.. = Synchronisationtype: Asynchronous (0x1)
        ..00 .... = Behaviourtype: Data-Endpoint (0x0)
    wMaxPacketSize: 156
        ...0 0... .... .... = Transactions per microframe: 1 (0)
        .... .000 1001 1100 = Maximum Packet Size: 156
    bInterval: 1
ENDPOINT DESCRIPTOR
    bLength: 7
    bDescriptorType: 0x05 (ENDPOINT)
    bEndpointAddress: 0x83  IN  Endpoint:3
        1... .... = Direction: IN Endpoint
        .... 0011 = Endpoint Number: 0x3
    bmAttributes: 0x02
        .... ..10 = Transfertype: Bulk-Transfer (0x2)
    wMaxPacketSize: 512
        .... .010 0000 0000 = Maximum Packet Size: 512
    bInterval: 4
ENDPOINT DESCRIPTOR
    bLength: 7
    bDescriptorType: 0x05 (ENDPOINT)
    bEndpointAddress: 0x04  OUT  Endpoint:4
        0... .... = Direction: OUT Endpoint
        .... 0100 = Endpoint Number: 0x4
    bmAttributes: 0x02
        .... ..10 = Transfertype: Bulk-Transfer (0x2)
    wMaxPacketSize: 512
        .... .010 0000 0000 = Maximum Packet Size: 512
    bInterval: 4
INTERFACE DESCRIPTOR (1.0): class Vendor Specific
    bLength: 9
    bDescriptorType: 0x04 (INTERFACE)
    bInterfaceNumber: 1
    bAlternateSetting: 0
    bNumEndpoints: 0
    bInterfaceClass: Vendor Specific (0xff)
    bInterfaceSubClass: 0x00
    bInterfaceProtocol: 0x00
    iInterface: 0
INTERFACE DESCRIPTOR (1.1): class Vendor Specific
    bLength: 9
    bDescriptorType: 0x04 (INTERFACE)
    bInterfaceNumber: 1
    bAlternateSetting: 1
    bNumEndpoints: 2
    bInterfaceClass: Vendor Specific (0xff)
    bInterfaceSubClass: 0x00
    bInterfaceProtocol: 0x00
    iInterface: 0
ENDPOINT DESCRIPTOR
    bLength: 7
    bDescriptorType: 0x05 (ENDPOINT)
    bEndpointAddress: 0x81  IN  Endpoint:1
        1... .... = Direction: IN Endpoint
        .... 0001 = Endpoint Number: 0x1
    bmAttributes: 0x05
        .... ..01 = Transfertype: Isochronous-Transfer (0x1)
        .... 01.. = Synchronisationtype: Asynchronous (0x1)
        ..00 .... = Behaviourtype: Data-Endpoint (0x0)
    wMaxPacketSize: 64
        ...0 0... .... .... = Transactions per microframe: 1 (0)
        .... .000 0100 0000 = Maximum Packet Size: 64
    bInterval: 4
ENDPOINT DESCRIPTOR
    bLength: 7
    bDescriptorType: 0x05 (ENDPOINT)
    bEndpointAddress: 0x86  IN  Endpoint:6
        1... .... = Direction: IN Endpoint
        .... 0110 = Endpoint Number: 0x6
    bmAttributes: 0x02
        .... ..10 = Transfertype: Bulk-Transfer (0x2)
    wMaxPacketSize: 512
        .... .010 0000 0000 = Maximum Packet Size: 512
    bInterval: 1

No.     Time           Source                Destination           Protocol Length Info
   3515 2.659038       host                  1.9.0                 USB      36     GET DESCRIPTOR Request DEVICE

Frame 3515: 36 bytes on wire (288 bits), 36 bytes captured (288 bits) on interface \\.\USBPcap1, id 0
    Section number: 1
    Interface id: 0 (\\.\USBPcap1)
        Interface name: \\.\USBPcap1
        Interface description: USBPcap1
    Encapsulation type: USB packets with USBPcap header (152)
    Arrival Time: Jun 22, 2025 18:49:57.670021000 Central Europe Daylight Time
    UTC Arrival Time: Jun 22, 2025 16:49:57.670021000 UTC
    Epoch Arrival Time: 1750610997.670021000
    [Time shift for this packet: 0.000000000 seconds]
    [Time delta from previous captured frame: 0.003638000 seconds]
    [Time delta from previous displayed frame: 0.003638000 seconds]
    [Time since reference or first frame: 2.659038000 seconds]
    Frame Number: 3515
    Frame Length: 36 bytes (288 bits)
    Capture Length: 36 bytes (288 bits)
    [Frame is marked: False]
    [Frame is ignored: False]
    [Protocols in frame: usb]
USB URB
    [Source: host]
    [Destination: 1.9.0]
    USBPcap pseudoheader length: 28
    IRP ID: 0xffffde073ea70560
    IRP USBD_STATUS: USBD_STATUS_SUCCESS (0x00000000)
    URB Function: URB_FUNCTION_GET_DESCRIPTOR_FROM_DEVICE (0x000b)
    IRP information: 0x00, Direction: FDO -> PDO
        0000 000. = Reserved: 0x00
        .... ...0 = Direction: FDO -> PDO (0x0)
    URB bus id: 1
    Device address: 9
    Endpoint: 0x80, Direction: IN
        1... .... = Direction: IN (1)
        .... 0000 = Endpoint number: 0
    URB transfer type: URB_CONTROL (0x02)
    Packet Data Length: 8
    [Response in: 3516]
    Control transfer stage: Setup (0)
Setup Data
    bmRequestType: 0x80
        1... .... = Direction: Device-to-host
        .00. .... = Type: Standard (0x0)
        ...0 0000 = Recipient: Device (0x00)
    bRequest: GET DESCRIPTOR (6)
    Descriptor Index: 0x00
    bDescriptorType: DEVICE (0x01)
    Language Id: no language specified (0x0000)
    wLength: 18

No.     Time           Source                Destination           Protocol Length Info
   3516 2.659190       1.9.0                 host                  USB      46     GET DESCRIPTOR Response DEVICE

Frame 3516: 46 bytes on wire (368 bits), 46 bytes captured (368 bits) on interface \\.\USBPcap1, id 0
    Section number: 1
    Interface id: 0 (\\.\USBPcap1)
        Interface name: \\.\USBPcap1
        Interface description: USBPcap1
    Encapsulation type: USB packets with USBPcap header (152)
    Arrival Time: Jun 22, 2025 18:49:57.670173000 Central Europe Daylight Time
    UTC Arrival Time: Jun 22, 2025 16:49:57.670173000 UTC
    Epoch Arrival Time: 1750610997.670173000
    [Time shift for this packet: 0.000000000 seconds]
    [Time delta from previous captured frame: 0.000152000 seconds]
    [Time delta from previous displayed frame: 0.000152000 seconds]
    [Time since reference or first frame: 2.659190000 seconds]
    Frame Number: 3516
    Frame Length: 46 bytes (368 bits)
    Capture Length: 46 bytes (368 bits)
    [Frame is marked: False]
    [Frame is ignored: False]
    [Protocols in frame: usb]
USB URB
    [Source: 1.9.0]
    [Destination: host]
    USBPcap pseudoheader length: 28
    IRP ID: 0xffffde073ea70560
    IRP USBD_STATUS: USBD_STATUS_SUCCESS (0x00000000)
    URB Function: URB_FUNCTION_CONTROL_TRANSFER (0x0008)
    IRP information: 0x01, Direction: PDO -> FDO
        0000 000. = Reserved: 0x00
        .... ...1 = Direction: PDO -> FDO (0x1)
    URB bus id: 1
    Device address: 9
    Endpoint: 0x80, Direction: IN
        1... .... = Direction: IN (1)
        .... 0000 = Endpoint number: 0
    URB transfer type: URB_CONTROL (0x02)
    Packet Data Length: 18
    [Request in: 3515]
    [Time from request: 0.000152000 seconds]
    Control transfer stage: Complete (3)
DEVICE DESCRIPTOR
    bLength: 18
    bDescriptorType: 0x01 (DEVICE)
    bcdUSB: 0x0200
    bDeviceClass: Vendor Specific (0xff)
    bDeviceSubClass: 255
    bDeviceProtocol: 255
    bMaxPacketSize0: 64
    idVendor: TEAC Corp. (0x0644)
    idProduct: Unknown (0x8020)
    bcdDevice: 0x0100
    iManufacturer: 1
    iProduct: 2
    iSerialNumber: 3
    bNumConfigurations: 1

No.     Time           Source                Destination           Protocol Length Info
   3517 2.659206       host                  1.9.0                 USB      36     SET CONFIGURATION Request

Frame 3517: 36 bytes on wire (288 bits), 36 bytes captured (288 bits) on interface \\.\USBPcap1, id 0
    Section number: 1
    Interface id: 0 (\\.\USBPcap1)
        Interface name: \\.\USBPcap1
        Interface description: USBPcap1
    Encapsulation type: USB packets with USBPcap header (152)
    Arrival Time: Jun 22, 2025 18:49:57.670189000 Central Europe Daylight Time
    UTC Arrival Time: Jun 22, 2025 16:49:57.670189000 UTC
    Epoch Arrival Time: 1750610997.670189000
    [Time shift for this packet: 0.000000000 seconds]
    [Time delta from previous captured frame: 0.000016000 seconds]
    [Time delta from previous displayed frame: 0.000016000 seconds]
    [Time since reference or first frame: 2.659206000 seconds]
    Frame Number: 3517
    Frame Length: 36 bytes (288 bits)
    Capture Length: 36 bytes (288 bits)
    [Frame is marked: False]
    [Frame is ignored: False]
    [Protocols in frame: usb]
USB URB
    [Source: host]
    [Destination: 1.9.0]
    USBPcap pseudoheader length: 28
    IRP ID: 0xffffde073ea70560
    IRP USBD_STATUS: USBD_STATUS_SUCCESS (0x00000000)
    URB Function: URB_FUNCTION_SELECT_CONFIGURATION (0x0000)
    IRP information: 0x00, Direction: FDO -> PDO
        0000 000. = Reserved: 0x00
        .... ...0 = Direction: FDO -> PDO (0x0)
    URB bus id: 1
    Device address: 9
    Endpoint: 0x00, Direction: OUT
        0... .... = Direction: OUT (0)
        .... 0000 = Endpoint number: 0
    URB transfer type: URB_CONTROL (0x02)
    Packet Data Length: 8
    [Response in: 3518]
    Control transfer stage: Setup (0)
Setup Data
    bmRequestType: 0x00
        0... .... = Direction: Host-to-device
        .00. .... = Type: Standard (0x0)
        ...0 0000 = Recipient: Device (0x00)
    bRequest: SET CONFIGURATION (9)
    bConfigurationValue: 1
    wIndex: 0 (0x0000)
    wLength: 0

No.     Time           Source                Destination           Protocol Length Info
   3518 2.869636       1.9.0                 host                  USB      28     SET CONFIGURATION Response

Frame 3518: 28 bytes on wire (224 bits), 28 bytes captured (224 bits) on interface \\.\USBPcap1, id 0
    Section number: 1
    Interface id: 0 (\\.\USBPcap1)
        Interface name: \\.\USBPcap1
        Interface description: USBPcap1
    Encapsulation type: USB packets with USBPcap header (152)
    Arrival Time: Jun 22, 2025 18:49:57.880619000 Central Europe Daylight Time
    UTC Arrival Time: Jun 22, 2025 16:49:57.880619000 UTC
    Epoch Arrival Time: 1750610997.880619000
    [Time shift for this packet: 0.000000000 seconds]
    [Time delta from previous captured frame: 0.210430000 seconds]
    [Time delta from previous displayed frame: 0.210430000 seconds]
    [Time since reference or first frame: 2.869636000 seconds]
    Frame Number: 3518
    Frame Length: 28 bytes (224 bits)
    Capture Length: 28 bytes (224 bits)
    [Frame is marked: False]
    [Frame is ignored: False]
    [Protocols in frame: usb]
USB URB
    [Source: 1.9.0]
    [Destination: host]
    USBPcap pseudoheader length: 28
    IRP ID: 0xffffde073ea70560
    IRP USBD_STATUS: USBD_STATUS_SUCCESS (0x00000000)
    URB Function: URB_FUNCTION_SELECT_CONFIGURATION (0x0000)
    IRP information: 0x01, Direction: PDO -> FDO
        0000 000. = Reserved: 0x00
        .... ...1 = Direction: PDO -> FDO (0x1)
    URB bus id: 1
    Device address: 9
    Endpoint: 0x00, Direction: OUT
        0... .... = Direction: OUT (0)
        .... 0000 = Endpoint number: 0
    URB transfer type: URB_CONTROL (0x02)
    Packet Data Length: 0
    [Request in: 3517]
    [Time from request: 0.210430000 seconds]
    Control transfer stage: Complete (3)

No.     Time           Source                Destination           Protocol Length Info
   3519 2.920359       host                  1.9.0                 USB      36     URB_CONTROL in

Frame 3519: 36 bytes on wire (288 bits), 36 bytes captured (288 bits) on interface \\.\USBPcap1, id 0
    Section number: 1
    Interface id: 0 (\\.\USBPcap1)
        Interface name: \\.\USBPcap1
        Interface description: USBPcap1
    Encapsulation type: USB packets with USBPcap header (152)
    Arrival Time: Jun 22, 2025 18:49:57.931342000 Central Europe Daylight Time
    UTC Arrival Time: Jun 22, 2025 16:49:57.931342000 UTC
    Epoch Arrival Time: 1750610997.931342000
    [Time shift for this packet: 0.000000000 seconds]
    [Time delta from previous captured frame: 0.050723000 seconds]
    [Time delta from previous displayed frame: 0.050723000 seconds]
    [Time since reference or first frame: 2.920359000 seconds]
    Frame Number: 3519
    Frame Length: 36 bytes (288 bits)
    Capture Length: 36 bytes (288 bits)
    [Frame is marked: False]
    [Frame is ignored: False]
    [Protocols in frame: usb]
USB URB
    [Source: host]
    [Destination: 1.9.0]
    USBPcap pseudoheader length: 28
    IRP ID: 0xffffde073ea70560
    IRP USBD_STATUS: USBD_STATUS_SUCCESS (0x00000000)
    URB Function: URB_FUNCTION_VENDOR_DEVICE (0x0017)
    IRP information: 0x00, Direction: FDO -> PDO
        0000 000. = Reserved: 0x00
        .... ...0 = Direction: FDO -> PDO (0x0)
    URB bus id: 1
    Device address: 9
    Endpoint: 0x80, Direction: IN
        1... .... = Direction: IN (1)
        .... 0000 = Endpoint number: 0
    URB transfer type: URB_CONTROL (0x02)
    Packet Data Length: 8
    [Response in: 3520]
    Control transfer stage: Setup (0)
    [bInterfaceClass: Unknown (0xffff)]
Setup Data
    bmRequestType: 0xc0
        1... .... = Direction: Device-to-host
        .10. .... = Type: Vendor (0x2)
        ...0 0000 = Recipient: Device (0x00)
    bRequest: 73
    wValue: 0x0000
    wIndex: 0 (0x0000)
    wLength: 1

No.     Time           Source                Destination           Protocol Length Info
   3520 2.920575       1.9.0                 host                  USB      29     URB_CONTROL in

Frame 3520: 29 bytes on wire (232 bits), 29 bytes captured (232 bits) on interface \\.\USBPcap1, id 0
    Section number: 1
    Interface id: 0 (\\.\USBPcap1)
        Interface name: \\.\USBPcap1
        Interface description: USBPcap1
    Encapsulation type: USB packets with USBPcap header (152)
    Arrival Time: Jun 22, 2025 18:49:57.931558000 Central Europe Daylight Time
    UTC Arrival Time: Jun 22, 2025 16:49:57.931558000 UTC
    Epoch Arrival Time: 1750610997.931558000
    [Time shift for this packet: 0.000000000 seconds]
    [Time delta from previous captured frame: 0.000216000 seconds]
    [Time delta from previous displayed frame: 0.000216000 seconds]
    [Time since reference or first frame: 2.920575000 seconds]
    Frame Number: 3520
    Frame Length: 29 bytes (232 bits)
    Capture Length: 29 bytes (232 bits)
    [Frame is marked: False]
    [Frame is ignored: False]
    [Protocols in frame: usb]
USB URB
    [Source: 1.9.0]
    [Destination: host]
    USBPcap pseudoheader length: 28
    IRP ID: 0xffffde073ea70560
    IRP USBD_STATUS: USBD_STATUS_SUCCESS (0x00000000)
    URB Function: URB_FUNCTION_CONTROL_TRANSFER (0x0008)
    IRP information: 0x01, Direction: PDO -> FDO
        0000 000. = Reserved: 0x00
        .... ...1 = Direction: PDO -> FDO (0x1)
    URB bus id: 1
    Device address: 9
    Endpoint: 0x80, Direction: IN
        1... .... = Direction: IN (1)
        .... 0000 = Endpoint number: 0
    URB transfer type: URB_CONTROL (0x02)
    Packet Data Length: 1
    [Request in: 3519]
    [Time from request: 0.000216000 seconds]
    Control transfer stage: Complete (3)
    [bInterfaceClass: Unknown (0xffff)]
CONTROL response data: 30

No.     Time           Source                Destination           Protocol Length Info
   3521 2.920594       host                  1.9.0                 USB      36     URB_CONTROL in

Frame 3521: 36 bytes on wire (288 bits), 36 bytes captured (288 bits) on interface \\.\USBPcap1, id 0
    Section number: 1
    Interface id: 0 (\\.\USBPcap1)
        Interface name: \\.\USBPcap1
        Interface description: USBPcap1
    Encapsulation type: USB packets with USBPcap header (152)
    Arrival Time: Jun 22, 2025 18:49:57.931577000 Central Europe Daylight Time
    UTC Arrival Time: Jun 22, 2025 16:49:57.931577000 UTC
    Epoch Arrival Time: 1750610997.931577000
    [Time shift for this packet: 0.000000000 seconds]
    [Time delta from previous captured frame: 0.000019000 seconds]
    [Time delta from previous displayed frame: 0.000019000 seconds]
    [Time since reference or first frame: 2.920594000 seconds]
    Frame Number: 3521
    Frame Length: 36 bytes (288 bits)
    Capture Length: 36 bytes (288 bits)
    [Frame is marked: False]
    [Frame is ignored: False]
    [Protocols in frame: usb]
USB URB
    [Source: host]
    [Destination: 1.9.0]
    USBPcap pseudoheader length: 28
    IRP ID: 0xffffde0737545010
    IRP USBD_STATUS: USBD_STATUS_SUCCESS (0x00000000)
    URB Function: URB_FUNCTION_CLASS_ENDPOINT (0x001c)
    IRP information: 0x00, Direction: FDO -> PDO
        0000 000. = Reserved: 0x00
        .... ...0 = Direction: FDO -> PDO (0x0)
    URB bus id: 1
    Device address: 9
    Endpoint: 0x80, Direction: IN
        1... .... = Direction: IN (1)
        .... 0000 = Endpoint number: 0
    URB transfer type: URB_CONTROL (0x02)
    Packet Data Length: 8
    [Response in: 3522]
    Control transfer stage: Setup (0)
    [bInterfaceClass: Unknown (0xffff)]
Setup Data
    bmRequestType: 0xa2
        1... .... = Direction: Device-to-host
        .01. .... = Type: Class (0x1)
        ...0 0010 = Recipient: Endpoint (0x02)
    bRequest: 129
    wValue: 0x0100
    wIndex: 0 (0x0000)
    wLength: 3

No.     Time           Source                Destination           Protocol Length Info
   3522 2.920757       1.9.0                 host                  USB      31     URB_CONTROL in

Frame 3522: 31 bytes on wire (248 bits), 31 bytes captured (248 bits) on interface \\.\USBPcap1, id 0
    Section number: 1
    Interface id: 0 (\\.\USBPcap1)
        Interface name: \\.\USBPcap1
        Interface description: USBPcap1
    Encapsulation type: USB packets with USBPcap header (152)
    Arrival Time: Jun 22, 2025 18:49:57.931740000 Central Europe Daylight Time
    UTC Arrival Time: Jun 22, 2025 16:49:57.931740000 UTC
    Epoch Arrival Time: 1750610997.931740000
    [Time shift for this packet: 0.000000000 seconds]
    [Time delta from previous captured frame: 0.000163000 seconds]
    [Time delta from previous displayed frame: 0.000163000 seconds]
    [Time since reference or first frame: 2.920757000 seconds]
    Frame Number: 3522
    Frame Length: 31 bytes (248 bits)
    Capture Length: 31 bytes (248 bits)
    [Frame is marked: False]
    [Frame is ignored: False]
    [Protocols in frame: usb]
USB URB
    [Source: 1.9.0]
    [Destination: host]
    USBPcap pseudoheader length: 28
    IRP ID: 0xffffde0737545010
    IRP USBD_STATUS: USBD_STATUS_SUCCESS (0x00000000)
    URB Function: URB_FUNCTION_CONTROL_TRANSFER (0x0008)
    IRP information: 0x01, Direction: PDO -> FDO
        0000 000. = Reserved: 0x00
        .... ...1 = Direction: PDO -> FDO (0x1)
    URB bus id: 1
    Device address: 9
    Endpoint: 0x80, Direction: IN
        1... .... = Direction: IN (1)
        .... 0000 = Endpoint number: 0
    URB transfer type: URB_CONTROL (0x02)
    Packet Data Length: 3
    [Request in: 3521]
    [Time from request: 0.000163000 seconds]
    Control transfer stage: Complete (3)
    [bInterfaceClass: Unknown (0xffff)]
CONTROL response data: 80bb00

No.     Time           Source                Destination           Protocol Length Info
   3523 2.925724       host                  1.9.0                 USB      39     URB_CONTROL out

Frame 3523: 39 bytes on wire (312 bits), 39 bytes captured (312 bits) on interface \\.\USBPcap1, id 0
    Section number: 1
    Interface id: 0 (\\.\USBPcap1)
        Interface name: \\.\USBPcap1
        Interface description: USBPcap1
    Encapsulation type: USB packets with USBPcap header (152)
    Arrival Time: Jun 22, 2025 18:49:57.936707000 Central Europe Daylight Time
    UTC Arrival Time: Jun 22, 2025 16:49:57.936707000 UTC
    Epoch Arrival Time: 1750610997.936707000
    [Time shift for this packet: 0.000000000 seconds]
    [Time delta from previous captured frame: 0.004967000 seconds]
    [Time delta from previous displayed frame: 0.004967000 seconds]
    [Time since reference or first frame: 2.925724000 seconds]
    Frame Number: 3523
    Frame Length: 39 bytes (312 bits)
    Capture Length: 39 bytes (312 bits)
    [Frame is marked: False]
    [Frame is ignored: False]
    [Protocols in frame: usb]
USB URB
    [Source: host]
    [Destination: 1.9.0]
    USBPcap pseudoheader length: 28
    IRP ID: 0xffffde0737545010
    IRP USBD_STATUS: USBD_STATUS_SUCCESS (0x00000000)
    URB Function: URB_FUNCTION_CLASS_ENDPOINT (0x001c)
    IRP information: 0x00, Direction: FDO -> PDO
        0000 000. = Reserved: 0x00
        .... ...0 = Direction: FDO -> PDO (0x0)
    URB bus id: 1
    Device address: 9
    Endpoint: 0x00, Direction: OUT
        0... .... = Direction: OUT (0)
        .... 0000 = Endpoint number: 0
    URB transfer type: URB_CONTROL (0x02)
    Packet Data Length: 11
    [Response in: 3524]
    Control transfer stage: Setup (0)
    [bInterfaceClass: Vendor Specific (0xff)]
Setup Data
    bmRequestType: 0x22
        0... .... = Direction: Host-to-device
        .01. .... = Type: Class (0x1)
        ...0 0010 = Recipient: Endpoint (0x02)
    bRequest: 1
    wValue: 0x0100
    wIndex: 134 (0x0086)
    wLength: 3
    Data Fragment: 80bb00

No.     Time           Source                Destination           Protocol Length Info
   3524 2.925866       1.9.0                 host                  USB      28     URB_CONTROL out

Frame 3524: 28 bytes on wire (224 bits), 28 bytes captured (224 bits) on interface \\.\USBPcap1, id 0
    Section number: 1
    Interface id: 0 (\\.\USBPcap1)
        Interface name: \\.\USBPcap1
        Interface description: USBPcap1
    Encapsulation type: USB packets with USBPcap header (152)
    Arrival Time: Jun 22, 2025 18:49:57.936849000 Central Europe Daylight Time
    UTC Arrival Time: Jun 22, 2025 16:49:57.936849000 UTC
    Epoch Arrival Time: 1750610997.936849000
    [Time shift for this packet: 0.000000000 seconds]
    [Time delta from previous captured frame: 0.000142000 seconds]
    [Time delta from previous displayed frame: 0.000142000 seconds]
    [Time since reference or first frame: 2.925866000 seconds]
    Frame Number: 3524
    Frame Length: 28 bytes (224 bits)
    Capture Length: 28 bytes (224 bits)
    [Frame is marked: False]
    [Frame is ignored: False]
    [Protocols in frame: usb]
USB URB
    [Source: 1.9.0]
    [Destination: host]
    USBPcap pseudoheader length: 28
    IRP ID: 0xffffde0737545010
    IRP USBD_STATUS: USBD_STATUS_SUCCESS (0x00000000)
    URB Function: URB_FUNCTION_CONTROL_TRANSFER (0x0008)
    IRP information: 0x01, Direction: PDO -> FDO
        0000 000. = Reserved: 0x00
        .... ...1 = Direction: PDO -> FDO (0x1)
    URB bus id: 1
    Device address: 9
    Endpoint: 0x00, Direction: OUT
        0... .... = Direction: OUT (0)
        .... 0000 = Endpoint number: 0
    URB transfer type: URB_CONTROL (0x02)
    Packet Data Length: 0
    [Request in: 3523]
    [Time from request: 0.000142000 seconds]
    Control transfer stage: Complete (3)
    [bInterfaceClass: Vendor Specific (0xff)]

No.     Time           Source                Destination           Protocol Length Info
   3525 2.925882       host                  1.9.0                 USB      39     URB_CONTROL out

Frame 3525: 39 bytes on wire (312 bits), 39 bytes captured (312 bits) on interface \\.\USBPcap1, id 0
    Section number: 1
    Interface id: 0 (\\.\USBPcap1)
        Interface name: \\.\USBPcap1
        Interface description: USBPcap1
    Encapsulation type: USB packets with USBPcap header (152)
    Arrival Time: Jun 22, 2025 18:49:57.936865000 Central Europe Daylight Time
    UTC Arrival Time: Jun 22, 2025 16:49:57.936865000 UTC
    Epoch Arrival Time: 1750610997.936865000
    [Time shift for this packet: 0.000000000 seconds]
    [Time delta from previous captured frame: 0.000016000 seconds]
    [Time delta from previous displayed frame: 0.000016000 seconds]
    [Time since reference or first frame: 2.925882000 seconds]
    Frame Number: 3525
    Frame Length: 39 bytes (312 bits)
    Capture Length: 39 bytes (312 bits)
    [Frame is marked: False]
    [Frame is ignored: False]
    [Protocols in frame: usb]
USB URB
    [Source: host]
    [Destination: 1.9.0]
    USBPcap pseudoheader length: 28
    IRP ID: 0xffffde073ea70560
    IRP USBD_STATUS: USBD_STATUS_SUCCESS (0x00000000)
    URB Function: URB_FUNCTION_CLASS_ENDPOINT (0x001c)
    IRP information: 0x00, Direction: FDO -> PDO
        0000 000. = Reserved: 0x00
        .... ...0 = Direction: FDO -> PDO (0x0)
    URB bus id: 1
    Device address: 9
    Endpoint: 0x00, Direction: OUT
        0... .... = Direction: OUT (0)
        .... 0000 = Endpoint number: 0
    URB transfer type: URB_CONTROL (0x02)
    Packet Data Length: 11
    [Response in: 3526]
    Control transfer stage: Setup (0)
    [bInterfaceClass: Vendor Specific (0xff)]
Setup Data
    bmRequestType: 0x22
        0... .... = Direction: Host-to-device
        .01. .... = Type: Class (0x1)
        ...0 0010 = Recipient: Endpoint (0x02)
    bRequest: 1
    wValue: 0x0100
    wIndex: 2 (0x0002)
    wLength: 3
    Data Fragment: 80bb00

No.     Time           Source                Destination           Protocol Length Info
   3526 2.926084       1.9.0                 host                  USB      28     URB_CONTROL out

Frame 3526: 28 bytes on wire (224 bits), 28 bytes captured (224 bits) on interface \\.\USBPcap1, id 0
    Section number: 1
    Interface id: 0 (\\.\USBPcap1)
        Interface name: \\.\USBPcap1
        Interface description: USBPcap1
    Encapsulation type: USB packets with USBPcap header (152)
    Arrival Time: Jun 22, 2025 18:49:57.937067000 Central Europe Daylight Time
    UTC Arrival Time: Jun 22, 2025 16:49:57.937067000 UTC
    Epoch Arrival Time: 1750610997.937067000
    [Time shift for this packet: 0.000000000 seconds]
    [Time delta from previous captured frame: 0.000202000 seconds]
    [Time delta from previous displayed frame: 0.000202000 seconds]
    [Time since reference or first frame: 2.926084000 seconds]
    Frame Number: 3526
    Frame Length: 28 bytes (224 bits)
    Capture Length: 28 bytes (224 bits)
    [Frame is marked: False]
    [Frame is ignored: False]
    [Protocols in frame: usb]
USB URB
    [Source: 1.9.0]
    [Destination: host]
    USBPcap pseudoheader length: 28
    IRP ID: 0xffffde073ea70560
    IRP USBD_STATUS: USBD_STATUS_SUCCESS (0x00000000)
    URB Function: URB_FUNCTION_CONTROL_TRANSFER (0x0008)
    IRP information: 0x01, Direction: PDO -> FDO
        0000 000. = Reserved: 0x00
        .... ...1 = Direction: PDO -> FDO (0x1)
    URB bus id: 1
    Device address: 9
    Endpoint: 0x00, Direction: OUT
        0... .... = Direction: OUT (0)
        .... 0000 = Endpoint number: 0
    URB transfer type: URB_CONTROL (0x02)
    Packet Data Length: 0
    [Request in: 3525]
    [Time from request: 0.000202000 seconds]
    Control transfer stage: Complete (3)
    [bInterfaceClass: Vendor Specific (0xff)]

No.     Time           Source                Destination           Protocol Length Info
   3527 2.926098       host                  1.9.0                 USB      36     URB_CONTROL in

Frame 3527: 36 bytes on wire (288 bits), 36 bytes captured (288 bits) on interface \\.\USBPcap1, id 0
    Section number: 1
    Interface id: 0 (\\.\USBPcap1)
        Interface name: \\.\USBPcap1
        Interface description: USBPcap1
    Encapsulation type: USB packets with USBPcap header (152)
    Arrival Time: Jun 22, 2025 18:49:57.937081000 Central Europe Daylight Time
    UTC Arrival Time: Jun 22, 2025 16:49:57.937081000 UTC
    Epoch Arrival Time: 1750610997.937081000
    [Time shift for this packet: 0.000000000 seconds]
    [Time delta from previous captured frame: 0.000014000 seconds]
    [Time delta from previous displayed frame: 0.000014000 seconds]
    [Time since reference or first frame: 2.926098000 seconds]
    Frame Number: 3527
    Frame Length: 36 bytes (288 bits)
    Capture Length: 36 bytes (288 bits)
    [Frame is marked: False]
    [Frame is ignored: False]
    [Protocols in frame: usb]
USB URB
    [Source: host]
    [Destination: 1.9.0]
    USBPcap pseudoheader length: 28
    IRP ID: 0xffffde073ea70560
    IRP USBD_STATUS: USBD_STATUS_SUCCESS (0x00000000)
    URB Function: URB_FUNCTION_VENDOR_DEVICE (0x0017)
    IRP information: 0x00, Direction: FDO -> PDO
        0000 000. = Reserved: 0x00
        .... ...0 = Direction: FDO -> PDO (0x0)
    URB bus id: 1
    Device address: 9
    Endpoint: 0x80, Direction: IN
        1... .... = Direction: IN (1)
        .... 0000 = Endpoint number: 0
    URB transfer type: URB_CONTROL (0x02)
    Packet Data Length: 8
    [Response in: 3528]
    Control transfer stage: Setup (0)
    [bInterfaceClass: Unknown (0xffff)]
Setup Data
    bmRequestType: 0xc0
        1... .... = Direction: Device-to-host
        .10. .... = Type: Vendor (0x2)
        ...0 0000 = Recipient: Device (0x00)
    bRequest: 65
    wValue: 0x0d00
    wIndex: 257 (0x0101)
    wLength: 5

No.     Time           Source                Destination           Protocol Length Info
   3528 2.926316       1.9.0                 host                  USB      33     URB_CONTROL in

Frame 3528: 33 bytes on wire (264 bits), 33 bytes captured (264 bits) on interface \\.\USBPcap1, id 0
    Section number: 1
    Interface id: 0 (\\.\USBPcap1)
        Interface name: \\.\USBPcap1
        Interface description: USBPcap1
    Encapsulation type: USB packets with USBPcap header (152)
    Arrival Time: Jun 22, 2025 18:49:57.937299000 Central Europe Daylight Time
    UTC Arrival Time: Jun 22, 2025 16:49:57.937299000 UTC
    Epoch Arrival Time: 1750610997.937299000
    [Time shift for this packet: 0.000000000 seconds]
    [Time delta from previous captured frame: 0.000218000 seconds]
    [Time delta from previous displayed frame: 0.000218000 seconds]
    [Time since reference or first frame: 2.926316000 seconds]
    Frame Number: 3528
    Frame Length: 33 bytes (264 bits)
    Capture Length: 33 bytes (264 bits)
    [Frame is marked: False]
    [Frame is ignored: False]
    [Protocols in frame: usb]
USB URB
    [Source: 1.9.0]
    [Destination: host]
    USBPcap pseudoheader length: 28
    IRP ID: 0xffffde073ea70560
    IRP USBD_STATUS: USBD_STATUS_SUCCESS (0x00000000)
    URB Function: URB_FUNCTION_CONTROL_TRANSFER (0x0008)
    IRP information: 0x01, Direction: PDO -> FDO
        0000 000. = Reserved: 0x00
        .... ...1 = Direction: PDO -> FDO (0x1)
    URB bus id: 1
    Device address: 9
    Endpoint: 0x80, Direction: IN
        1... .... = Direction: IN (1)
        .... 0000 = Endpoint number: 0
    URB transfer type: URB_CONTROL (0x02)
    Packet Data Length: 5
    [Request in: 3527]
    [Time from request: 0.000218000 seconds]
    Control transfer stage: Complete (3)
    [bInterfaceClass: Unknown (0xffff)]
CONTROL response data: 0000000200

No.     Time           Source                Destination           Protocol Length Info
   3529 2.926330       host                  1.9.0                 USB      36     URB_CONTROL out

Frame 3529: 36 bytes on wire (288 bits), 36 bytes captured (288 bits) on interface \\.\USBPcap1, id 0
    Section number: 1
    Interface id: 0 (\\.\USBPcap1)
        Interface name: \\.\USBPcap1
        Interface description: USBPcap1
    Encapsulation type: USB packets with USBPcap header (152)
    Arrival Time: Jun 22, 2025 18:49:57.937313000 Central Europe Daylight Time
    UTC Arrival Time: Jun 22, 2025 16:49:57.937313000 UTC
    Epoch Arrival Time: 1750610997.937313000
    [Time shift for this packet: 0.000000000 seconds]
    [Time delta from previous captured frame: 0.000014000 seconds]
    [Time delta from previous displayed frame: 0.000014000 seconds]
    [Time since reference or first frame: 2.926330000 seconds]
    Frame Number: 3529
    Frame Length: 36 bytes (288 bits)
    Capture Length: 36 bytes (288 bits)
    [Frame is marked: False]
    [Frame is ignored: False]
    [Protocols in frame: usb]
USB URB
    [Source: host]
    [Destination: 1.9.0]
    USBPcap pseudoheader length: 28
    IRP ID: 0xffffde073ea70560
    IRP USBD_STATUS: USBD_STATUS_SUCCESS (0x00000000)
    URB Function: URB_FUNCTION_VENDOR_DEVICE (0x0017)
    IRP information: 0x00, Direction: FDO -> PDO
        0000 000. = Reserved: 0x00
        .... ...0 = Direction: FDO -> PDO (0x0)
    URB bus id: 1
    Device address: 9
    Endpoint: 0x00, Direction: OUT
        0... .... = Direction: OUT (0)
        .... 0000 = Endpoint number: 0
    URB transfer type: URB_CONTROL (0x02)
    Packet Data Length: 8
    [Response in: 3530]
    Control transfer stage: Setup (0)
    [bInterfaceClass: Unknown (0xffff)]
Setup Data
    bmRequestType: 0x40
        0... .... = Direction: Host-to-device
        .10. .... = Type: Vendor (0x2)
        ...0 0000 = Recipient: Device (0x00)
    bRequest: 65
    wValue: 0x0d04
    wIndex: 257 (0x0101)
    wLength: 0

No.     Time           Source                Destination           Protocol Length Info
   3530 2.926390       1.9.0                 host                  USB      28     URB_CONTROL out

Frame 3530: 28 bytes on wire (224 bits), 28 bytes captured (224 bits) on interface \\.\USBPcap1, id 0
    Section number: 1
    Interface id: 0 (\\.\USBPcap1)
        Interface name: \\.\USBPcap1
        Interface description: USBPcap1
    Encapsulation type: USB packets with USBPcap header (152)
    Arrival Time: Jun 22, 2025 18:49:57.937373000 Central Europe Daylight Time
    UTC Arrival Time: Jun 22, 2025 16:49:57.937373000 UTC
    Epoch Arrival Time: 1750610997.937373000
    [Time shift for this packet: 0.000000000 seconds]
    [Time delta from previous captured frame: 0.000060000 seconds]
    [Time delta from previous displayed frame: 0.000060000 seconds]
    [Time since reference or first frame: 2.926390000 seconds]
    Frame Number: 3530
    Frame Length: 28 bytes (224 bits)
    Capture Length: 28 bytes (224 bits)
    [Frame is marked: False]
    [Frame is ignored: False]
    [Protocols in frame: usb]
USB URB
    [Source: 1.9.0]
    [Destination: host]
    USBPcap pseudoheader length: 28
    IRP ID: 0xffffde073ea70560
    IRP USBD_STATUS: USBD_STATUS_SUCCESS (0x00000000)
    URB Function: URB_FUNCTION_CONTROL_TRANSFER (0x0008)
    IRP information: 0x01, Direction: PDO -> FDO
        0000 000. = Reserved: 0x00
        .... ...1 = Direction: PDO -> FDO (0x1)
    URB bus id: 1
    Device address: 9
    Endpoint: 0x00, Direction: OUT
        0... .... = Direction: OUT (0)
        .... 0000 = Endpoint number: 0
    URB transfer type: URB_CONTROL (0x02)
    Packet Data Length: 0
    [Request in: 3529]
    [Time from request: 0.000060000 seconds]
    Control transfer stage: Complete (3)
    [bInterfaceClass: Unknown (0xffff)]

No.     Time           Source                Destination           Protocol Length Info
   3531 2.926395       host                  1.9.0                 USB      36     URB_CONTROL out

Frame 3531: 36 bytes on wire (288 bits), 36 bytes captured (288 bits) on interface \\.\USBPcap1, id 0
    Section number: 1
    Interface id: 0 (\\.\USBPcap1)
        Interface name: \\.\USBPcap1
        Interface description: USBPcap1
    Encapsulation type: USB packets with USBPcap header (152)
    Arrival Time: Jun 22, 2025 18:49:57.937378000 Central Europe Daylight Time
    UTC Arrival Time: Jun 22, 2025 16:49:57.937378000 UTC
    Epoch Arrival Time: 1750610997.937378000
    [Time shift for this packet: 0.000000000 seconds]
    [Time delta from previous captured frame: 0.000005000 seconds]
    [Time delta from previous displayed frame: 0.000005000 seconds]
    [Time since reference or first frame: 2.926395000 seconds]
    Frame Number: 3531
    Frame Length: 36 bytes (288 bits)
    Capture Length: 36 bytes (288 bits)
    [Frame is marked: False]
    [Frame is ignored: False]
    [Protocols in frame: usb]
USB URB
    [Source: host]
    [Destination: 1.9.0]
    USBPcap pseudoheader length: 28
    IRP ID: 0xffffde073ea70560
    IRP USBD_STATUS: USBD_STATUS_SUCCESS (0x00000000)
    URB Function: URB_FUNCTION_VENDOR_DEVICE (0x0017)
    IRP information: 0x00, Direction: FDO -> PDO
        0000 000. = Reserved: 0x00
        .... ...0 = Direction: FDO -> PDO (0x0)
    URB bus id: 1
    Device address: 9
    Endpoint: 0x00, Direction: OUT
        0... .... = Direction: OUT (0)
        .... 0000 = Endpoint number: 0
    URB transfer type: URB_CONTROL (0x02)
    Packet Data Length: 8
    [Response in: 3532]
    Control transfer stage: Setup (0)
    [bInterfaceClass: Unknown (0xffff)]
Setup Data
    bmRequestType: 0x40
        0... .... = Direction: Host-to-device
        .10. .... = Type: Vendor (0x2)
        ...0 0000 = Recipient: Device (0x00)
    bRequest: 65
    wValue: 0x0e00
    wIndex: 257 (0x0101)
    wLength: 0

No.     Time           Source                Destination           Protocol Length Info
   3532 2.926455       1.9.0                 host                  USB      28     URB_CONTROL out

Frame 3532: 28 bytes on wire (224 bits), 28 bytes captured (224 bits) on interface \\.\USBPcap1, id 0
    Section number: 1
    Interface id: 0 (\\.\USBPcap1)
        Interface name: \\.\USBPcap1
        Interface description: USBPcap1
    Encapsulation type: USB packets with USBPcap header (152)
    Arrival Time: Jun 22, 2025 18:49:57.937438000 Central Europe Daylight Time
    UTC Arrival Time: Jun 22, 2025 16:49:57.937438000 UTC
    Epoch Arrival Time: 1750610997.937438000
    [Time shift for this packet: 0.000000000 seconds]
    [Time delta from previous captured frame: 0.000060000 seconds]
    [Time delta from previous displayed frame: 0.000060000 seconds]
    [Time since reference or first frame: 2.926455000 seconds]
    Frame Number: 3532
    Frame Length: 28 bytes (224 bits)
    Capture Length: 28 bytes (224 bits)
    [Frame is marked: False]
    [Frame is ignored: False]
    [Protocols in frame: usb]
USB URB
    [Source: 1.9.0]
    [Destination: host]
    USBPcap pseudoheader length: 28
    IRP ID: 0xffffde073ea70560
    IRP USBD_STATUS: USBD_STATUS_SUCCESS (0x00000000)
    URB Function: URB_FUNCTION_CONTROL_TRANSFER (0x0008)
    IRP information: 0x01, Direction: PDO -> FDO
        0000 000. = Reserved: 0x00
        .... ...1 = Direction: PDO -> FDO (0x1)
    URB bus id: 1
    Device address: 9
    Endpoint: 0x00, Direction: OUT
        0... .... = Direction: OUT (0)
        .... 0000 = Endpoint number: 0
    URB transfer type: URB_CONTROL (0x02)
    Packet Data Length: 0
    [Request in: 3531]
    [Time from request: 0.000060000 seconds]
    Control transfer stage: Complete (3)
    [bInterfaceClass: Unknown (0xffff)]

No.     Time           Source                Destination           Protocol Length Info
   3533 2.926460       host                  1.9.0                 USB      36     URB_CONTROL out

Frame 3533: 36 bytes on wire (288 bits), 36 bytes captured (288 bits) on interface \\.\USBPcap1, id 0
    Section number: 1
    Interface id: 0 (\\.\USBPcap1)
        Interface name: \\.\USBPcap1
        Interface description: USBPcap1
    Encapsulation type: USB packets with USBPcap header (152)
    Arrival Time: Jun 22, 2025 18:49:57.937443000 Central Europe Daylight Time
    UTC Arrival Time: Jun 22, 2025 16:49:57.937443000 UTC
    Epoch Arrival Time: 1750610997.937443000
    [Time shift for this packet: 0.000000000 seconds]
    [Time delta from previous captured frame: 0.000005000 seconds]
    [Time delta from previous displayed frame: 0.000005000 seconds]
    [Time since reference or first frame: 2.926460000 seconds]
    Frame Number: 3533
    Frame Length: 36 bytes (288 bits)
    Capture Length: 36 bytes (288 bits)
    [Frame is marked: False]
    [Frame is ignored: False]
    [Protocols in frame: usb]
USB URB
    [Source: host]
    [Destination: 1.9.0]
    USBPcap pseudoheader length: 28
    IRP ID: 0xffffde073ea70560
    IRP USBD_STATUS: USBD_STATUS_SUCCESS (0x00000000)
    URB Function: URB_FUNCTION_VENDOR_DEVICE (0x0017)
    IRP information: 0x00, Direction: FDO -> PDO
        0000 000. = Reserved: 0x00
        .... ...0 = Direction: FDO -> PDO (0x0)
    URB bus id: 1
    Device address: 9
    Endpoint: 0x00, Direction: OUT
        0... .... = Direction: OUT (0)
        .... 0000 = Endpoint number: 0
    URB transfer type: URB_CONTROL (0x02)
    Packet Data Length: 8
    [Response in: 3534]
    Control transfer stage: Setup (0)
    [bInterfaceClass: Unknown (0xffff)]
Setup Data
    bmRequestType: 0x40
        0... .... = Direction: Host-to-device
        .10. .... = Type: Vendor (0x2)
        ...0 0000 = Recipient: Device (0x00)
    bRequest: 65
    wValue: 0x0f00
    wIndex: 257 (0x0101)
    wLength: 0

No.     Time           Source                Destination           Protocol Length Info
   3534 2.926518       1.9.0                 host                  USB      28     URB_CONTROL out

Frame 3534: 28 bytes on wire (224 bits), 28 bytes captured (224 bits) on interface \\.\USBPcap1, id 0
    Section number: 1
    Interface id: 0 (\\.\USBPcap1)
        Interface name: \\.\USBPcap1
        Interface description: USBPcap1
    Encapsulation type: USB packets with USBPcap header (152)
    Arrival Time: Jun 22, 2025 18:49:57.937501000 Central Europe Daylight Time
    UTC Arrival Time: Jun 22, 2025 16:49:57.937501000 UTC
    Epoch Arrival Time: 1750610997.937501000
    [Time shift for this packet: 0.000000000 seconds]
    [Time delta from previous captured frame: 0.000058000 seconds]
    [Time delta from previous displayed frame: 0.000058000 seconds]
    [Time since reference or first frame: 2.926518000 seconds]
    Frame Number: 3534
    Frame Length: 28 bytes (224 bits)
    Capture Length: 28 bytes (224 bits)
    [Frame is marked: False]
    [Frame is ignored: False]
    [Protocols in frame: usb]
USB URB
    [Source: 1.9.0]
    [Destination: host]
    USBPcap pseudoheader length: 28
    IRP ID: 0xffffde073ea70560
    IRP USBD_STATUS: USBD_STATUS_SUCCESS (0x00000000)
    URB Function: URB_FUNCTION_CONTROL_TRANSFER (0x0008)
    IRP information: 0x01, Direction: PDO -> FDO
        0000 000. = Reserved: 0x00
        .... ...1 = Direction: PDO -> FDO (0x1)
    URB bus id: 1
    Device address: 9
    Endpoint: 0x00, Direction: OUT
        0... .... = Direction: OUT (0)
        .... 0000 = Endpoint number: 0
    URB transfer type: URB_CONTROL (0x02)
    Packet Data Length: 0
    [Request in: 3533]
    [Time from request: 0.000058000 seconds]
    Control transfer stage: Complete (3)
    [bInterfaceClass: Unknown (0xffff)]

No.     Time           Source                Destination           Protocol Length Info
   3535 2.926523       host                  1.9.0                 USB      36     URB_CONTROL out

Frame 3535: 36 bytes on wire (288 bits), 36 bytes captured (288 bits) on interface \\.\USBPcap1, id 0
    Section number: 1
    Interface id: 0 (\\.\USBPcap1)
        Interface name: \\.\USBPcap1
        Interface description: USBPcap1
    Encapsulation type: USB packets with USBPcap header (152)
    Arrival Time: Jun 22, 2025 18:49:57.937506000 Central Europe Daylight Time
    UTC Arrival Time: Jun 22, 2025 16:49:57.937506000 UTC
    Epoch Arrival Time: 1750610997.937506000
    [Time shift for this packet: 0.000000000 seconds]
    [Time delta from previous captured frame: 0.000005000 seconds]
    [Time delta from previous displayed frame: 0.000005000 seconds]
    [Time since reference or first frame: 2.926523000 seconds]
    Frame Number: 3535
    Frame Length: 36 bytes (288 bits)
    Capture Length: 36 bytes (288 bits)
    [Frame is marked: False]
    [Frame is ignored: False]
    [Protocols in frame: usb]
USB URB
    [Source: host]
    [Destination: 1.9.0]
    USBPcap pseudoheader length: 28
    IRP ID: 0xffffde073ea70560
    IRP USBD_STATUS: USBD_STATUS_SUCCESS (0x00000000)
    URB Function: URB_FUNCTION_VENDOR_DEVICE (0x0017)
    IRP information: 0x00, Direction: FDO -> PDO
        0000 000. = Reserved: 0x00
        .... ...0 = Direction: FDO -> PDO (0x0)
    URB bus id: 1
    Device address: 9
    Endpoint: 0x00, Direction: OUT
        0... .... = Direction: OUT (0)
        .... 0000 = Endpoint number: 0
    URB transfer type: URB_CONTROL (0x02)
    Packet Data Length: 8
    [Response in: 3536]
    Control transfer stage: Setup (0)
    [bInterfaceClass: Unknown (0xffff)]
Setup Data
    bmRequestType: 0x40
        0... .... = Direction: Host-to-device
        .10. .... = Type: Vendor (0x2)
        ...0 0000 = Recipient: Device (0x00)
    bRequest: 65
    wValue: 0x1002
    wIndex: 257 (0x0101)
    wLength: 0

No.     Time           Source                Destination           Protocol Length Info
   3536 2.926582       1.9.0                 host                  USB      28     URB_CONTROL out

Frame 3536: 28 bytes on wire (224 bits), 28 bytes captured (224 bits) on interface \\.\USBPcap1, id 0
    Section number: 1
    Interface id: 0 (\\.\USBPcap1)
        Interface name: \\.\USBPcap1
        Interface description: USBPcap1
    Encapsulation type: USB packets with USBPcap header (152)
    Arrival Time: Jun 22, 2025 18:49:57.937565000 Central Europe Daylight Time
    UTC Arrival Time: Jun 22, 2025 16:49:57.937565000 UTC
    Epoch Arrival Time: 1750610997.937565000
    [Time shift for this packet: 0.000000000 seconds]
    [Time delta from previous captured frame: 0.000059000 seconds]
    [Time delta from previous displayed frame: 0.000059000 seconds]
    [Time since reference or first frame: 2.926582000 seconds]
    Frame Number: 3536
    Frame Length: 28 bytes (224 bits)
    Capture Length: 28 bytes (224 bits)
    [Frame is marked: False]
    [Frame is ignored: False]
    [Protocols in frame: usb]
USB URB
    [Source: 1.9.0]
    [Destination: host]
    USBPcap pseudoheader length: 28
    IRP ID: 0xffffde073ea70560
    IRP USBD_STATUS: USBD_STATUS_SUCCESS (0x00000000)
    URB Function: URB_FUNCTION_CONTROL_TRANSFER (0x0008)
    IRP information: 0x01, Direction: PDO -> FDO
        0000 000. = Reserved: 0x00
        .... ...1 = Direction: PDO -> FDO (0x1)
    URB bus id: 1
    Device address: 9
    Endpoint: 0x00, Direction: OUT
        0... .... = Direction: OUT (0)
        .... 0000 = Endpoint number: 0
    URB transfer type: URB_CONTROL (0x02)
    Packet Data Length: 0
    [Request in: 3535]
    [Time from request: 0.000059000 seconds]
    Control transfer stage: Complete (3)
    [bInterfaceClass: Unknown (0xffff)]

No.     Time           Source                Destination           Protocol Length Info
   3537 2.926587       host                  1.9.0                 USB      36     URB_CONTROL out

Frame 3537: 36 bytes on wire (288 bits), 36 bytes captured (288 bits) on interface \\.\USBPcap1, id 0
    Section number: 1
    Interface id: 0 (\\.\USBPcap1)
        Interface name: \\.\USBPcap1
        Interface description: USBPcap1
    Encapsulation type: USB packets with USBPcap header (152)
    Arrival Time: Jun 22, 2025 18:49:57.937570000 Central Europe Daylight Time
    UTC Arrival Time: Jun 22, 2025 16:49:57.937570000 UTC
    Epoch Arrival Time: 1750610997.937570000
    [Time shift for this packet: 0.000000000 seconds]
    [Time delta from previous captured frame: 0.000005000 seconds]
    [Time delta from previous displayed frame: 0.000005000 seconds]
    [Time since reference or first frame: 2.926587000 seconds]
    Frame Number: 3537
    Frame Length: 36 bytes (288 bits)
    Capture Length: 36 bytes (288 bits)
    [Frame is marked: False]
    [Frame is ignored: False]
    [Protocols in frame: usb]
USB URB
    [Source: host]
    [Destination: 1.9.0]
    USBPcap pseudoheader length: 28
    IRP ID: 0xffffde073ea70560
    IRP USBD_STATUS: USBD_STATUS_SUCCESS (0x00000000)
    URB Function: URB_FUNCTION_VENDOR_DEVICE (0x0017)
    IRP information: 0x00, Direction: FDO -> PDO
        0000 000. = Reserved: 0x00
        .... ...0 = Direction: FDO -> PDO (0x0)
    URB bus id: 1
    Device address: 9
    Endpoint: 0x00, Direction: OUT
        0... .... = Direction: OUT (0)
        .... 0000 = Endpoint number: 0
    URB transfer type: URB_CONTROL (0x02)
    Packet Data Length: 8
    [Response in: 3538]
    Control transfer stage: Setup (0)
    [bInterfaceClass: Unknown (0xffff)]
Setup Data
    bmRequestType: 0x40
        0... .... = Direction: Host-to-device
        .10. .... = Type: Vendor (0x2)
        ...0 0000 = Recipient: Device (0x00)
    bRequest: 65
    wValue: 0x110b
    wIndex: 257 (0x0101)
    wLength: 0

No.     Time           Source                Destination           Protocol Length Info
   3538 2.926647       1.9.0                 host                  USB      28     URB_CONTROL out

Frame 3538: 28 bytes on wire (224 bits), 28 bytes captured (224 bits) on interface \\.\USBPcap1, id 0
    Section number: 1
    Interface id: 0 (\\.\USBPcap1)
        Interface name: \\.\USBPcap1
        Interface description: USBPcap1
    Encapsulation type: USB packets with USBPcap header (152)
    Arrival Time: Jun 22, 2025 18:49:57.937630000 Central Europe Daylight Time
    UTC Arrival Time: Jun 22, 2025 16:49:57.937630000 UTC
    Epoch Arrival Time: 1750610997.937630000
    [Time shift for this packet: 0.000000000 seconds]
    [Time delta from previous captured frame: 0.000060000 seconds]
    [Time delta from previous displayed frame: 0.000060000 seconds]
    [Time since reference or first frame: 2.926647000 seconds]
    Frame Number: 3538
    Frame Length: 28 bytes (224 bits)
    Capture Length: 28 bytes (224 bits)
    [Frame is marked: False]
    [Frame is ignored: False]
    [Protocols in frame: usb]
USB URB
    [Source: 1.9.0]
    [Destination: host]
    USBPcap pseudoheader length: 28
    IRP ID: 0xffffde073ea70560
    IRP USBD_STATUS: USBD_STATUS_SUCCESS (0x00000000)
    URB Function: URB_FUNCTION_CONTROL_TRANSFER (0x0008)
    IRP information: 0x01, Direction: PDO -> FDO
        0000 000. = Reserved: 0x00
        .... ...1 = Direction: PDO -> FDO (0x1)
    URB bus id: 1
    Device address: 9
    Endpoint: 0x00, Direction: OUT
        0... .... = Direction: OUT (0)
        .... 0000 = Endpoint number: 0
    URB transfer type: URB_CONTROL (0x02)
    Packet Data Length: 0
    [Request in: 3537]
    [Time from request: 0.000060000 seconds]
    Control transfer stage: Complete (3)
    [bInterfaceClass: Unknown (0xffff)]

No.     Time           Source                Destination           Protocol Length Info
   3539 2.926696       host                  1.9.0                 USB      39     URB_CONTROL out

Frame 3539: 39 bytes on wire (312 bits), 39 bytes captured (312 bits) on interface \\.\USBPcap1, id 0
    Section number: 1
    Interface id: 0 (\\.\USBPcap1)
        Interface name: \\.\USBPcap1
        Interface description: USBPcap1
    Encapsulation type: USB packets with USBPcap header (152)
    Arrival Time: Jun 22, 2025 18:49:57.937679000 Central Europe Daylight Time
    UTC Arrival Time: Jun 22, 2025 16:49:57.937679000 UTC
    Epoch Arrival Time: 1750610997.937679000
    [Time shift for this packet: 0.000000000 seconds]
    [Time delta from previous captured frame: 0.000049000 seconds]
    [Time delta from previous displayed frame: 0.000049000 seconds]
    [Time since reference or first frame: 2.926696000 seconds]
    Frame Number: 3539
    Frame Length: 39 bytes (312 bits)
    Capture Length: 39 bytes (312 bits)
    [Frame is marked: False]
    [Frame is ignored: False]
    [Protocols in frame: usb]
USB URB
    [Source: host]
    [Destination: 1.9.0]
    USBPcap pseudoheader length: 28
    IRP ID: 0xffffde073ea70560
    IRP USBD_STATUS: USBD_STATUS_SUCCESS (0x00000000)
    URB Function: URB_FUNCTION_CLASS_ENDPOINT (0x001c)
    IRP information: 0x00, Direction: FDO -> PDO
        0000 000. = Reserved: 0x00
        .... ...0 = Direction: FDO -> PDO (0x0)
    URB bus id: 1
    Device address: 9
    Endpoint: 0x00, Direction: OUT
        0... .... = Direction: OUT (0)
        .... 0000 = Endpoint number: 0
    URB transfer type: URB_CONTROL (0x02)
    Packet Data Length: 11
    [Response in: 3540]
    Control transfer stage: Setup (0)
    [bInterfaceClass: Vendor Specific (0xff)]
Setup Data
    bmRequestType: 0x22
        0... .... = Direction: Host-to-device
        .01. .... = Type: Class (0x1)
        ...0 0010 = Recipient: Endpoint (0x02)
    bRequest: 1
    wValue: 0x0100
    wIndex: 134 (0x0086)
    wLength: 3
    Data Fragment: 80bb00

No.     Time           Source                Destination           Protocol Length Info
   3540 2.926817       1.9.0                 host                  USB      28     URB_CONTROL out

Frame 3540: 28 bytes on wire (224 bits), 28 bytes captured (224 bits) on interface \\.\USBPcap1, id 0
    Section number: 1
    Interface id: 0 (\\.\USBPcap1)
        Interface name: \\.\USBPcap1
        Interface description: USBPcap1
    Encapsulation type: USB packets with USBPcap header (152)
    Arrival Time: Jun 22, 2025 18:49:57.937800000 Central Europe Daylight Time
    UTC Arrival Time: Jun 22, 2025 16:49:57.937800000 UTC
    Epoch Arrival Time: 1750610997.937800000
    [Time shift for this packet: 0.000000000 seconds]
    [Time delta from previous captured frame: 0.000121000 seconds]
    [Time delta from previous displayed frame: 0.000121000 seconds]
    [Time since reference or first frame: 2.926817000 seconds]
    Frame Number: 3540
    Frame Length: 28 bytes (224 bits)
    Capture Length: 28 bytes (224 bits)
    [Frame is marked: False]
    [Frame is ignored: False]
    [Protocols in frame: usb]
USB URB
    [Source: 1.9.0]
    [Destination: host]
    USBPcap pseudoheader length: 28
    IRP ID: 0xffffde073ea70560
    IRP USBD_STATUS: USBD_STATUS_SUCCESS (0x00000000)
    URB Function: URB_FUNCTION_CONTROL_TRANSFER (0x0008)
    IRP information: 0x01, Direction: PDO -> FDO
        0000 000. = Reserved: 0x00
        .... ...1 = Direction: PDO -> FDO (0x1)
    URB bus id: 1
    Device address: 9
    Endpoint: 0x00, Direction: OUT
        0... .... = Direction: OUT (0)
        .... 0000 = Endpoint number: 0
    URB transfer type: URB_CONTROL (0x02)
    Packet Data Length: 0
    [Request in: 3539]
    [Time from request: 0.000121000 seconds]
    Control transfer stage: Complete (3)
    [bInterfaceClass: Vendor Specific (0xff)]

No.     Time           Source                Destination           Protocol Length Info
   3541 2.926820       host                  1.9.0                 USB      39     URB_CONTROL out

Frame 3541: 39 bytes on wire (312 bits), 39 bytes captured (312 bits) on interface \\.\USBPcap1, id 0
    Section number: 1
    Interface id: 0 (\\.\USBPcap1)
        Interface name: \\.\USBPcap1
        Interface description: USBPcap1
    Encapsulation type: USB packets with USBPcap header (152)
    Arrival Time: Jun 22, 2025 18:49:57.937803000 Central Europe Daylight Time
    UTC Arrival Time: Jun 22, 2025 16:49:57.937803000 UTC
    Epoch Arrival Time: 1750610997.937803000
    [Time shift for this packet: 0.000000000 seconds]
    [Time delta from previous captured frame: 0.000003000 seconds]
    [Time delta from previous displayed frame: 0.000003000 seconds]
    [Time since reference or first frame: 2.926820000 seconds]
    Frame Number: 3541
    Frame Length: 39 bytes (312 bits)
    Capture Length: 39 bytes (312 bits)
    [Frame is marked: False]
    [Frame is ignored: False]
    [Protocols in frame: usb]
USB URB
    [Source: host]
    [Destination: 1.9.0]
    USBPcap pseudoheader length: 28
    IRP ID: 0xffffde073ea70560
    IRP USBD_STATUS: USBD_STATUS_SUCCESS (0x00000000)
    URB Function: URB_FUNCTION_CLASS_ENDPOINT (0x001c)
    IRP information: 0x00, Direction: FDO -> PDO
        0000 000. = Reserved: 0x00
        .... ...0 = Direction: FDO -> PDO (0x0)
    URB bus id: 1
    Device address: 9
    Endpoint: 0x00, Direction: OUT
        0... .... = Direction: OUT (0)
        .... 0000 = Endpoint number: 0
    URB transfer type: URB_CONTROL (0x02)
    Packet Data Length: 11
    [Response in: 3542]
    Control transfer stage: Setup (0)
    [bInterfaceClass: Vendor Specific (0xff)]
Setup Data
    bmRequestType: 0x22
        0... .... = Direction: Host-to-device
        .01. .... = Type: Class (0x1)
        ...0 0010 = Recipient: Endpoint (0x02)
    bRequest: 1
    wValue: 0x0100
    wIndex: 2 (0x0002)
    wLength: 3
    Data Fragment: 80bb00

No.     Time           Source                Destination           Protocol Length Info
   3542 2.926980       1.9.0                 host                  USB      28     URB_CONTROL out

Frame 3542: 28 bytes on wire (224 bits), 28 bytes captured (224 bits) on interface \\.\USBPcap1, id 0
    Section number: 1
    Interface id: 0 (\\.\USBPcap1)
        Interface name: \\.\USBPcap1
        Interface description: USBPcap1
    Encapsulation type: USB packets with USBPcap header (152)
    Arrival Time: Jun 22, 2025 18:49:57.937963000 Central Europe Daylight Time
    UTC Arrival Time: Jun 22, 2025 16:49:57.937963000 UTC
    Epoch Arrival Time: 1750610997.937963000
    [Time shift for this packet: 0.000000000 seconds]
    [Time delta from previous captured frame: 0.000160000 seconds]
    [Time delta from previous displayed frame: 0.000160000 seconds]
    [Time since reference or first frame: 2.926980000 seconds]
    Frame Number: 3542
    Frame Length: 28 bytes (224 bits)
    Capture Length: 28 bytes (224 bits)
    [Frame is marked: False]
    [Frame is ignored: False]
    [Protocols in frame: usb]
USB URB
    [Source: 1.9.0]
    [Destination: host]
    USBPcap pseudoheader length: 28
    IRP ID: 0xffffde073ea70560
    IRP USBD_STATUS: USBD_STATUS_SUCCESS (0x00000000)
    URB Function: URB_FUNCTION_CONTROL_TRANSFER (0x0008)
    IRP information: 0x01, Direction: PDO -> FDO
        0000 000. = Reserved: 0x00
        .... ...1 = Direction: PDO -> FDO (0x1)
    URB bus id: 1
    Device address: 9
    Endpoint: 0x00, Direction: OUT
        0... .... = Direction: OUT (0)
        .... 0000 = Endpoint number: 0
    URB transfer type: URB_CONTROL (0x02)
    Packet Data Length: 0
    [Request in: 3541]
    [Time from request: 0.000160000 seconds]
    Control transfer stage: Complete (3)
    [bInterfaceClass: Vendor Specific (0xff)]

No.     Time           Source                Destination           Protocol Length Info
   3543 2.926995       host                  1.9.0                 USB      39     URB_CONTROL out

Frame 3543: 39 bytes on wire (312 bits), 39 bytes captured (312 bits) on interface \\.\USBPcap1, id 0
    Section number: 1
    Interface id: 0 (\\.\USBPcap1)
        Interface name: \\.\USBPcap1
        Interface description: USBPcap1
    Encapsulation type: USB packets with USBPcap header (152)
    Arrival Time: Jun 22, 2025 18:49:57.937978000 Central Europe Daylight Time
    UTC Arrival Time: Jun 22, 2025 16:49:57.937978000 UTC
    Epoch Arrival Time: 1750610997.937978000
    [Time shift for this packet: 0.000000000 seconds]
    [Time delta from previous captured frame: 0.000015000 seconds]
    [Time delta from previous displayed frame: 0.000015000 seconds]
    [Time since reference or first frame: 2.926995000 seconds]
    Frame Number: 3543
    Frame Length: 39 bytes (312 bits)
    Capture Length: 39 bytes (312 bits)
    [Frame is marked: False]
    [Frame is ignored: False]
    [Protocols in frame: usb]
USB URB
    [Source: host]
    [Destination: 1.9.0]
    USBPcap pseudoheader length: 28
    IRP ID: 0xffffde073ea70560
    IRP USBD_STATUS: USBD_STATUS_SUCCESS (0x00000000)
    URB Function: URB_FUNCTION_CLASS_ENDPOINT (0x001c)
    IRP information: 0x00, Direction: FDO -> PDO
        0000 000. = Reserved: 0x00
        .... ...0 = Direction: FDO -> PDO (0x0)
    URB bus id: 1
    Device address: 9
    Endpoint: 0x00, Direction: OUT
        0... .... = Direction: OUT (0)
        .... 0000 = Endpoint number: 0
    URB transfer type: URB_CONTROL (0x02)
    Packet Data Length: 11
    [Response in: 3544]
    Control transfer stage: Setup (0)
    [bInterfaceClass: Vendor Specific (0xff)]
Setup Data
    bmRequestType: 0x22
        0... .... = Direction: Host-to-device
        .01. .... = Type: Class (0x1)
        ...0 0010 = Recipient: Endpoint (0x02)
    bRequest: 1
    wValue: 0x0100
    wIndex: 134 (0x0086)
    wLength: 3
    Data Fragment: 80bb00

No.     Time           Source                Destination           Protocol Length Info
   3544 2.927130       1.9.0                 host                  USB      28     URB_CONTROL out

Frame 3544: 28 bytes on wire (224 bits), 28 bytes captured (224 bits) on interface \\.\USBPcap1, id 0
    Section number: 1
    Interface id: 0 (\\.\USBPcap1)
        Interface name: \\.\USBPcap1
        Interface description: USBPcap1
    Encapsulation type: USB packets with USBPcap header (152)
    Arrival Time: Jun 22, 2025 18:49:57.938113000 Central Europe Daylight Time
    UTC Arrival Time: Jun 22, 2025 16:49:57.938113000 UTC
    Epoch Arrival Time: 1750610997.938113000
    [Time shift for this packet: 0.000000000 seconds]
    [Time delta from previous captured frame: 0.000135000 seconds]
    [Time delta from previous displayed frame: 0.000135000 seconds]
    [Time since reference or first frame: 2.927130000 seconds]
    Frame Number: 3544
    Frame Length: 28 bytes (224 bits)
    Capture Length: 28 bytes (224 bits)
    [Frame is marked: False]
    [Frame is ignored: False]
    [Protocols in frame: usb]
USB URB
    [Source: 1.9.0]
    [Destination: host]
    USBPcap pseudoheader length: 28
    IRP ID: 0xffffde073ea70560
    IRP USBD_STATUS: USBD_STATUS_SUCCESS (0x00000000)
    URB Function: URB_FUNCTION_CONTROL_TRANSFER (0x0008)
    IRP information: 0x01, Direction: PDO -> FDO
        0000 000. = Reserved: 0x00
        .... ...1 = Direction: PDO -> FDO (0x1)
    URB bus id: 1
    Device address: 9
    Endpoint: 0x00, Direction: OUT
        0... .... = Direction: OUT (0)
        .... 0000 = Endpoint number: 0
    URB transfer type: URB_CONTROL (0x02)
    Packet Data Length: 0
    [Request in: 3543]
    [Time from request: 0.000135000 seconds]
    Control transfer stage: Complete (3)
    [bInterfaceClass: Vendor Specific (0xff)]

No.     Time           Source                Destination           Protocol Length Info
   3545 2.927148       host                  1.9.0                 USB      36     URB_CONTROL in

Frame 3545: 36 bytes on wire (288 bits), 36 bytes captured (288 bits) on interface \\.\USBPcap1, id 0
    Section number: 1
    Interface id: 0 (\\.\USBPcap1)
        Interface name: \\.\USBPcap1
        Interface description: USBPcap1
    Encapsulation type: USB packets with USBPcap header (152)
    Arrival Time: Jun 22, 2025 18:49:57.938131000 Central Europe Daylight Time
    UTC Arrival Time: Jun 22, 2025 16:49:57.938131000 UTC
    Epoch Arrival Time: 1750610997.938131000
    [Time shift for this packet: 0.000000000 seconds]
    [Time delta from previous captured frame: 0.000018000 seconds]
    [Time delta from previous displayed frame: 0.000018000 seconds]
    [Time since reference or first frame: 2.927148000 seconds]
    Frame Number: 3545
    Frame Length: 36 bytes (288 bits)
    Capture Length: 36 bytes (288 bits)
    [Frame is marked: False]
    [Frame is ignored: False]
    [Protocols in frame: usb]
USB URB
    [Source: host]
    [Destination: 1.9.0]
    USBPcap pseudoheader length: 28
    IRP ID: 0xffffde073e62b8e0
    IRP USBD_STATUS: USBD_STATUS_SUCCESS (0x00000000)
    URB Function: URB_FUNCTION_CLASS_ENDPOINT (0x001c)
    IRP information: 0x00, Direction: FDO -> PDO
        0000 000. = Reserved: 0x00
        .... ...0 = Direction: FDO -> PDO (0x0)
    URB bus id: 1
    Device address: 9
    Endpoint: 0x80, Direction: IN
        1... .... = Direction: IN (1)
        .... 0000 = Endpoint number: 0
    URB transfer type: URB_CONTROL (0x02)
    Packet Data Length: 8
    [Response in: 3546]
    Control transfer stage: Setup (0)
    [bInterfaceClass: Vendor Specific (0xff)]
Setup Data
    bmRequestType: 0xa2
        1... .... = Direction: Device-to-host
        .01. .... = Type: Class (0x1)
        ...0 0010 = Recipient: Endpoint (0x02)
    bRequest: 129
    wValue: 0x0100
    wIndex: 134 (0x0086)
    wLength: 3

No.     Time           Source                Destination           Protocol Length Info
   3546 2.927320       1.9.0                 host                  USB      31     URB_CONTROL in

Frame 3546: 31 bytes on wire (248 bits), 31 bytes captured (248 bits) on interface \\.\USBPcap1, id 0
    Section number: 1
    Interface id: 0 (\\.\USBPcap1)
        Interface name: \\.\USBPcap1
        Interface description: USBPcap1
    Encapsulation type: USB packets with USBPcap header (152)
    Arrival Time: Jun 22, 2025 18:49:57.938303000 Central Europe Daylight Time
    UTC Arrival Time: Jun 22, 2025 16:49:57.938303000 UTC
    Epoch Arrival Time: 1750610997.938303000
    [Time shift for this packet: 0.000000000 seconds]
    [Time delta from previous captured frame: 0.000172000 seconds]
    [Time delta from previous displayed frame: 0.000172000 seconds]
    [Time since reference or first frame: 2.927320000 seconds]
    Frame Number: 3546
    Frame Length: 31 bytes (248 bits)
    Capture Length: 31 bytes (248 bits)
    [Frame is marked: False]
    [Frame is ignored: False]
    [Protocols in frame: usb]
USB URB
    [Source: 1.9.0]
    [Destination: host]
    USBPcap pseudoheader length: 28
    IRP ID: 0xffffde073e62b8e0
    IRP USBD_STATUS: USBD_STATUS_SUCCESS (0x00000000)
    URB Function: URB_FUNCTION_CONTROL_TRANSFER (0x0008)
    IRP information: 0x01, Direction: PDO -> FDO
        0000 000. = Reserved: 0x00
        .... ...1 = Direction: PDO -> FDO (0x1)
    URB bus id: 1
    Device address: 9
    Endpoint: 0x80, Direction: IN
        1... .... = Direction: IN (1)
        .... 0000 = Endpoint number: 0
    URB transfer type: URB_CONTROL (0x02)
    Packet Data Length: 3
    [Request in: 3545]
    [Time from request: 0.000172000 seconds]
    Control transfer stage: Complete (3)
    [bInterfaceClass: Vendor Specific (0xff)]
CONTROL response data: 80bb00

No.     Time           Source                Destination           Protocol Length Info
   3547 2.927337       host                  1.9.0                 USB      36     URB_CONTROL in

Frame 3547: 36 bytes on wire (288 bits), 36 bytes captured (288 bits) on interface \\.\USBPcap1, id 0
    Section number: 1
    Interface id: 0 (\\.\USBPcap1)
        Interface name: \\.\USBPcap1
        Interface description: USBPcap1
    Encapsulation type: USB packets with USBPcap header (152)
    Arrival Time: Jun 22, 2025 18:49:57.938320000 Central Europe Daylight Time
    UTC Arrival Time: Jun 22, 2025 16:49:57.938320000 UTC
    Epoch Arrival Time: 1750610997.938320000
    [Time shift for this packet: 0.000000000 seconds]
    [Time delta from previous captured frame: 0.000017000 seconds]
    [Time delta from previous displayed frame: 0.000017000 seconds]
    [Time since reference or first frame: 2.927337000 seconds]
    Frame Number: 3547
    Frame Length: 36 bytes (288 bits)
    Capture Length: 36 bytes (288 bits)
    [Frame is marked: False]
    [Frame is ignored: False]
    [Protocols in frame: usb]
USB URB
    [Source: host]
    [Destination: 1.9.0]
    USBPcap pseudoheader length: 28
    IRP ID: 0xffffde073ea70560
    IRP USBD_STATUS: USBD_STATUS_SUCCESS (0x00000000)
    URB Function: URB_FUNCTION_VENDOR_DEVICE (0x0017)
    IRP information: 0x00, Direction: FDO -> PDO
        0000 000. = Reserved: 0x00
        .... ...0 = Direction: FDO -> PDO (0x0)
    URB bus id: 1
    Device address: 9
    Endpoint: 0x80, Direction: IN
        1... .... = Direction: IN (1)
        .... 0000 = Endpoint number: 0
    URB transfer type: URB_CONTROL (0x02)
    Packet Data Length: 8
    [Response in: 3548]
    Control transfer stage: Setup (0)
    [bInterfaceClass: Unknown (0xffff)]
Setup Data
    bmRequestType: 0xc0
        1... .... = Direction: Device-to-host
        .10. .... = Type: Vendor (0x2)
        ...0 0000 = Recipient: Device (0x00)
    bRequest: 73
    wValue: 0x0000
    wIndex: 0 (0x0000)
    wLength: 1

No.     Time           Source                Destination           Protocol Length Info
   3548 2.927493       1.9.0                 host                  USB      29     URB_CONTROL in

Frame 3548: 29 bytes on wire (232 bits), 29 bytes captured (232 bits) on interface \\.\USBPcap1, id 0
    Section number: 1
    Interface id: 0 (\\.\USBPcap1)
        Interface name: \\.\USBPcap1
        Interface description: USBPcap1
    Encapsulation type: USB packets with USBPcap header (152)
    Arrival Time: Jun 22, 2025 18:49:57.938476000 Central Europe Daylight Time
    UTC Arrival Time: Jun 22, 2025 16:49:57.938476000 UTC
    Epoch Arrival Time: 1750610997.938476000
    [Time shift for this packet: 0.000000000 seconds]
    [Time delta from previous captured frame: 0.000156000 seconds]
    [Time delta from previous displayed frame: 0.000156000 seconds]
    [Time since reference or first frame: 2.927493000 seconds]
    Frame Number: 3548
    Frame Length: 29 bytes (232 bits)
    Capture Length: 29 bytes (232 bits)
    [Frame is marked: False]
    [Frame is ignored: False]
    [Protocols in frame: usb]
USB URB
    [Source: 1.9.0]
    [Destination: host]
    USBPcap pseudoheader length: 28
    IRP ID: 0xffffde073ea70560
    IRP USBD_STATUS: USBD_STATUS_SUCCESS (0x00000000)
    URB Function: URB_FUNCTION_CONTROL_TRANSFER (0x0008)
    IRP information: 0x01, Direction: PDO -> FDO
        0000 000. = Reserved: 0x00
        .... ...1 = Direction: PDO -> FDO (0x1)
    URB bus id: 1
    Device address: 9
    Endpoint: 0x80, Direction: IN
        1... .... = Direction: IN (1)
        .... 0000 = Endpoint number: 0
    URB transfer type: URB_CONTROL (0x02)
    Packet Data Length: 1
    [Request in: 3547]
    [Time from request: 0.000156000 seconds]
    Control transfer stage: Complete (3)
    [bInterfaceClass: Unknown (0xffff)]
CONTROL response data: 30

No.     Time           Source                Destination           Protocol Length Info
   3549 2.927500       host                  1.9.0                 USB      36     URB_CONTROL out

Frame 3549: 36 bytes on wire (288 bits), 36 bytes captured (288 bits) on interface \\.\USBPcap1, id 0
    Section number: 1
    Interface id: 0 (\\.\USBPcap1)
        Interface name: \\.\USBPcap1
        Interface description: USBPcap1
    Encapsulation type: USB packets with USBPcap header (152)
    Arrival Time: Jun 22, 2025 18:49:57.938483000 Central Europe Daylight Time
    UTC Arrival Time: Jun 22, 2025 16:49:57.938483000 UTC
    Epoch Arrival Time: 1750610997.938483000
    [Time shift for this packet: 0.000000000 seconds]
    [Time delta from previous captured frame: 0.000007000 seconds]
    [Time delta from previous displayed frame: 0.000007000 seconds]
    [Time since reference or first frame: 2.927500000 seconds]
    Frame Number: 3549
    Frame Length: 36 bytes (288 bits)
    Capture Length: 36 bytes (288 bits)
    [Frame is marked: False]
    [Frame is ignored: False]
    [Protocols in frame: usb]
USB URB
    [Source: host]
    [Destination: 1.9.0]
    USBPcap pseudoheader length: 28
    IRP ID: 0xffffde073ea70560
    IRP USBD_STATUS: USBD_STATUS_SUCCESS (0x00000000)
    URB Function: URB_FUNCTION_VENDOR_DEVICE (0x0017)
    IRP information: 0x00, Direction: FDO -> PDO
        0000 000. = Reserved: 0x00
        .... ...0 = Direction: FDO -> PDO (0x0)
    URB bus id: 1
    Device address: 9
    Endpoint: 0x00, Direction: OUT
        0... .... = Direction: OUT (0)
        .... 0000 = Endpoint number: 0
    URB transfer type: URB_CONTROL (0x02)
    Packet Data Length: 8
    [Response in: 3550]
    Control transfer stage: Setup (0)
    [bInterfaceClass: Unknown (0xffff)]
Setup Data
    bmRequestType: 0x40
        0... .... = Direction: Host-to-device
        .10. .... = Type: Vendor (0x2)
        ...0 0000 = Recipient: Device (0x00)
    bRequest: 73
    wValue: 0x0030
    wIndex: 0 (0x0000)
    wLength: 0

No.     Time           Source                Destination           Protocol Length Info
   3550 2.927728       1.9.0                 host                  USB      28     URB_CONTROL out

Frame 3550: 28 bytes on wire (224 bits), 28 bytes captured (224 bits) on interface \\.\USBPcap1, id 0
    Section number: 1
    Interface id: 0 (\\.\USBPcap1)
        Interface name: \\.\USBPcap1
        Interface description: USBPcap1
    Encapsulation type: USB packets with USBPcap header (152)
    Arrival Time: Jun 22, 2025 18:49:57.938711000 Central Europe Daylight Time
    UTC Arrival Time: Jun 22, 2025 16:49:57.938711000 UTC
    Epoch Arrival Time: 1750610997.938711000
    [Time shift for this packet: 0.000000000 seconds]
    [Time delta from previous captured frame: 0.000228000 seconds]
    [Time delta from previous displayed frame: 0.000228000 seconds]
    [Time since reference or first frame: 2.927728000 seconds]
    Frame Number: 3550
    Frame Length: 28 bytes (224 bits)
    Capture Length: 28 bytes (224 bits)
    [Frame is marked: False]
    [Frame is ignored: False]
    [Protocols in frame: usb]
USB URB
    [Source: 1.9.0]
    [Destination: host]
    USBPcap pseudoheader length: 28
    IRP ID: 0xffffde073ea70560
    IRP USBD_STATUS: USBD_STATUS_SUCCESS (0x00000000)
    URB Function: URB_FUNCTION_CONTROL_TRANSFER (0x0008)
    IRP information: 0x01, Direction: PDO -> FDO
        0000 000. = Reserved: 0x00
        .... ...1 = Direction: PDO -> FDO (0x1)
    URB bus id: 1
    Device address: 9
    Endpoint: 0x00, Direction: OUT
        0... .... = Direction: OUT (0)
        .... 0000 = Endpoint number: 0
    URB transfer type: URB_CONTROL (0x02)
    Packet Data Length: 0
    [Request in: 3549]
    [Time from request: 0.000228000 seconds]
    Control transfer stage: Complete (3)
    [bInterfaceClass: Unknown (0xffff)]
