No.     Time           Source                Destination           Protocol Length Info
  13993 16.325597      host                  1.13.0                USB      36     GET DESCRIPTOR Request DEVICE

Frame 13993: 36 bytes on wire (288 bits), 36 bytes captured (288 bits) on interface \\.\USBPcap1, id 0
    Section number: 1
    Interface id: 0 (\\.\USBPcap1)
        Interface name: \\.\USBPcap1
        Interface description: USBPcap1
    Encapsulation type: USB packets with USBPcap header (152)
    Arrival Time: Jun 22, 2025 19:19:25.532461000 Central Europe Daylight Time
    UTC Arrival Time: Jun 22, 2025 17:19:25.532461000 UTC
    Epoch Arrival Time: 1750612765.532461000
    [Time shift for this packet: 0.000000000 seconds]
    [Time delta from previous captured frame: 1.439807000 seconds]
    [Time delta from previous displayed frame: 0.000000000 seconds]
    [Time since reference or first frame: 16.325597000 seconds]
    Frame Number: 13993
    Frame Length: 36 bytes (288 bits)
    Capture Length: 36 bytes (288 bits)
    [Frame is marked: False]
    [Frame is ignored: False]
    [Protocols in frame: usb]
USB URB
    [Source: host]
    [Destination: 1.13.0]
    USBPcap pseudoheader length: 28
    IRP ID: 0xffffde073c652a80
    IRP USBD_STATUS: USBD_STATUS_SUCCESS (0x00000000)
    URB Function: URB_FUNCTION_GET_DESCRIPTOR_FROM_DEVICE (0x000b)
    IRP information: 0x00, Direction: FDO -> PDO
        0000 000. = Reserved: 0x00
        .... ...0 = Direction: FDO -> PDO (0x0)
    URB bus id: 1
    Device address: 13
    Endpoint: 0x80, Direction: IN
        1... .... = Direction: IN (1)
        .... 0000 = Endpoint number: 0
    URB transfer type: URB_CONTROL (0x02)
    Packet Data Length: 8
    [Response in: 13994]
    Control transfer stage: Setup (0)
Setup Data
    bmRequestType: 0x80
        1... .... = Direction: Device-to-host
        .00. .... = Type: Standard (0x0)
        ...0 0000 = Recipient: Device (0x00)
    bRequest: GET DESCRIPTOR (6)
    Descriptor Index: 0x00
    bDescriptorType: DEVICE (0x01)
    Language Id: no language specified (0x0000)
    wLength: 18

No.     Time           Source                Destination           Protocol Length Info
  13994 16.325767      1.13.0                host                  USB      46     GET DESCRIPTOR Response DEVICE

Frame 13994: 46 bytes on wire (368 bits), 46 bytes captured (368 bits) on interface \\.\USBPcap1, id 0
    Section number: 1
    Interface id: 0 (\\.\USBPcap1)
        Interface name: \\.\USBPcap1
        Interface description: USBPcap1
    Encapsulation type: USB packets with USBPcap header (152)
    Arrival Time: Jun 22, 2025 19:19:25.532631000 Central Europe Daylight Time
    UTC Arrival Time: Jun 22, 2025 17:19:25.532631000 UTC
    Epoch Arrival Time: 1750612765.532631000
    [Time shift for this packet: 0.000000000 seconds]
    [Time delta from previous captured frame: 0.000170000 seconds]
    [Time delta from previous displayed frame: 0.000170000 seconds]
    [Time since reference or first frame: 16.325767000 seconds]
    Frame Number: 13994
    Frame Length: 46 bytes (368 bits)
    Capture Length: 46 bytes (368 bits)
    [Frame is marked: False]
    [Frame is ignored: False]
    [Protocols in frame: usb]
USB URB
    [Source: 1.13.0]
    [Destination: host]
    USBPcap pseudoheader length: 28
    IRP ID: 0xffffde073c652a80
    IRP USBD_STATUS: USBD_STATUS_SUCCESS (0x00000000)
    URB Function: URB_FUNCTION_CONTROL_TRANSFER (0x0008)
    IRP information: 0x01, Direction: PDO -> FDO
        0000 000. = Reserved: 0x00
        .... ...1 = Direction: PDO -> FDO (0x1)
    URB bus id: 1
    Device address: 13
    Endpoint: 0x80, Direction: IN
        1... .... = Direction: IN (1)
        .... 0000 = Endpoint number: 0
    URB transfer type: URB_CONTROL (0x02)
    Packet Data Length: 18
    [Request in: 13993]
    [Time from request: 0.000170000 seconds]
    Control transfer stage: Complete (3)
DEVICE DESCRIPTOR
    bLength: 18
    bDescriptorType: 0x01 (DEVICE)
    bcdUSB: 0x0200
    bDeviceClass: Vendor Specific (0xff)
    bDeviceSubClass: 255
    bDeviceProtocol: 255
    bMaxPacketSize0: 64
    idVendor: TEAC Corp. (0x0644)
    idProduct: Unknown (0x8020)
    bcdDevice: 0x0100
    iManufacturer: 1
    iProduct: 2
    iSerialNumber: 3
    bNumConfigurations: 1

No.     Time           Source                Destination           Protocol Length Info
  13995 16.393234      host                  1.13.0                USB      36     URB_CONTROL in

Frame 13995: 36 bytes on wire (288 bits), 36 bytes captured (288 bits) on interface \\.\USBPcap1, id 0
    Section number: 1
    Interface id: 0 (\\.\USBPcap1)
        Interface name: \\.\USBPcap1
        Interface description: USBPcap1
    Encapsulation type: USB packets with USBPcap header (152)
    Arrival Time: Jun 22, 2025 19:19:25.600098000 Central Europe Daylight Time
    UTC Arrival Time: Jun 22, 2025 17:19:25.600098000 UTC
    Epoch Arrival Time: 1750612765.600098000
    [Time shift for this packet: 0.000000000 seconds]
    [Time delta from previous captured frame: 0.067467000 seconds]
    [Time delta from previous displayed frame: 0.067467000 seconds]
    [Time since reference or first frame: 16.393234000 seconds]
    Frame Number: 13995
    Frame Length: 36 bytes (288 bits)
    Capture Length: 36 bytes (288 bits)
    [Frame is marked: False]
    [Frame is ignored: False]
    [Protocols in frame: usb]
USB URB
    [Source: host]
    [Destination: 1.13.0]
    USBPcap pseudoheader length: 28
    IRP ID: 0xffffde073777c2a0
    IRP USBD_STATUS: USBD_STATUS_SUCCESS (0x00000000)
    URB Function: URB_FUNCTION_VENDOR_DEVICE (0x0017)
    IRP information: 0x00, Direction: FDO -> PDO
        0000 000. = Reserved: 0x00
        .... ...0 = Direction: FDO -> PDO (0x0)
    URB bus id: 1
    Device address: 13
    Endpoint: 0x80, Direction: IN
        1... .... = Direction: IN (1)
        .... 0000 = Endpoint number: 0
    URB transfer type: URB_CONTROL (0x02)
    Packet Data Length: 8
    [Response in: 13996]
    Control transfer stage: Setup (0)
    [bInterfaceClass: Unknown (0xffff)]
Setup Data
    bmRequestType: 0xc0
        1... .... = Direction: Device-to-host
        .10. .... = Type: Vendor (0x2)
        ...0 0000 = Recipient: Device (0x00)
    bRequest: 86
    wValue: 0x0000
    wIndex: 0 (0x0000)
    wLength: 15

No.     Time           Source                Destination           Protocol Length Info
  13996 16.393386      1.13.0                host                  USB      43     URB_CONTROL in

Frame 13996: 43 bytes on wire (344 bits), 43 bytes captured (344 bits) on interface \\.\USBPcap1, id 0
    Section number: 1
    Interface id: 0 (\\.\USBPcap1)
        Interface name: \\.\USBPcap1
        Interface description: USBPcap1
    Encapsulation type: USB packets with USBPcap header (152)
    Arrival Time: Jun 22, 2025 19:19:25.600250000 Central Europe Daylight Time
    UTC Arrival Time: Jun 22, 2025 17:19:25.600250000 UTC
    Epoch Arrival Time: 1750612765.600250000
    [Time shift for this packet: 0.000000000 seconds]
    [Time delta from previous captured frame: 0.000152000 seconds]
    [Time delta from previous displayed frame: 0.000152000 seconds]
    [Time since reference or first frame: 16.393386000 seconds]
    Frame Number: 13996
    Frame Length: 43 bytes (344 bits)
    Capture Length: 43 bytes (344 bits)
    [Frame is marked: False]
    [Frame is ignored: False]
    [Protocols in frame: usb]
USB URB
    [Source: 1.13.0]
    [Destination: host]
    USBPcap pseudoheader length: 28
    IRP ID: 0xffffde073777c2a0
    IRP USBD_STATUS: USBD_STATUS_SUCCESS (0x00000000)
    URB Function: URB_FUNCTION_CONTROL_TRANSFER (0x0008)
    IRP information: 0x01, Direction: PDO -> FDO
        0000 000. = Reserved: 0x00
        .... ...1 = Direction: PDO -> FDO (0x1)
    URB bus id: 1
    Device address: 13
    Endpoint: 0x80, Direction: IN
        1... .... = Direction: IN (1)
        .... 0000 = Endpoint number: 0
    URB transfer type: URB_CONTROL (0x02)
    Packet Data Length: 15
    [Request in: 13995]
    [Time from request: 0.000152000 seconds]
    Control transfer stage: Complete (3)
    [bInterfaceClass: Unknown (0xffff)]
CONTROL response data: 31020356322e30332020202000ffff

No.     Time           Source                Destination           Protocol Length Info
  13997 16.393409      host                  1.13.0                USB      36     URB_CONTROL in

Frame 13997: 36 bytes on wire (288 bits), 36 bytes captured (288 bits) on interface \\.\USBPcap1, id 0
    Section number: 1
    Interface id: 0 (\\.\USBPcap1)
        Interface name: \\.\USBPcap1
        Interface description: USBPcap1
    Encapsulation type: USB packets with USBPcap header (152)
    Arrival Time: Jun 22, 2025 19:19:25.600273000 Central Europe Daylight Time
    UTC Arrival Time: Jun 22, 2025 17:19:25.600273000 UTC
    Epoch Arrival Time: 1750612765.600273000
    [Time shift for this packet: 0.000000000 seconds]
    [Time delta from previous captured frame: 0.000023000 seconds]
    [Time delta from previous displayed frame: 0.000023000 seconds]
    [Time since reference or first frame: 16.393409000 seconds]
    Frame Number: 13997
    Frame Length: 36 bytes (288 bits)
    Capture Length: 36 bytes (288 bits)
    [Frame is marked: False]
    [Frame is ignored: False]
    [Protocols in frame: usb]
USB URB
    [Source: host]
    [Destination: 1.13.0]
    USBPcap pseudoheader length: 28
    IRP ID: 0xffffde073777c2a0
    IRP USBD_STATUS: USBD_STATUS_SUCCESS (0x00000000)
    URB Function: URB_FUNCTION_VENDOR_DEVICE (0x0017)
    IRP information: 0x00, Direction: FDO -> PDO
        0000 000. = Reserved: 0x00
        .... ...0 = Direction: FDO -> PDO (0x0)
    URB bus id: 1
    Device address: 13
    Endpoint: 0x80, Direction: IN
        1... .... = Direction: IN (1)
        .... 0000 = Endpoint number: 0
    URB transfer type: URB_CONTROL (0x02)
    Packet Data Length: 8
    [Response in: 13998]
    Control transfer stage: Setup (0)
    [bInterfaceClass: Unknown (0xffff)]
Setup Data
    bmRequestType: 0xc0
        1... .... = Direction: Device-to-host
        .10. .... = Type: Vendor (0x2)
        ...0 0000 = Recipient: Device (0x00)
    bRequest: 86
    wValue: 0x0000
    wIndex: 0 (0x0000)
    wLength: 15

No.     Time           Source                Destination           Protocol Length Info
  13998 16.393527      1.13.0                host                  USB      43     URB_CONTROL in

Frame 13998: 43 bytes on wire (344 bits), 43 bytes captured (344 bits) on interface \\.\USBPcap1, id 0
    Section number: 1
    Interface id: 0 (\\.\USBPcap1)
        Interface name: \\.\USBPcap1
        Interface description: USBPcap1
    Encapsulation type: USB packets with USBPcap header (152)
    Arrival Time: Jun 22, 2025 19:19:25.600391000 Central Europe Daylight Time
    UTC Arrival Time: Jun 22, 2025 17:19:25.600391000 UTC
    Epoch Arrival Time: 1750612765.600391000
    [Time shift for this packet: 0.000000000 seconds]
    [Time delta from previous captured frame: 0.000118000 seconds]
    [Time delta from previous displayed frame: 0.000118000 seconds]
    [Time since reference or first frame: 16.393527000 seconds]
    Frame Number: 13998
    Frame Length: 43 bytes (344 bits)
    Capture Length: 43 bytes (344 bits)
    [Frame is marked: False]
    [Frame is ignored: False]
    [Protocols in frame: usb]
USB URB
    [Source: 1.13.0]
    [Destination: host]
    USBPcap pseudoheader length: 28
    IRP ID: 0xffffde073777c2a0
    IRP USBD_STATUS: USBD_STATUS_SUCCESS (0x00000000)
    URB Function: URB_FUNCTION_CONTROL_TRANSFER (0x0008)
    IRP information: 0x01, Direction: PDO -> FDO
        0000 000. = Reserved: 0x00
        .... ...1 = Direction: PDO -> FDO (0x1)
    URB bus id: 1
    Device address: 13
    Endpoint: 0x80, Direction: IN
        1... .... = Direction: IN (1)
        .... 0000 = Endpoint number: 0
    URB transfer type: URB_CONTROL (0x02)
    Packet Data Length: 15
    [Request in: 13997]
    [Time from request: 0.000118000 seconds]
    Control transfer stage: Complete (3)
    [bInterfaceClass: Unknown (0xffff)]
CONTROL response data: 31020356322e30332020202000ffff

No.     Time           Source                Destination           Protocol Length Info
  13999 16.393604      host                  1.13.0                USB      36     GET DESCRIPTOR Request STRING

Frame 13999: 36 bytes on wire (288 bits), 36 bytes captured (288 bits) on interface \\.\USBPcap1, id 0
    Section number: 1
    Interface id: 0 (\\.\USBPcap1)
        Interface name: \\.\USBPcap1
        Interface description: USBPcap1
    Encapsulation type: USB packets with USBPcap header (152)
    Arrival Time: Jun 22, 2025 19:19:25.600468000 Central Europe Daylight Time
    UTC Arrival Time: Jun 22, 2025 17:19:25.600468000 UTC
    Epoch Arrival Time: 1750612765.600468000
    [Time shift for this packet: 0.000000000 seconds]
    [Time delta from previous captured frame: 0.000077000 seconds]
    [Time delta from previous displayed frame: 0.000077000 seconds]
    [Time since reference or first frame: 16.393604000 seconds]
    Frame Number: 13999
    Frame Length: 36 bytes (288 bits)
    Capture Length: 36 bytes (288 bits)
    [Frame is marked: False]
    [Frame is ignored: False]
    [Protocols in frame: usb]
USB URB
    [Source: host]
    [Destination: 1.13.0]
    USBPcap pseudoheader length: 28
    IRP ID: 0xffffde073777c2a0
    IRP USBD_STATUS: Unknown (0xffffde07)
    URB Function: URB_FUNCTION_GET_DESCRIPTOR_FROM_DEVICE (0x000b)
    IRP information: 0x00, Direction: FDO -> PDO
        0000 000. = Reserved: 0x00
        .... ...0 = Direction: FDO -> PDO (0x0)
    URB bus id: 1
    Device address: 13
    Endpoint: 0x80, Direction: IN
        1... .... = Direction: IN (1)
        .... 0000 = Endpoint number: 0
    URB transfer type: URB_CONTROL (0x02)
    Packet Data Length: 8
    [Response in: 14000]
    Control transfer stage: Setup (0)
Setup Data
    bmRequestType: 0x80
        1... .... = Direction: Device-to-host
        .00. .... = Type: Standard (0x0)
        ...0 0000 = Recipient: Device (0x00)
    bRequest: GET DESCRIPTOR (6)
    Descriptor Index: 0x01
    bDescriptorType: STRING (0x03)
    Language Id: no language specified (0x0000)
    wLength: 514

No.     Time           Source                Destination           Protocol Length Info
  14000 16.393759      1.13.0                host                  USB      42     GET DESCRIPTOR Response STRING

Frame 14000: 42 bytes on wire (336 bits), 42 bytes captured (336 bits) on interface \\.\USBPcap1, id 0
    Section number: 1
    Interface id: 0 (\\.\USBPcap1)
        Interface name: \\.\USBPcap1
        Interface description: USBPcap1
    Encapsulation type: USB packets with USBPcap header (152)
    Arrival Time: Jun 22, 2025 19:19:25.600623000 Central Europe Daylight Time
    UTC Arrival Time: Jun 22, 2025 17:19:25.600623000 UTC
    Epoch Arrival Time: 1750612765.600623000
    [Time shift for this packet: 0.000000000 seconds]
    [Time delta from previous captured frame: 0.000155000 seconds]
    [Time delta from previous displayed frame: 0.000155000 seconds]
    [Time since reference or first frame: 16.393759000 seconds]
    Frame Number: 14000
    Frame Length: 42 bytes (336 bits)
    Capture Length: 42 bytes (336 bits)
    [Frame is marked: False]
    [Frame is ignored: False]
    [Protocols in frame: usb]
USB URB
    [Source: 1.13.0]
    [Destination: host]
    USBPcap pseudoheader length: 28
    IRP ID: 0xffffde073777c2a0
    IRP USBD_STATUS: USBD_STATUS_SUCCESS (0x00000000)
    URB Function: URB_FUNCTION_CONTROL_TRANSFER (0x0008)
    IRP information: 0x01, Direction: PDO -> FDO
        0000 000. = Reserved: 0x00
        .... ...1 = Direction: PDO -> FDO (0x1)
    URB bus id: 1
    Device address: 13
    Endpoint: 0x80, Direction: IN
        1... .... = Direction: IN (1)
        .... 0000 = Endpoint number: 0
    URB transfer type: URB_CONTROL (0x02)
    Packet Data Length: 14
    [Request in: 13999]
    [Time from request: 0.000155000 seconds]
    Control transfer stage: Complete (3)
STRING DESCRIPTOR
    bLength: 14
    bDescriptorType: 0x03 (STRING)
    bString: TASCAM

No.     Time           Source                Destination           Protocol Length Info
  14001 16.393818      host                  1.13.0                USB      36     GET DESCRIPTOR Request STRING

Frame 14001: 36 bytes on wire (288 bits), 36 bytes captured (288 bits) on interface \\.\USBPcap1, id 0
    Section number: 1
    Interface id: 0 (\\.\USBPcap1)
        Interface name: \\.\USBPcap1
        Interface description: USBPcap1
    Encapsulation type: USB packets with USBPcap header (152)
    Arrival Time: Jun 22, 2025 19:19:25.600682000 Central Europe Daylight Time
    UTC Arrival Time: Jun 22, 2025 17:19:25.600682000 UTC
    Epoch Arrival Time: 1750612765.600682000
    [Time shift for this packet: 0.000000000 seconds]
    [Time delta from previous captured frame: 0.000059000 seconds]
    [Time delta from previous displayed frame: 0.000059000 seconds]
    [Time since reference or first frame: 16.393818000 seconds]
    Frame Number: 14001
    Frame Length: 36 bytes (288 bits)
    Capture Length: 36 bytes (288 bits)
    [Frame is marked: False]
    [Frame is ignored: False]
    [Protocols in frame: usb]
USB URB
    [Source: host]
    [Destination: 1.13.0]
    USBPcap pseudoheader length: 28
    IRP ID: 0xffffde073777c2a0
    IRP USBD_STATUS: USBD_STATUS_SUCCESS (0x00000000)
    URB Function: URB_FUNCTION_GET_DESCRIPTOR_FROM_DEVICE (0x000b)
    IRP information: 0x00, Direction: FDO -> PDO
        0000 000. = Reserved: 0x00
        .... ...0 = Direction: FDO -> PDO (0x0)
    URB bus id: 1
    Device address: 13
    Endpoint: 0x80, Direction: IN
        1... .... = Direction: IN (1)
        .... 0000 = Endpoint number: 0
    URB transfer type: URB_CONTROL (0x02)
    Packet Data Length: 8
    [Response in: 14002]
    Control transfer stage: Setup (0)
Setup Data
    bmRequestType: 0x80
        1... .... = Direction: Device-to-host
        .00. .... = Type: Standard (0x0)
        ...0 0000 = Recipient: Device (0x00)
    bRequest: GET DESCRIPTOR (6)
    Descriptor Index: 0x02
    bDescriptorType: STRING (0x03)
    Language Id: no language specified (0x0000)
    wLength: 514

No.     Time           Source                Destination           Protocol Length Info
  14002 16.394017      1.13.0                host                  USB      52     GET DESCRIPTOR Response STRING

Frame 14002: 52 bytes on wire (416 bits), 52 bytes captured (416 bits) on interface \\.\USBPcap1, id 0
    Section number: 1
    Interface id: 0 (\\.\USBPcap1)
        Interface name: \\.\USBPcap1
        Interface description: USBPcap1
    Encapsulation type: USB packets with USBPcap header (152)
    Arrival Time: Jun 22, 2025 19:19:25.600881000 Central Europe Daylight Time
    UTC Arrival Time: Jun 22, 2025 17:19:25.600881000 UTC
    Epoch Arrival Time: 1750612765.600881000
    [Time shift for this packet: 0.000000000 seconds]
    [Time delta from previous captured frame: 0.000199000 seconds]
    [Time delta from previous displayed frame: 0.000199000 seconds]
    [Time since reference or first frame: 16.394017000 seconds]
    Frame Number: 14002
    Frame Length: 52 bytes (416 bits)
    Capture Length: 52 bytes (416 bits)
    [Frame is marked: False]
    [Frame is ignored: False]
    [Protocols in frame: usb]
USB URB
    [Source: 1.13.0]
    [Destination: host]
    USBPcap pseudoheader length: 28
    IRP ID: 0xffffde073777c2a0
    IRP USBD_STATUS: USBD_STATUS_SUCCESS (0x00000000)
    URB Function: URB_FUNCTION_CONTROL_TRANSFER (0x0008)
    IRP information: 0x01, Direction: PDO -> FDO
        0000 000. = Reserved: 0x00
        .... ...1 = Direction: PDO -> FDO (0x1)
    URB bus id: 1
    Device address: 13
    Endpoint: 0x80, Direction: IN
        1... .... = Direction: IN (1)
        .... 0000 = Endpoint number: 0
    URB transfer type: URB_CONTROL (0x02)
    Packet Data Length: 24
    [Request in: 14001]
    [Time from request: 0.000199000 seconds]
    Control transfer stage: Complete (3)
STRING DESCRIPTOR
    bLength: 24
    bDescriptorType: 0x03 (STRING)
    bString: US-144 MKII

No.     Time           Source                Destination           Protocol Length Info
  14003 16.394087      host                  1.13.0                USB      36     GET DESCRIPTOR Request STRING

Frame 14003: 36 bytes on wire (288 bits), 36 bytes captured (288 bits) on interface \\.\USBPcap1, id 0
    Section number: 1
    Interface id: 0 (\\.\USBPcap1)
        Interface name: \\.\USBPcap1
        Interface description: USBPcap1
    Encapsulation type: USB packets with USBPcap header (152)
    Arrival Time: Jun 22, 2025 19:19:25.600951000 Central Europe Daylight Time
    UTC Arrival Time: Jun 22, 2025 17:19:25.600951000 UTC
    Epoch Arrival Time: 1750612765.600951000
    [Time shift for this packet: 0.000000000 seconds]
    [Time delta from previous captured frame: 0.000070000 seconds]
    [Time delta from previous displayed frame: 0.000070000 seconds]
    [Time since reference or first frame: 16.394087000 seconds]
    Frame Number: 14003
    Frame Length: 36 bytes (288 bits)
    Capture Length: 36 bytes (288 bits)
    [Frame is marked: False]
    [Frame is ignored: False]
    [Protocols in frame: usb]
USB URB
    [Source: host]
    [Destination: 1.13.0]
    USBPcap pseudoheader length: 28
    IRP ID: 0xffffde073777c2a0
    IRP USBD_STATUS: USBD_STATUS_SUCCESS (0x00000000)
    URB Function: URB_FUNCTION_GET_DESCRIPTOR_FROM_DEVICE (0x000b)
    IRP information: 0x00, Direction: FDO -> PDO
        0000 000. = Reserved: 0x00
        .... ...0 = Direction: FDO -> PDO (0x0)
    URB bus id: 1
    Device address: 13
    Endpoint: 0x80, Direction: IN
        1... .... = Direction: IN (1)
        .... 0000 = Endpoint number: 0
    URB transfer type: URB_CONTROL (0x02)
    Packet Data Length: 8
    [Response in: 14004]
    Control transfer stage: Setup (0)
Setup Data
    bmRequestType: 0x80
        1... .... = Direction: Device-to-host
        .00. .... = Type: Standard (0x0)
        ...0 0000 = Recipient: Device (0x00)
    bRequest: GET DESCRIPTOR (6)
    Descriptor Index: 0x03
    bDescriptorType: STRING (0x03)
    Language Id: no language specified (0x0000)
    wLength: 514

No.     Time           Source                Destination           Protocol Length Info
  14004 16.394259      1.13.0                host                  USB      62     GET DESCRIPTOR Response STRING

Frame 14004: 62 bytes on wire (496 bits), 62 bytes captured (496 bits) on interface \\.\USBPcap1, id 0
    Section number: 1
    Interface id: 0 (\\.\USBPcap1)
        Interface name: \\.\USBPcap1
        Interface description: USBPcap1
    Encapsulation type: USB packets with USBPcap header (152)
    Arrival Time: Jun 22, 2025 19:19:25.601123000 Central Europe Daylight Time
    UTC Arrival Time: Jun 22, 2025 17:19:25.601123000 UTC
    Epoch Arrival Time: 1750612765.601123000
    [Time shift for this packet: 0.000000000 seconds]
    [Time delta from previous captured frame: 0.000172000 seconds]
    [Time delta from previous displayed frame: 0.000172000 seconds]
    [Time since reference or first frame: 16.394259000 seconds]
    Frame Number: 14004
    Frame Length: 62 bytes (496 bits)
    Capture Length: 62 bytes (496 bits)
    [Frame is marked: False]
    [Frame is ignored: False]
    [Protocols in frame: usb]
USB URB
    [Source: 1.13.0]
    [Destination: host]
    USBPcap pseudoheader length: 28
    IRP ID: 0xffffde073777c2a0
    IRP USBD_STATUS: USBD_STATUS_SUCCESS (0x00000000)
    URB Function: URB_FUNCTION_CONTROL_TRANSFER (0x0008)
    IRP information: 0x01, Direction: PDO -> FDO
        0000 000. = Reserved: 0x00
        .... ...1 = Direction: PDO -> FDO (0x1)
    URB bus id: 1
    Device address: 13
    Endpoint: 0x80, Direction: IN
        1... .... = Direction: IN (1)
        .... 0000 = Endpoint number: 0
    URB transfer type: URB_CONTROL (0x02)
    Packet Data Length: 34
    [Request in: 14003]
    [Time from request: 0.000172000 seconds]
    Control transfer stage: Complete (3)
STRING DESCRIPTOR
    bLength: 34
    bDescriptorType: 0x03 (STRING)
    bString: no serial number

No.     Time           Source                Destination           Protocol Length Info
  14005 16.394274      host                  1.13.0                USB      36     GET DESCRIPTOR Request CONFIGURATION

Frame 14005: 36 bytes on wire (288 bits), 36 bytes captured (288 bits) on interface \\.\USBPcap1, id 0
    Section number: 1
    Interface id: 0 (\\.\USBPcap1)
        Interface name: \\.\USBPcap1
        Interface description: USBPcap1
    Encapsulation type: USB packets with USBPcap header (152)
    Arrival Time: Jun 22, 2025 19:19:25.601138000 Central Europe Daylight Time
    UTC Arrival Time: Jun 22, 2025 17:19:25.601138000 UTC
    Epoch Arrival Time: 1750612765.601138000
    [Time shift for this packet: 0.000000000 seconds]
    [Time delta from previous captured frame: 0.000015000 seconds]
    [Time delta from previous displayed frame: 0.000015000 seconds]
    [Time since reference or first frame: 16.394274000 seconds]
    Frame Number: 14005
    Frame Length: 36 bytes (288 bits)
    Capture Length: 36 bytes (288 bits)
    [Frame is marked: False]
    [Frame is ignored: False]
    [Protocols in frame: usb]
USB URB
    [Source: host]
    [Destination: 1.13.0]
    USBPcap pseudoheader length: 28
    IRP ID: 0xffffde07385137d0
    IRP USBD_STATUS: USBD_STATUS_SUCCESS (0x00000000)
    URB Function: URB_FUNCTION_GET_DESCRIPTOR_FROM_DEVICE (0x000b)
    IRP information: 0x00, Direction: FDO -> PDO
        0000 000. = Reserved: 0x00
        .... ...0 = Direction: FDO -> PDO (0x0)
    URB bus id: 1
    Device address: 13
    Endpoint: 0x80, Direction: IN
        1... .... = Direction: IN (1)
        .... 0000 = Endpoint number: 0
    URB transfer type: URB_CONTROL (0x02)
    Packet Data Length: 8
    [Response in: 14006]
    Control transfer stage: Setup (0)
Setup Data
    bmRequestType: 0x80
        1... .... = Direction: Device-to-host
        .00. .... = Type: Standard (0x0)
        ...0 0000 = Recipient: Device (0x00)
    bRequest: GET DESCRIPTOR (6)
    Descriptor Index: 0x00
    bDescriptorType: CONFIGURATION (0x02)
    Language Id: no language specified (0x0000)
    wLength: 1033

No.     Time           Source                Destination           Protocol Length Info
  14006 16.394565      1.13.0                host                  USB      108    GET DESCRIPTOR Response CONFIGURATION

Frame 14006: 108 bytes on wire (864 bits), 108 bytes captured (864 bits) on interface \\.\USBPcap1, id 0
    Section number: 1
    Interface id: 0 (\\.\USBPcap1)
        Interface name: \\.\USBPcap1
        Interface description: USBPcap1
    Encapsulation type: USB packets with USBPcap header (152)
    Arrival Time: Jun 22, 2025 19:19:25.601429000 Central Europe Daylight Time
    UTC Arrival Time: Jun 22, 2025 17:19:25.601429000 UTC
    Epoch Arrival Time: 1750612765.601429000
    [Time shift for this packet: 0.000000000 seconds]
    [Time delta from previous captured frame: 0.000291000 seconds]
    [Time delta from previous displayed frame: 0.000291000 seconds]
    [Time since reference or first frame: 16.394565000 seconds]
    Frame Number: 14006
    Frame Length: 108 bytes (864 bits)
    Capture Length: 108 bytes (864 bits)
    [Frame is marked: False]
    [Frame is ignored: False]
    [Protocols in frame: usb]
USB URB
    [Source: 1.13.0]
    [Destination: host]
    USBPcap pseudoheader length: 28
    IRP ID: 0xffffde07385137d0
    IRP USBD_STATUS: USBD_STATUS_SUCCESS (0x00000000)
    URB Function: URB_FUNCTION_CONTROL_TRANSFER (0x0008)
    IRP information: 0x01, Direction: PDO -> FDO
        0000 000. = Reserved: 0x00
        .... ...1 = Direction: PDO -> FDO (0x1)
    URB bus id: 1
    Device address: 13
    Endpoint: 0x80, Direction: IN
        1... .... = Direction: IN (1)
        .... 0000 = Endpoint number: 0
    URB transfer type: URB_CONTROL (0x02)
    Packet Data Length: 80
    [Request in: 14005]
    [Time from request: 0.000291000 seconds]
    Control transfer stage: Complete (3)
CONFIGURATION DESCRIPTOR
    bLength: 9
    bDescriptorType: 0x02 (CONFIGURATION)
    wTotalLength: 80
    bNumInterfaces: 2
    bConfigurationValue: 1
    iConfiguration: 0
    Configuration bmAttributes: 0x80  NOT SELF-POWERED  NO REMOTE-WAKEUP
        1... .... = Must be 1: Must be 1 for USB 1.1 and higher
        .0.. .... = Self-Powered: This device is powered from the USB bus
        ..0. .... = Remote Wakeup: This device does NOT support remote wakeup
    bMaxPower: 240  (480mA)
INTERFACE DESCRIPTOR (0.0): class Vendor Specific
    bLength: 9
    bDescriptorType: 0x04 (INTERFACE)
    bInterfaceNumber: 0
    bAlternateSetting: 0
    bNumEndpoints: 0
    bInterfaceClass: Vendor Specific (0xff)
    bInterfaceSubClass: 0x00
    bInterfaceProtocol: 0x00
    iInterface: 0
INTERFACE DESCRIPTOR (0.1): class Vendor Specific
    bLength: 9
    bDescriptorType: 0x04 (INTERFACE)
    bInterfaceNumber: 0
    bAlternateSetting: 1
    bNumEndpoints: 3
    bInterfaceClass: Vendor Specific (0xff)
    bInterfaceSubClass: 0x00
    bInterfaceProtocol: 0x00
    iInterface: 0
ENDPOINT DESCRIPTOR
    bLength: 7
    bDescriptorType: 0x05 (ENDPOINT)
    bEndpointAddress: 0x02  OUT  Endpoint:2
        0... .... = Direction: OUT Endpoint
        .... 0010 = Endpoint Number: 0x2
    bmAttributes: 0x05
        .... ..01 = Transfertype: Isochronous-Transfer (0x1)
        .... 01.. = Synchronisationtype: Asynchronous (0x1)
        ..00 .... = Behaviourtype: Data-Endpoint (0x0)
    wMaxPacketSize: 156
        ...0 0... .... .... = Transactions per microframe: 1 (0)
        .... .000 1001 1100 = Maximum Packet Size: 156
    bInterval: 1
ENDPOINT DESCRIPTOR
    bLength: 7
    bDescriptorType: 0x05 (ENDPOINT)
    bEndpointAddress: 0x83  IN  Endpoint:3
        1... .... = Direction: IN Endpoint
        .... 0011 = Endpoint Number: 0x3
    bmAttributes: 0x02
        .... ..10 = Transfertype: Bulk-Transfer (0x2)
    wMaxPacketSize: 512
        .... .010 0000 0000 = Maximum Packet Size: 512
    bInterval: 4
ENDPOINT DESCRIPTOR
    bLength: 7
    bDescriptorType: 0x05 (ENDPOINT)
    bEndpointAddress: 0x04  OUT  Endpoint:4
        0... .... = Direction: OUT Endpoint
        .... 0100 = Endpoint Number: 0x4
    bmAttributes: 0x02
        .... ..10 = Transfertype: Bulk-Transfer (0x2)
    wMaxPacketSize: 512
        .... .010 0000 0000 = Maximum Packet Size: 512
    bInterval: 4
INTERFACE DESCRIPTOR (1.0): class Vendor Specific
    bLength: 9
    bDescriptorType: 0x04 (INTERFACE)
    bInterfaceNumber: 1
    bAlternateSetting: 0
    bNumEndpoints: 0
    bInterfaceClass: Vendor Specific (0xff)
    bInterfaceSubClass: 0x00
    bInterfaceProtocol: 0x00
    iInterface: 0
INTERFACE DESCRIPTOR (1.1): class Vendor Specific
    bLength: 9
    bDescriptorType: 0x04 (INTERFACE)
    bInterfaceNumber: 1
    bAlternateSetting: 1
    bNumEndpoints: 2
    bInterfaceClass: Vendor Specific (0xff)
    bInterfaceSubClass: 0x00
    bInterfaceProtocol: 0x00
    iInterface: 0
ENDPOINT DESCRIPTOR
    bLength: 7
    bDescriptorType: 0x05 (ENDPOINT)
    bEndpointAddress: 0x81  IN  Endpoint:1
        1... .... = Direction: IN Endpoint
        .... 0001 = Endpoint Number: 0x1
    bmAttributes: 0x05
        .... ..01 = Transfertype: Isochronous-Transfer (0x1)
        .... 01.. = Synchronisationtype: Asynchronous (0x1)
        ..00 .... = Behaviourtype: Data-Endpoint (0x0)
    wMaxPacketSize: 64
        ...0 0... .... .... = Transactions per microframe: 1 (0)
        .... .000 0100 0000 = Maximum Packet Size: 64
    bInterval: 4
ENDPOINT DESCRIPTOR
    bLength: 7
    bDescriptorType: 0x05 (ENDPOINT)
    bEndpointAddress: 0x86  IN  Endpoint:6
        1... .... = Direction: IN Endpoint
        .... 0110 = Endpoint Number: 0x6
    bmAttributes: 0x02
        .... ..10 = Transfertype: Bulk-Transfer (0x2)
    wMaxPacketSize: 512
        .... .010 0000 0000 = Maximum Packet Size: 512
    bInterval: 1

No.     Time           Source                Destination           Protocol Length Info
  14007 16.397749      host                  1.13.0                USB      36     GET DESCRIPTOR Request DEVICE

Frame 14007: 36 bytes on wire (288 bits), 36 bytes captured (288 bits) on interface \\.\USBPcap1, id 0
    Section number: 1
    Interface id: 0 (\\.\USBPcap1)
        Interface name: \\.\USBPcap1
        Interface description: USBPcap1
    Encapsulation type: USB packets with USBPcap header (152)
    Arrival Time: Jun 22, 2025 19:19:25.604613000 Central Europe Daylight Time
    UTC Arrival Time: Jun 22, 2025 17:19:25.604613000 UTC
    Epoch Arrival Time: 1750612765.604613000
    [Time shift for this packet: 0.000000000 seconds]
    [Time delta from previous captured frame: 0.003184000 seconds]
    [Time delta from previous displayed frame: 0.003184000 seconds]
    [Time since reference or first frame: 16.397749000 seconds]
    Frame Number: 14007
    Frame Length: 36 bytes (288 bits)
    Capture Length: 36 bytes (288 bits)
    [Frame is marked: False]
    [Frame is ignored: False]
    [Protocols in frame: usb]
USB URB
    [Source: host]
    [Destination: 1.13.0]
    USBPcap pseudoheader length: 28
    IRP ID: 0xffffde073777c2a0
    IRP USBD_STATUS: Unknown (0xffffde07)
    URB Function: URB_FUNCTION_GET_DESCRIPTOR_FROM_DEVICE (0x000b)
    IRP information: 0x00, Direction: FDO -> PDO
        0000 000. = Reserved: 0x00
        .... ...0 = Direction: FDO -> PDO (0x0)
    URB bus id: 1
    Device address: 13
    Endpoint: 0x80, Direction: IN
        1... .... = Direction: IN (1)
        .... 0000 = Endpoint number: 0
    URB transfer type: URB_CONTROL (0x02)
    Packet Data Length: 8
    [Response in: 14008]
    Control transfer stage: Setup (0)
Setup Data
    bmRequestType: 0x80
        1... .... = Direction: Device-to-host
        .00. .... = Type: Standard (0x0)
        ...0 0000 = Recipient: Device (0x00)
    bRequest: GET DESCRIPTOR (6)
    Descriptor Index: 0x00
    bDescriptorType: DEVICE (0x01)
    Language Id: no language specified (0x0000)
    wLength: 18

No.     Time           Source                Destination           Protocol Length Info
  14008 16.397905      1.13.0                host                  USB      46     GET DESCRIPTOR Response DEVICE

Frame 14008: 46 bytes on wire (368 bits), 46 bytes captured (368 bits) on interface \\.\USBPcap1, id 0
    Section number: 1
    Interface id: 0 (\\.\USBPcap1)
        Interface name: \\.\USBPcap1
        Interface description: USBPcap1
    Encapsulation type: USB packets with USBPcap header (152)
    Arrival Time: Jun 22, 2025 19:19:25.604769000 Central Europe Daylight Time
    UTC Arrival Time: Jun 22, 2025 17:19:25.604769000 UTC
    Epoch Arrival Time: 1750612765.604769000
    [Time shift for this packet: 0.000000000 seconds]
    [Time delta from previous captured frame: 0.000156000 seconds]
    [Time delta from previous displayed frame: 0.000156000 seconds]
    [Time since reference or first frame: 16.397905000 seconds]
    Frame Number: 14008
    Frame Length: 46 bytes (368 bits)
    Capture Length: 46 bytes (368 bits)
    [Frame is marked: False]
    [Frame is ignored: False]
    [Protocols in frame: usb]
USB URB
    [Source: 1.13.0]
    [Destination: host]
    USBPcap pseudoheader length: 28
    IRP ID: 0xffffde073777c2a0
    IRP USBD_STATUS: USBD_STATUS_SUCCESS (0x00000000)
    URB Function: URB_FUNCTION_CONTROL_TRANSFER (0x0008)
    IRP information: 0x01, Direction: PDO -> FDO
        0000 000. = Reserved: 0x00
        .... ...1 = Direction: PDO -> FDO (0x1)
    URB bus id: 1
    Device address: 13
    Endpoint: 0x80, Direction: IN
        1... .... = Direction: IN (1)
        .... 0000 = Endpoint number: 0
    URB transfer type: URB_CONTROL (0x02)
    Packet Data Length: 18
    [Request in: 14007]
    [Time from request: 0.000156000 seconds]
    Control transfer stage: Complete (3)
DEVICE DESCRIPTOR
    bLength: 18
    bDescriptorType: 0x01 (DEVICE)
    bcdUSB: 0x0200
    bDeviceClass: Vendor Specific (0xff)
    bDeviceSubClass: 255
    bDeviceProtocol: 255
    bMaxPacketSize0: 64
    idVendor: TEAC Corp. (0x0644)
    idProduct: Unknown (0x8020)
    bcdDevice: 0x0100
    iManufacturer: 1
    iProduct: 2
    iSerialNumber: 3
    bNumConfigurations: 1

No.     Time           Source                Destination           Protocol Length Info
  14009 16.397923      host                  1.13.0                USB      36     SET CONFIGURATION Request

Frame 14009: 36 bytes on wire (288 bits), 36 bytes captured (288 bits) on interface \\.\USBPcap1, id 0
    Section number: 1
    Interface id: 0 (\\.\USBPcap1)
        Interface name: \\.\USBPcap1
        Interface description: USBPcap1
    Encapsulation type: USB packets with USBPcap header (152)
    Arrival Time: Jun 22, 2025 19:19:25.604787000 Central Europe Daylight Time
    UTC Arrival Time: Jun 22, 2025 17:19:25.604787000 UTC
    Epoch Arrival Time: 1750612765.604787000
    [Time shift for this packet: 0.000000000 seconds]
    [Time delta from previous captured frame: 0.000018000 seconds]
    [Time delta from previous displayed frame: 0.000018000 seconds]
    [Time since reference or first frame: 16.397923000 seconds]
    Frame Number: 14009
    Frame Length: 36 bytes (288 bits)
    Capture Length: 36 bytes (288 bits)
    [Frame is marked: False]
    [Frame is ignored: False]
    [Protocols in frame: usb]
USB URB
    [Source: host]
    [Destination: 1.13.0]
    USBPcap pseudoheader length: 28
    IRP ID: 0xffffde073777c2a0
    IRP USBD_STATUS: USBD_STATUS_SUCCESS (0x00000000)
    URB Function: URB_FUNCTION_SELECT_CONFIGURATION (0x0000)
    IRP information: 0x00, Direction: FDO -> PDO
        0000 000. = Reserved: 0x00
        .... ...0 = Direction: FDO -> PDO (0x0)
    URB bus id: 1
    Device address: 13
    Endpoint: 0x00, Direction: OUT
        0... .... = Direction: OUT (0)
        .... 0000 = Endpoint number: 0
    URB transfer type: URB_CONTROL (0x02)
    Packet Data Length: 8
    [Response in: 14010]
    Control transfer stage: Setup (0)
Setup Data
    bmRequestType: 0x00
        0... .... = Direction: Host-to-device
        .00. .... = Type: Standard (0x0)
        ...0 0000 = Recipient: Device (0x00)
    bRequest: SET CONFIGURATION (9)
    bConfigurationValue: 1
    wIndex: 0 (0x0000)
    wLength: 0

No.     Time           Source                Destination           Protocol Length Info
  14010 16.632568      1.13.0                host                  USB      28     SET CONFIGURATION Response

Frame 14010: 28 bytes on wire (224 bits), 28 bytes captured (224 bits) on interface \\.\USBPcap1, id 0
    Section number: 1
    Interface id: 0 (\\.\USBPcap1)
        Interface name: \\.\USBPcap1
        Interface description: USBPcap1
    Encapsulation type: USB packets with USBPcap header (152)
    Arrival Time: Jun 22, 2025 19:19:25.839432000 Central Europe Daylight Time
    UTC Arrival Time: Jun 22, 2025 17:19:25.839432000 UTC
    Epoch Arrival Time: 1750612765.839432000
    [Time shift for this packet: 0.000000000 seconds]
    [Time delta from previous captured frame: 0.234645000 seconds]
    [Time delta from previous displayed frame: 0.234645000 seconds]
    [Time since reference or first frame: 16.632568000 seconds]
    Frame Number: 14010
    Frame Length: 28 bytes (224 bits)
    Capture Length: 28 bytes (224 bits)
    [Frame is marked: False]
    [Frame is ignored: False]
    [Protocols in frame: usb]
USB URB
    [Source: 1.13.0]
    [Destination: host]
    USBPcap pseudoheader length: 28
    IRP ID: 0xffffde073777c2a0
    IRP USBD_STATUS: USBD_STATUS_SUCCESS (0x00000000)
    URB Function: URB_FUNCTION_SELECT_CONFIGURATION (0x0000)
    IRP information: 0x01, Direction: PDO -> FDO
        0000 000. = Reserved: 0x00
        .... ...1 = Direction: PDO -> FDO (0x1)
    URB bus id: 1
    Device address: 13
    Endpoint: 0x00, Direction: OUT
        0... .... = Direction: OUT (0)
        .... 0000 = Endpoint number: 0
    URB transfer type: URB_CONTROL (0x02)
    Packet Data Length: 0
    [Request in: 14009]
    [Time from request: 0.234645000 seconds]
    Control transfer stage: Complete (3)

No.     Time           Source                Destination           Protocol Length Info
  14011 16.848715      host                  1.13.0                USB      36     URB_CONTROL in

Frame 14011: 36 bytes on wire (288 bits), 36 bytes captured (288 bits) on interface \\.\USBPcap1, id 0
    Section number: 1
    Interface id: 0 (\\.\USBPcap1)
        Interface name: \\.\USBPcap1
        Interface description: USBPcap1
    Encapsulation type: USB packets with USBPcap header (152)
    Arrival Time: Jun 22, 2025 19:19:26.055579000 Central Europe Daylight Time
    UTC Arrival Time: Jun 22, 2025 17:19:26.055579000 UTC
    Epoch Arrival Time: 1750612766.055579000
    [Time shift for this packet: 0.000000000 seconds]
    [Time delta from previous captured frame: 0.216147000 seconds]
    [Time delta from previous displayed frame: 0.216147000 seconds]
    [Time since reference or first frame: 16.848715000 seconds]
    Frame Number: 14011
    Frame Length: 36 bytes (288 bits)
    Capture Length: 36 bytes (288 bits)
    [Frame is marked: False]
    [Frame is ignored: False]
    [Protocols in frame: usb]
USB URB
    [Source: host]
    [Destination: 1.13.0]
    USBPcap pseudoheader length: 28
    IRP ID: 0xffffde073c695010
    IRP USBD_STATUS: USBD_STATUS_SUCCESS (0x00000000)
    URB Function: URB_FUNCTION_VENDOR_DEVICE (0x0017)
    IRP information: 0x00, Direction: FDO -> PDO
        0000 000. = Reserved: 0x00
        .... ...0 = Direction: FDO -> PDO (0x0)
    URB bus id: 1
    Device address: 13
    Endpoint: 0x80, Direction: IN
        1... .... = Direction: IN (1)
        .... 0000 = Endpoint number: 0
    URB transfer type: URB_CONTROL (0x02)
    Packet Data Length: 8
    [Response in: 14012]
    Control transfer stage: Setup (0)
    [bInterfaceClass: Unknown (0xffff)]
Setup Data
    bmRequestType: 0xc0
        1... .... = Direction: Device-to-host
        .10. .... = Type: Vendor (0x2)
        ...0 0000 = Recipient: Device (0x00)
    bRequest: 73
    wValue: 0x0000
    wIndex: 0 (0x0000)
    wLength: 1

No.     Time           Source                Destination           Protocol Length Info
  14012 16.848996      1.13.0                host                  USB      29     URB_CONTROL in

Frame 14012: 29 bytes on wire (232 bits), 29 bytes captured (232 bits) on interface \\.\USBPcap1, id 0
    Section number: 1
    Interface id: 0 (\\.\USBPcap1)
        Interface name: \\.\USBPcap1
        Interface description: USBPcap1
    Encapsulation type: USB packets with USBPcap header (152)
    Arrival Time: Jun 22, 2025 19:19:26.055860000 Central Europe Daylight Time
    UTC Arrival Time: Jun 22, 2025 17:19:26.055860000 UTC
    Epoch Arrival Time: 1750612766.055860000
    [Time shift for this packet: 0.000000000 seconds]
    [Time delta from previous captured frame: 0.000281000 seconds]
    [Time delta from previous displayed frame: 0.000281000 seconds]
    [Time since reference or first frame: 16.848996000 seconds]
    Frame Number: 14012
    Frame Length: 29 bytes (232 bits)
    Capture Length: 29 bytes (232 bits)
    [Frame is marked: False]
    [Frame is ignored: False]
    [Protocols in frame: usb]
USB URB
    [Source: 1.13.0]
    [Destination: host]
    USBPcap pseudoheader length: 28
    IRP ID: 0xffffde073c695010
    IRP USBD_STATUS: USBD_STATUS_SUCCESS (0x00000000)
    URB Function: URB_FUNCTION_CONTROL_TRANSFER (0x0008)
    IRP information: 0x01, Direction: PDO -> FDO
        0000 000. = Reserved: 0x00
        .... ...1 = Direction: PDO -> FDO (0x1)
    URB bus id: 1
    Device address: 13
    Endpoint: 0x80, Direction: IN
        1... .... = Direction: IN (1)
        .... 0000 = Endpoint number: 0
    URB transfer type: URB_CONTROL (0x02)
    Packet Data Length: 1
    [Request in: 14011]
    [Time from request: 0.000281000 seconds]
    Control transfer stage: Complete (3)
    [bInterfaceClass: Unknown (0xffff)]
CONTROL response data: 12

No.     Time           Source                Destination           Protocol Length Info
  14013 16.849023      host                  1.13.0                USB      36     URB_CONTROL out

Frame 14013: 36 bytes on wire (288 bits), 36 bytes captured (288 bits) on interface \\.\USBPcap1, id 0
    Section number: 1
    Interface id: 0 (\\.\USBPcap1)
        Interface name: \\.\USBPcap1
        Interface description: USBPcap1
    Encapsulation type: USB packets with USBPcap header (152)
    Arrival Time: Jun 22, 2025 19:19:26.055887000 Central Europe Daylight Time
    UTC Arrival Time: Jun 22, 2025 17:19:26.055887000 UTC
    Epoch Arrival Time: 1750612766.055887000
    [Time shift for this packet: 0.000000000 seconds]
    [Time delta from previous captured frame: 0.000027000 seconds]
    [Time delta from previous displayed frame: 0.000027000 seconds]
    [Time since reference or first frame: 16.849023000 seconds]
    Frame Number: 14013
    Frame Length: 36 bytes (288 bits)
    Capture Length: 36 bytes (288 bits)
    [Frame is marked: False]
    [Frame is ignored: False]
    [Protocols in frame: usb]
USB URB
    [Source: host]
    [Destination: 1.13.0]
    USBPcap pseudoheader length: 28
    IRP ID: 0xffffde073c652a80
    IRP USBD_STATUS: USBD_STATUS_SUCCESS (0x00000000)
    URB Function: URB_FUNCTION_VENDOR_DEVICE (0x0017)
    IRP information: 0x00, Direction: FDO -> PDO
        0000 000. = Reserved: 0x00
        .... ...0 = Direction: FDO -> PDO (0x0)
    URB bus id: 1
    Device address: 13
    Endpoint: 0x00, Direction: OUT
        0... .... = Direction: OUT (0)
        .... 0000 = Endpoint number: 0
    URB transfer type: URB_CONTROL (0x02)
    Packet Data Length: 8
    [Response in: 14014]
    Control transfer stage: Setup (0)
    [bInterfaceClass: Unknown (0xffff)]
Setup Data
    bmRequestType: 0x40
        0... .... = Direction: Host-to-device
        .10. .... = Type: Vendor (0x2)
        ...0 0000 = Recipient: Device (0x00)
    bRequest: 73
    wValue: 0x0010
    wIndex: 0 (0x0000)
    wLength: 0

No.     Time           Source                Destination           Protocol Length Info
  14014 16.849257      1.13.0                host                  USB      28     URB_CONTROL out

Frame 14014: 28 bytes on wire (224 bits), 28 bytes captured (224 bits) on interface \\.\USBPcap1, id 0
    Section number: 1
    Interface id: 0 (\\.\USBPcap1)
        Interface name: \\.\USBPcap1
        Interface description: USBPcap1
    Encapsulation type: USB packets with USBPcap header (152)
    Arrival Time: Jun 22, 2025 19:19:26.056121000 Central Europe Daylight Time
    UTC Arrival Time: Jun 22, 2025 17:19:26.056121000 UTC
    Epoch Arrival Time: 1750612766.056121000
    [Time shift for this packet: 0.000000000 seconds]
    [Time delta from previous captured frame: 0.000234000 seconds]
    [Time delta from previous displayed frame: 0.000234000 seconds]
    [Time since reference or first frame: 16.849257000 seconds]
    Frame Number: 14014
    Frame Length: 28 bytes (224 bits)
    Capture Length: 28 bytes (224 bits)
    [Frame is marked: False]
    [Frame is ignored: False]
    [Protocols in frame: usb]
USB URB
    [Source: 1.13.0]
    [Destination: host]
    USBPcap pseudoheader length: 28
    IRP ID: 0xffffde073c652a80
    IRP USBD_STATUS: USBD_STATUS_SUCCESS (0x00000000)
    URB Function: URB_FUNCTION_CONTROL_TRANSFER (0x0008)
    IRP information: 0x01, Direction: PDO -> FDO
        0000 000. = Reserved: 0x00
        .... ...1 = Direction: PDO -> FDO (0x1)
    URB bus id: 1
    Device address: 13
    Endpoint: 0x00, Direction: OUT
        0... .... = Direction: OUT (0)
        .... 0000 = Endpoint number: 0
    URB transfer type: URB_CONTROL (0x02)
    Packet Data Length: 0
    [Request in: 14013]
    [Time from request: 0.000234000 seconds]
    Control transfer stage: Complete (3)
    [bInterfaceClass: Unknown (0xffff)]

No.     Time           Source                Destination           Protocol Length Info
  14015 16.895963      host                  1.13.0                USB      36     URB_CONTROL in

Frame 14015: 36 bytes on wire (288 bits), 36 bytes captured (288 bits) on interface \\.\USBPcap1, id 0
    Section number: 1
    Interface id: 0 (\\.\USBPcap1)
        Interface name: \\.\USBPcap1
        Interface description: USBPcap1
    Encapsulation type: USB packets with USBPcap header (152)
    Arrival Time: Jun 22, 2025 19:19:26.102827000 Central Europe Daylight Time
    UTC Arrival Time: Jun 22, 2025 17:19:26.102827000 UTC
    Epoch Arrival Time: 1750612766.102827000
    [Time shift for this packet: 0.000000000 seconds]
    [Time delta from previous captured frame: 0.046706000 seconds]
    [Time delta from previous displayed frame: 0.046706000 seconds]
    [Time since reference or first frame: 16.895963000 seconds]
    Frame Number: 14015
    Frame Length: 36 bytes (288 bits)
    Capture Length: 36 bytes (288 bits)
    [Frame is marked: False]
    [Frame is ignored: False]
    [Protocols in frame: usb]
USB URB
    [Source: host]
    [Destination: 1.13.0]
    USBPcap pseudoheader length: 28
    IRP ID: 0xffffde073c652a80
    IRP USBD_STATUS: USBD_STATUS_SUCCESS (0x00000000)
    URB Function: URB_FUNCTION_CLASS_ENDPOINT (0x001c)
    IRP information: 0x00, Direction: FDO -> PDO
        0000 000. = Reserved: 0x00
        .... ...0 = Direction: FDO -> PDO (0x0)
    URB bus id: 1
    Device address: 13
    Endpoint: 0x80, Direction: IN
        1... .... = Direction: IN (1)
        .... 0000 = Endpoint number: 0
    URB transfer type: URB_CONTROL (0x02)
    Packet Data Length: 8
    [Response in: 14016]
    Control transfer stage: Setup (0)
    [bInterfaceClass: Unknown (0xffff)]
Setup Data
    bmRequestType: 0xa2
        1... .... = Direction: Device-to-host
        .01. .... = Type: Class (0x1)
        ...0 0010 = Recipient: Endpoint (0x02)
    bRequest: 129
    wValue: 0x0100
    wIndex: 0 (0x0000)
    wLength: 3

No.     Time           Source                Destination           Protocol Length Info
  14016 16.896163      1.13.0                host                  USB      31     URB_CONTROL in

Frame 14016: 31 bytes on wire (248 bits), 31 bytes captured (248 bits) on interface \\.\USBPcap1, id 0
    Section number: 1
    Interface id: 0 (\\.\USBPcap1)
        Interface name: \\.\USBPcap1
        Interface description: USBPcap1
    Encapsulation type: USB packets with USBPcap header (152)
    Arrival Time: Jun 22, 2025 19:19:26.103027000 Central Europe Daylight Time
    UTC Arrival Time: Jun 22, 2025 17:19:26.103027000 UTC
    Epoch Arrival Time: 1750612766.103027000
    [Time shift for this packet: 0.000000000 seconds]
    [Time delta from previous captured frame: 0.000200000 seconds]
    [Time delta from previous displayed frame: 0.000200000 seconds]
    [Time since reference or first frame: 16.896163000 seconds]
    Frame Number: 14016
    Frame Length: 31 bytes (248 bits)
    Capture Length: 31 bytes (248 bits)
    [Frame is marked: False]
    [Frame is ignored: False]
    [Protocols in frame: usb]
USB URB
    [Source: 1.13.0]
    [Destination: host]
    USBPcap pseudoheader length: 28
    IRP ID: 0xffffde073c652a80
    IRP USBD_STATUS: USBD_STATUS_SUCCESS (0x00000000)
    URB Function: URB_FUNCTION_CONTROL_TRANSFER (0x0008)
    IRP information: 0x01, Direction: PDO -> FDO
        0000 000. = Reserved: 0x00
        .... ...1 = Direction: PDO -> FDO (0x1)
    URB bus id: 1
    Device address: 13
    Endpoint: 0x80, Direction: IN
        1... .... = Direction: IN (1)
        .... 0000 = Endpoint number: 0
    URB transfer type: URB_CONTROL (0x02)
    Packet Data Length: 3
    [Request in: 14015]
    [Time from request: 0.000200000 seconds]
    Control transfer stage: Complete (3)
    [bInterfaceClass: Unknown (0xffff)]
CONTROL response data: 44ac00

No.     Time           Source                Destination           Protocol Length Info
  14017 16.896170      host                  1.13.0                USB      36     URB_CONTROL in

Frame 14017: 36 bytes on wire (288 bits), 36 bytes captured (288 bits) on interface \\.\USBPcap1, id 0
    Section number: 1
    Interface id: 0 (\\.\USBPcap1)
        Interface name: \\.\USBPcap1
        Interface description: USBPcap1
    Encapsulation type: USB packets with USBPcap header (152)
    Arrival Time: Jun 22, 2025 19:19:26.103034000 Central Europe Daylight Time
    UTC Arrival Time: Jun 22, 2025 17:19:26.103034000 UTC
    Epoch Arrival Time: 1750612766.103034000
    [Time shift for this packet: 0.000000000 seconds]
    [Time delta from previous captured frame: 0.000007000 seconds]
    [Time delta from previous displayed frame: 0.000007000 seconds]
    [Time since reference or first frame: 16.896170000 seconds]
    Frame Number: 14017
    Frame Length: 36 bytes (288 bits)
    Capture Length: 36 bytes (288 bits)
    [Frame is marked: False]
    [Frame is ignored: False]
    [Protocols in frame: usb]
USB URB
    [Source: host]
    [Destination: 1.13.0]
    USBPcap pseudoheader length: 28
    IRP ID: 0xffffde073c652a80
    IRP USBD_STATUS: USBD_STATUS_SUCCESS (0x00000000)
    URB Function: URB_FUNCTION_VENDOR_DEVICE (0x0017)
    IRP information: 0x00, Direction: FDO -> PDO
        0000 000. = Reserved: 0x00
        .... ...0 = Direction: FDO -> PDO (0x0)
    URB bus id: 1
    Device address: 13
    Endpoint: 0x80, Direction: IN
        1... .... = Direction: IN (1)
        .... 0000 = Endpoint number: 0
    URB transfer type: URB_CONTROL (0x02)
    Packet Data Length: 8
    [Response in: 14018]
    Control transfer stage: Setup (0)
    [bInterfaceClass: Unknown (0xffff)]
Setup Data
    bmRequestType: 0xc0
        1... .... = Direction: Device-to-host
        .10. .... = Type: Vendor (0x2)
        ...0 0000 = Recipient: Device (0x00)
    bRequest: 73
    wValue: 0x0000
    wIndex: 0 (0x0000)
    wLength: 1

No.     Time           Source                Destination           Protocol Length Info
  14018 16.896327      1.13.0                host                  USB      29     URB_CONTROL in

Frame 14018: 29 bytes on wire (232 bits), 29 bytes captured (232 bits) on interface \\.\USBPcap1, id 0
    Section number: 1
    Interface id: 0 (\\.\USBPcap1)
        Interface name: \\.\USBPcap1
        Interface description: USBPcap1
    Encapsulation type: USB packets with USBPcap header (152)
    Arrival Time: Jun 22, 2025 19:19:26.103191000 Central Europe Daylight Time
    UTC Arrival Time: Jun 22, 2025 17:19:26.103191000 UTC
    Epoch Arrival Time: 1750612766.103191000
    [Time shift for this packet: 0.000000000 seconds]
    [Time delta from previous captured frame: 0.000157000 seconds]
    [Time delta from previous displayed frame: 0.000157000 seconds]
    [Time since reference or first frame: 16.896327000 seconds]
    Frame Number: 14018
    Frame Length: 29 bytes (232 bits)
    Capture Length: 29 bytes (232 bits)
    [Frame is marked: False]
    [Frame is ignored: False]
    [Protocols in frame: usb]
USB URB
    [Source: 1.13.0]
    [Destination: host]
    USBPcap pseudoheader length: 28
    IRP ID: 0xffffde073c652a80
    IRP USBD_STATUS: USBD_STATUS_SUCCESS (0x00000000)
    URB Function: URB_FUNCTION_CONTROL_TRANSFER (0x0008)
    IRP information: 0x01, Direction: PDO -> FDO
        0000 000. = Reserved: 0x00
        .... ...1 = Direction: PDO -> FDO (0x1)
    URB bus id: 1
    Device address: 13
    Endpoint: 0x80, Direction: IN
        1... .... = Direction: IN (1)
        .... 0000 = Endpoint number: 0
    URB transfer type: URB_CONTROL (0x02)
    Packet Data Length: 1
    [Request in: 14017]
    [Time from request: 0.000157000 seconds]
    Control transfer stage: Complete (3)
    [bInterfaceClass: Unknown (0xffff)]
CONTROL response data: 10

No.     Time           Source                Destination           Protocol Length Info
  14019 16.896331      host                  1.13.0                USB      36     URB_CONTROL in

Frame 14019: 36 bytes on wire (288 bits), 36 bytes captured (288 bits) on interface \\.\USBPcap1, id 0
    Section number: 1
    Interface id: 0 (\\.\USBPcap1)
        Interface name: \\.\USBPcap1
        Interface description: USBPcap1
    Encapsulation type: USB packets with USBPcap header (152)
    Arrival Time: Jun 22, 2025 19:19:26.103195000 Central Europe Daylight Time
    UTC Arrival Time: Jun 22, 2025 17:19:26.103195000 UTC
    Epoch Arrival Time: 1750612766.103195000
    [Time shift for this packet: 0.000000000 seconds]
    [Time delta from previous captured frame: 0.000004000 seconds]
    [Time delta from previous displayed frame: 0.000004000 seconds]
    [Time since reference or first frame: 16.896331000 seconds]
    Frame Number: 14019
    Frame Length: 36 bytes (288 bits)
    Capture Length: 36 bytes (288 bits)
    [Frame is marked: False]
    [Frame is ignored: False]
    [Protocols in frame: usb]
USB URB
    [Source: host]
    [Destination: 1.13.0]
    USBPcap pseudoheader length: 28
    IRP ID: 0xffffde073c652a80
    IRP USBD_STATUS: USBD_STATUS_SUCCESS (0x00000000)
    URB Function: URB_FUNCTION_CLASS_ENDPOINT (0x001c)
    IRP information: 0x00, Direction: FDO -> PDO
        0000 000. = Reserved: 0x00
        .... ...0 = Direction: FDO -> PDO (0x0)
    URB bus id: 1
    Device address: 13
    Endpoint: 0x80, Direction: IN
        1... .... = Direction: IN (1)
        .... 0000 = Endpoint number: 0
    URB transfer type: URB_CONTROL (0x02)
    Packet Data Length: 8
    [Response in: 14020]
    Control transfer stage: Setup (0)
    [bInterfaceClass: Unknown (0xffff)]
Setup Data
    bmRequestType: 0xa2
        1... .... = Direction: Device-to-host
        .01. .... = Type: Class (0x1)
        ...0 0010 = Recipient: Endpoint (0x02)
    bRequest: 129
    wValue: 0x0100
    wIndex: 0 (0x0000)
    wLength: 3

No.     Time           Source                Destination           Protocol Length Info
  14020 16.896486      1.13.0                host                  USB      31     URB_CONTROL in

Frame 14020: 31 bytes on wire (248 bits), 31 bytes captured (248 bits) on interface \\.\USBPcap1, id 0
    Section number: 1
    Interface id: 0 (\\.\USBPcap1)
        Interface name: \\.\USBPcap1
        Interface description: USBPcap1
    Encapsulation type: USB packets with USBPcap header (152)
    Arrival Time: Jun 22, 2025 19:19:26.103350000 Central Europe Daylight Time
    UTC Arrival Time: Jun 22, 2025 17:19:26.103350000 UTC
    Epoch Arrival Time: 1750612766.103350000
    [Time shift for this packet: 0.000000000 seconds]
    [Time delta from previous captured frame: 0.000155000 seconds]
    [Time delta from previous displayed frame: 0.000155000 seconds]
    [Time since reference or first frame: 16.896486000 seconds]
    Frame Number: 14020
    Frame Length: 31 bytes (248 bits)
    Capture Length: 31 bytes (248 bits)
    [Frame is marked: False]
    [Frame is ignored: False]
    [Protocols in frame: usb]
USB URB
    [Source: 1.13.0]
    [Destination: host]
    USBPcap pseudoheader length: 28
    IRP ID: 0xffffde073c652a80
    IRP USBD_STATUS: USBD_STATUS_SUCCESS (0x00000000)
    URB Function: URB_FUNCTION_CONTROL_TRANSFER (0x0008)
    IRP information: 0x01, Direction: PDO -> FDO
        0000 000. = Reserved: 0x00
        .... ...1 = Direction: PDO -> FDO (0x1)
    URB bus id: 1
    Device address: 13
    Endpoint: 0x80, Direction: IN
        1... .... = Direction: IN (1)
        .... 0000 = Endpoint number: 0
    URB transfer type: URB_CONTROL (0x02)
    Packet Data Length: 3
    [Request in: 14019]
    [Time from request: 0.000155000 seconds]
    Control transfer stage: Complete (3)
    [bInterfaceClass: Unknown (0xffff)]
CONTROL response data: 44ac00

No.     Time           Source                Destination           Protocol Length Info
  14021 16.896490      host                  1.13.0                USB      36     URB_CONTROL in

Frame 14021: 36 bytes on wire (288 bits), 36 bytes captured (288 bits) on interface \\.\USBPcap1, id 0
    Section number: 1
    Interface id: 0 (\\.\USBPcap1)
        Interface name: \\.\USBPcap1
        Interface description: USBPcap1
    Encapsulation type: USB packets with USBPcap header (152)
    Arrival Time: Jun 22, 2025 19:19:26.103354000 Central Europe Daylight Time
    UTC Arrival Time: Jun 22, 2025 17:19:26.103354000 UTC
    Epoch Arrival Time: 1750612766.103354000
    [Time shift for this packet: 0.000000000 seconds]
    [Time delta from previous captured frame: 0.000004000 seconds]
    [Time delta from previous displayed frame: 0.000004000 seconds]
    [Time since reference or first frame: 16.896490000 seconds]
    Frame Number: 14021
    Frame Length: 36 bytes (288 bits)
    Capture Length: 36 bytes (288 bits)
    [Frame is marked: False]
    [Frame is ignored: False]
    [Protocols in frame: usb]
USB URB
    [Source: host]
    [Destination: 1.13.0]
    USBPcap pseudoheader length: 28
    IRP ID: 0xffffde073c652a80
    IRP USBD_STATUS: USBD_STATUS_SUCCESS (0x00000000)
    URB Function: URB_FUNCTION_CLASS_ENDPOINT (0x001c)
    IRP information: 0x00, Direction: FDO -> PDO
        0000 000. = Reserved: 0x00
        .... ...0 = Direction: FDO -> PDO (0x0)
    URB bus id: 1
    Device address: 13
    Endpoint: 0x80, Direction: IN
        1... .... = Direction: IN (1)
        .... 0000 = Endpoint number: 0
    URB transfer type: URB_CONTROL (0x02)
    Packet Data Length: 8
    [Response in: 14022]
    Control transfer stage: Setup (0)
    [bInterfaceClass: Unknown (0xffff)]
Setup Data
    bmRequestType: 0xa2
        1... .... = Direction: Device-to-host
        .01. .... = Type: Class (0x1)
        ...0 0010 = Recipient: Endpoint (0x02)
    bRequest: 129
    wValue: 0x0100
    wIndex: 0 (0x0000)
    wLength: 3

No.     Time           Source                Destination           Protocol Length Info
  14022 16.896642      1.13.0                host                  USB      31     URB_CONTROL in

Frame 14022: 31 bytes on wire (248 bits), 31 bytes captured (248 bits) on interface \\.\USBPcap1, id 0
    Section number: 1
    Interface id: 0 (\\.\USBPcap1)
        Interface name: \\.\USBPcap1
        Interface description: USBPcap1
    Encapsulation type: USB packets with USBPcap header (152)
    Arrival Time: Jun 22, 2025 19:19:26.103506000 Central Europe Daylight Time
    UTC Arrival Time: Jun 22, 2025 17:19:26.103506000 UTC
    Epoch Arrival Time: 1750612766.103506000
    [Time shift for this packet: 0.000000000 seconds]
    [Time delta from previous captured frame: 0.000152000 seconds]
    [Time delta from previous displayed frame: 0.000152000 seconds]
    [Time since reference or first frame: 16.896642000 seconds]
    Frame Number: 14022
    Frame Length: 31 bytes (248 bits)
    Capture Length: 31 bytes (248 bits)
    [Frame is marked: False]
    [Frame is ignored: False]
    [Protocols in frame: usb]
USB URB
    [Source: 1.13.0]
    [Destination: host]
    USBPcap pseudoheader length: 28
    IRP ID: 0xffffde073c652a80
    IRP USBD_STATUS: USBD_STATUS_SUCCESS (0x00000000)
    URB Function: URB_FUNCTION_CONTROL_TRANSFER (0x0008)
    IRP information: 0x01, Direction: PDO -> FDO
        0000 000. = Reserved: 0x00
        .... ...1 = Direction: PDO -> FDO (0x1)
    URB bus id: 1
    Device address: 13
    Endpoint: 0x80, Direction: IN
        1... .... = Direction: IN (1)
        .... 0000 = Endpoint number: 0
    URB transfer type: URB_CONTROL (0x02)
    Packet Data Length: 3
    [Request in: 14021]
    [Time from request: 0.000152000 seconds]
    Control transfer stage: Complete (3)
    [bInterfaceClass: Unknown (0xffff)]
CONTROL response data: 44ac00

No.     Time           Source                Destination           Protocol Length Info
  14023 16.896650      host                  1.13.0                USB      39     URB_CONTROL out

Frame 14023: 39 bytes on wire (312 bits), 39 bytes captured (312 bits) on interface \\.\USBPcap1, id 0
    Section number: 1
    Interface id: 0 (\\.\USBPcap1)
        Interface name: \\.\USBPcap1
        Interface description: USBPcap1
    Encapsulation type: USB packets with USBPcap header (152)
    Arrival Time: Jun 22, 2025 19:19:26.103514000 Central Europe Daylight Time
    UTC Arrival Time: Jun 22, 2025 17:19:26.103514000 UTC
    Epoch Arrival Time: 1750612766.103514000
    [Time shift for this packet: 0.000000000 seconds]
    [Time delta from previous captured frame: 0.000008000 seconds]
    [Time delta from previous displayed frame: 0.000008000 seconds]
    [Time since reference or first frame: 16.896650000 seconds]
    Frame Number: 14023
    Frame Length: 39 bytes (312 bits)
    Capture Length: 39 bytes (312 bits)
    [Frame is marked: False]
    [Frame is ignored: False]
    [Protocols in frame: usb]
USB URB
    [Source: host]
    [Destination: 1.13.0]
    USBPcap pseudoheader length: 28
    IRP ID: 0xffffde073777c2a0
    IRP USBD_STATUS: USBD_STATUS_SUCCESS (0x00000000)
    URB Function: URB_FUNCTION_CLASS_ENDPOINT (0x001c)
    IRP information: 0x00, Direction: FDO -> PDO
        0000 000. = Reserved: 0x00
        .... ...0 = Direction: FDO -> PDO (0x0)
    URB bus id: 1
    Device address: 13
    Endpoint: 0x00, Direction: OUT
        0... .... = Direction: OUT (0)
        .... 0000 = Endpoint number: 0
    URB transfer type: URB_CONTROL (0x02)
    Packet Data Length: 11
    [Response in: 14024]
    Control transfer stage: Setup (0)
    [bInterfaceClass: Vendor Specific (0xff)]
Setup Data
    bmRequestType: 0x22
        0... .... = Direction: Host-to-device
        .01. .... = Type: Class (0x1)
        ...0 0010 = Recipient: Endpoint (0x02)
    bRequest: 1
    wValue: 0x0100
    wIndex: 134 (0x0086)
    wLength: 3
    Data Fragment: 80bb00

No.     Time           Source                Destination           Protocol Length Info
  14024 16.896777      1.13.0                host                  USB      28     URB_CONTROL out

Frame 14024: 28 bytes on wire (224 bits), 28 bytes captured (224 bits) on interface \\.\USBPcap1, id 0
    Section number: 1
    Interface id: 0 (\\.\USBPcap1)
        Interface name: \\.\USBPcap1
        Interface description: USBPcap1
    Encapsulation type: USB packets with USBPcap header (152)
    Arrival Time: Jun 22, 2025 19:19:26.103641000 Central Europe Daylight Time
    UTC Arrival Time: Jun 22, 2025 17:19:26.103641000 UTC
    Epoch Arrival Time: 1750612766.103641000
    [Time shift for this packet: 0.000000000 seconds]
    [Time delta from previous captured frame: 0.000127000 seconds]
    [Time delta from previous displayed frame: 0.000127000 seconds]
    [Time since reference or first frame: 16.896777000 seconds]
    Frame Number: 14024
    Frame Length: 28 bytes (224 bits)
    Capture Length: 28 bytes (224 bits)
    [Frame is marked: False]
    [Frame is ignored: False]
    [Protocols in frame: usb]
USB URB
    [Source: 1.13.0]
    [Destination: host]
    USBPcap pseudoheader length: 28
    IRP ID: 0xffffde073777c2a0
    IRP USBD_STATUS: USBD_STATUS_SUCCESS (0x00000000)
    URB Function: URB_FUNCTION_CONTROL_TRANSFER (0x0008)
    IRP information: 0x01, Direction: PDO -> FDO
        0000 000. = Reserved: 0x00
        .... ...1 = Direction: PDO -> FDO (0x1)
    URB bus id: 1
    Device address: 13
    Endpoint: 0x00, Direction: OUT
        0... .... = Direction: OUT (0)
        .... 0000 = Endpoint number: 0
    URB transfer type: URB_CONTROL (0x02)
    Packet Data Length: 0
    [Request in: 14023]
    [Time from request: 0.000127000 seconds]
    Control transfer stage: Complete (3)
    [bInterfaceClass: Vendor Specific (0xff)]

No.     Time           Source                Destination           Protocol Length Info
  14025 16.896795      host                  1.13.0                USB      39     URB_CONTROL out

Frame 14025: 39 bytes on wire (312 bits), 39 bytes captured (312 bits) on interface \\.\USBPcap1, id 0
    Section number: 1
    Interface id: 0 (\\.\USBPcap1)
        Interface name: \\.\USBPcap1
        Interface description: USBPcap1
    Encapsulation type: USB packets with USBPcap header (152)
    Arrival Time: Jun 22, 2025 19:19:26.103659000 Central Europe Daylight Time
    UTC Arrival Time: Jun 22, 2025 17:19:26.103659000 UTC
    Epoch Arrival Time: 1750612766.103659000
    [Time shift for this packet: 0.000000000 seconds]
    [Time delta from previous captured frame: 0.000018000 seconds]
    [Time delta from previous displayed frame: 0.000018000 seconds]
    [Time since reference or first frame: 16.896795000 seconds]
    Frame Number: 14025
    Frame Length: 39 bytes (312 bits)
    Capture Length: 39 bytes (312 bits)
    [Frame is marked: False]
    [Frame is ignored: False]
    [Protocols in frame: usb]
USB URB
    [Source: host]
    [Destination: 1.13.0]
    USBPcap pseudoheader length: 28
    IRP ID: 0xffffde073c695010
    IRP USBD_STATUS: USBD_STATUS_SUCCESS (0x00000000)
    URB Function: URB_FUNCTION_CLASS_ENDPOINT (0x001c)
    IRP information: 0x00, Direction: FDO -> PDO
        0000 000. = Reserved: 0x00
        .... ...0 = Direction: FDO -> PDO (0x0)
    URB bus id: 1
    Device address: 13
    Endpoint: 0x00, Direction: OUT
        0... .... = Direction: OUT (0)
        .... 0000 = Endpoint number: 0
    URB transfer type: URB_CONTROL (0x02)
    Packet Data Length: 11
    [Response in: 14026]
    Control transfer stage: Setup (0)
    [bInterfaceClass: Vendor Specific (0xff)]
Setup Data
    bmRequestType: 0x22
        0... .... = Direction: Host-to-device
        .01. .... = Type: Class (0x1)
        ...0 0010 = Recipient: Endpoint (0x02)
    bRequest: 1
    wValue: 0x0100
    wIndex: 2 (0x0002)
    wLength: 3
    Data Fragment: 80bb00

No.     Time           Source                Destination           Protocol Length Info
  14026 16.897011      1.13.0                host                  USB      28     URB_CONTROL out

Frame 14026: 28 bytes on wire (224 bits), 28 bytes captured (224 bits) on interface \\.\USBPcap1, id 0
    Section number: 1
    Interface id: 0 (\\.\USBPcap1)
        Interface name: \\.\USBPcap1
        Interface description: USBPcap1
    Encapsulation type: USB packets with USBPcap header (152)
    Arrival Time: Jun 22, 2025 19:19:26.103875000 Central Europe Daylight Time
    UTC Arrival Time: Jun 22, 2025 17:19:26.103875000 UTC
    Epoch Arrival Time: 1750612766.103875000
    [Time shift for this packet: 0.000000000 seconds]
    [Time delta from previous captured frame: 0.000216000 seconds]
    [Time delta from previous displayed frame: 0.000216000 seconds]
    [Time since reference or first frame: 16.897011000 seconds]
    Frame Number: 14026
    Frame Length: 28 bytes (224 bits)
    Capture Length: 28 bytes (224 bits)
    [Frame is marked: False]
    [Frame is ignored: False]
    [Protocols in frame: usb]
USB URB
    [Source: 1.13.0]
    [Destination: host]
    USBPcap pseudoheader length: 28
    IRP ID: 0xffffde073c695010
    IRP USBD_STATUS: USBD_STATUS_SUCCESS (0x00000000)
    URB Function: URB_FUNCTION_CONTROL_TRANSFER (0x0008)
    IRP information: 0x01, Direction: PDO -> FDO
        0000 000. = Reserved: 0x00
        .... ...1 = Direction: PDO -> FDO (0x1)
    URB bus id: 1
    Device address: 13
    Endpoint: 0x00, Direction: OUT
        0... .... = Direction: OUT (0)
        .... 0000 = Endpoint number: 0
    URB transfer type: URB_CONTROL (0x02)
    Packet Data Length: 0
    [Request in: 14025]
    [Time from request: 0.000216000 seconds]
    Control transfer stage: Complete (3)
    [bInterfaceClass: Vendor Specific (0xff)]

No.     Time           Source                Destination           Protocol Length Info
  14027 16.916920      host                  1.13.0                USB      39     URB_CONTROL out

Frame 14027: 39 bytes on wire (312 bits), 39 bytes captured (312 bits) on interface \\.\USBPcap1, id 0
    Section number: 1
    Interface id: 0 (\\.\USBPcap1)
        Interface name: \\.\USBPcap1
        Interface description: USBPcap1
    Encapsulation type: USB packets with USBPcap header (152)
    Arrival Time: Jun 22, 2025 19:19:26.123784000 Central Europe Daylight Time
    UTC Arrival Time: Jun 22, 2025 17:19:26.123784000 UTC
    Epoch Arrival Time: 1750612766.123784000
    [Time shift for this packet: 0.000000000 seconds]
    [Time delta from previous captured frame: 0.019909000 seconds]
    [Time delta from previous displayed frame: 0.019909000 seconds]
    [Time since reference or first frame: 16.916920000 seconds]
    Frame Number: 14027
    Frame Length: 39 bytes (312 bits)
    Capture Length: 39 bytes (312 bits)
    [Frame is marked: False]
    [Frame is ignored: False]
    [Protocols in frame: usb]
USB URB
    [Source: host]
    [Destination: 1.13.0]
    USBPcap pseudoheader length: 28
    IRP ID: 0xffffde0739beb7c0
    IRP USBD_STATUS: USBD_STATUS_SUCCESS (0x00000000)
    URB Function: URB_FUNCTION_CLASS_ENDPOINT (0x001c)
    IRP information: 0x00, Direction: FDO -> PDO
        0000 000. = Reserved: 0x00
        .... ...0 = Direction: FDO -> PDO (0x0)
    URB bus id: 1
    Device address: 13
    Endpoint: 0x00, Direction: OUT
        0... .... = Direction: OUT (0)
        .... 0000 = Endpoint number: 0
    URB transfer type: URB_CONTROL (0x02)
    Packet Data Length: 11
    [Response in: 14028]
    Control transfer stage: Setup (0)
    [bInterfaceClass: Vendor Specific (0xff)]
Setup Data
    bmRequestType: 0x22
        0... .... = Direction: Host-to-device
        .01. .... = Type: Class (0x1)
        ...0 0010 = Recipient: Endpoint (0x02)
    bRequest: 1
    wValue: 0x0100
    wIndex: 134 (0x0086)
    wLength: 3
    Data Fragment: 80bb00

No.     Time           Source                Destination           Protocol Length Info
  14028 16.917070      1.13.0                host                  USB      28     URB_CONTROL out

Frame 14028: 28 bytes on wire (224 bits), 28 bytes captured (224 bits) on interface \\.\USBPcap1, id 0
    Section number: 1
    Interface id: 0 (\\.\USBPcap1)
        Interface name: \\.\USBPcap1
        Interface description: USBPcap1
    Encapsulation type: USB packets with USBPcap header (152)
    Arrival Time: Jun 22, 2025 19:19:26.123934000 Central Europe Daylight Time
    UTC Arrival Time: Jun 22, 2025 17:19:26.123934000 UTC
    Epoch Arrival Time: 1750612766.123934000
    [Time shift for this packet: 0.000000000 seconds]
    [Time delta from previous captured frame: 0.000150000 seconds]
    [Time delta from previous displayed frame: 0.000150000 seconds]
    [Time since reference or first frame: 16.917070000 seconds]
    Frame Number: 14028
    Frame Length: 28 bytes (224 bits)
    Capture Length: 28 bytes (224 bits)
    [Frame is marked: False]
    [Frame is ignored: False]
    [Protocols in frame: usb]
USB URB
    [Source: 1.13.0]
    [Destination: host]
    USBPcap pseudoheader length: 28
    IRP ID: 0xffffde0739beb7c0
    IRP USBD_STATUS: USBD_STATUS_SUCCESS (0x00000000)
    URB Function: URB_FUNCTION_CONTROL_TRANSFER (0x0008)
    IRP information: 0x01, Direction: PDO -> FDO
        0000 000. = Reserved: 0x00
        .... ...1 = Direction: PDO -> FDO (0x1)
    URB bus id: 1
    Device address: 13
    Endpoint: 0x00, Direction: OUT
        0... .... = Direction: OUT (0)
        .... 0000 = Endpoint number: 0
    URB transfer type: URB_CONTROL (0x02)
    Packet Data Length: 0
    [Request in: 14027]
    [Time from request: 0.000150000 seconds]
    Control transfer stage: Complete (3)
    [bInterfaceClass: Vendor Specific (0xff)]

No.     Time           Source                Destination           Protocol Length Info
  14029 16.917080      host                  1.13.0                USB      39     URB_CONTROL out

Frame 14029: 39 bytes on wire (312 bits), 39 bytes captured (312 bits) on interface \\.\USBPcap1, id 0
    Section number: 1
    Interface id: 0 (\\.\USBPcap1)
        Interface name: \\.\USBPcap1
        Interface description: USBPcap1
    Encapsulation type: USB packets with USBPcap header (152)
    Arrival Time: Jun 22, 2025 19:19:26.123944000 Central Europe Daylight Time
    UTC Arrival Time: Jun 22, 2025 17:19:26.123944000 UTC
    Epoch Arrival Time: 1750612766.123944000
    [Time shift for this packet: 0.000000000 seconds]
    [Time delta from previous captured frame: 0.000010000 seconds]
    [Time delta from previous displayed frame: 0.000010000 seconds]
    [Time since reference or first frame: 16.917080000 seconds]
    Frame Number: 14029
    Frame Length: 39 bytes (312 bits)
    Capture Length: 39 bytes (312 bits)
    [Frame is marked: False]
    [Frame is ignored: False]
    [Protocols in frame: usb]
USB URB
    [Source: host]
    [Destination: 1.13.0]
    USBPcap pseudoheader length: 28
    IRP ID: 0xffffde0739beb7c0
    IRP USBD_STATUS: USBD_STATUS_SUCCESS (0x00000000)
    URB Function: URB_FUNCTION_CLASS_ENDPOINT (0x001c)
    IRP information: 0x00, Direction: FDO -> PDO
        0000 000. = Reserved: 0x00
        .... ...0 = Direction: FDO -> PDO (0x0)
    URB bus id: 1
    Device address: 13
    Endpoint: 0x00, Direction: OUT
        0... .... = Direction: OUT (0)
        .... 0000 = Endpoint number: 0
    URB transfer type: URB_CONTROL (0x02)
    Packet Data Length: 11
    [Response in: 14030]
    Control transfer stage: Setup (0)
    [bInterfaceClass: Vendor Specific (0xff)]
Setup Data
    bmRequestType: 0x22
        0... .... = Direction: Host-to-device
        .01. .... = Type: Class (0x1)
        ...0 0010 = Recipient: Endpoint (0x02)
    bRequest: 1
    wValue: 0x0100
    wIndex: 2 (0x0002)
    wLength: 3
    Data Fragment: 80bb00

No.     Time           Source                Destination           Protocol Length Info
  14030 16.917285      1.13.0                host                  USB      28     URB_CONTROL out

Frame 14030: 28 bytes on wire (224 bits), 28 bytes captured (224 bits) on interface \\.\USBPcap1, id 0
    Section number: 1
    Interface id: 0 (\\.\USBPcap1)
        Interface name: \\.\USBPcap1
        Interface description: USBPcap1
    Encapsulation type: USB packets with USBPcap header (152)
    Arrival Time: Jun 22, 2025 19:19:26.124149000 Central Europe Daylight Time
    UTC Arrival Time: Jun 22, 2025 17:19:26.124149000 UTC
    Epoch Arrival Time: 1750612766.124149000
    [Time shift for this packet: 0.000000000 seconds]
    [Time delta from previous captured frame: 0.000205000 seconds]
    [Time delta from previous displayed frame: 0.000205000 seconds]
    [Time since reference or first frame: 16.917285000 seconds]
    Frame Number: 14030
    Frame Length: 28 bytes (224 bits)
    Capture Length: 28 bytes (224 bits)
    [Frame is marked: False]
    [Frame is ignored: False]
    [Protocols in frame: usb]
USB URB
    [Source: 1.13.0]
    [Destination: host]
    USBPcap pseudoheader length: 28
    IRP ID: 0xffffde0739beb7c0
    IRP USBD_STATUS: USBD_STATUS_SUCCESS (0x00000000)
    URB Function: URB_FUNCTION_CONTROL_TRANSFER (0x0008)
    IRP information: 0x01, Direction: PDO -> FDO
        0000 000. = Reserved: 0x00
        .... ...1 = Direction: PDO -> FDO (0x1)
    URB bus id: 1
    Device address: 13
    Endpoint: 0x00, Direction: OUT
        0... .... = Direction: OUT (0)
        .... 0000 = Endpoint number: 0
    URB transfer type: URB_CONTROL (0x02)
    Packet Data Length: 0
    [Request in: 14029]
    [Time from request: 0.000205000 seconds]
    Control transfer stage: Complete (3)
    [bInterfaceClass: Vendor Specific (0xff)]

No.     Time           Source                Destination           Protocol Length Info
  14031 16.917295      host                  1.13.0                USB      36     URB_CONTROL in

Frame 14031: 36 bytes on wire (288 bits), 36 bytes captured (288 bits) on interface \\.\USBPcap1, id 0
    Section number: 1
    Interface id: 0 (\\.\USBPcap1)
        Interface name: \\.\USBPcap1
        Interface description: USBPcap1
    Encapsulation type: USB packets with USBPcap header (152)
    Arrival Time: Jun 22, 2025 19:19:26.124159000 Central Europe Daylight Time
    UTC Arrival Time: Jun 22, 2025 17:19:26.124159000 UTC
    Epoch Arrival Time: 1750612766.124159000
    [Time shift for this packet: 0.000000000 seconds]
    [Time delta from previous captured frame: 0.000010000 seconds]
    [Time delta from previous displayed frame: 0.000010000 seconds]
    [Time since reference or first frame: 16.917295000 seconds]
    Frame Number: 14031
    Frame Length: 36 bytes (288 bits)
    Capture Length: 36 bytes (288 bits)
    [Frame is marked: False]
    [Frame is ignored: False]
    [Protocols in frame: usb]
USB URB
    [Source: host]
    [Destination: 1.13.0]
    USBPcap pseudoheader length: 28
    IRP ID: 0xffffde073c430a70
    IRP USBD_STATUS: USBD_STATUS_SUCCESS (0x00000000)
    URB Function: URB_FUNCTION_VENDOR_DEVICE (0x0017)
    IRP information: 0x00, Direction: FDO -> PDO
        0000 000. = Reserved: 0x00
        .... ...0 = Direction: FDO -> PDO (0x0)
    URB bus id: 1
    Device address: 13
    Endpoint: 0x80, Direction: IN
        1... .... = Direction: IN (1)
        .... 0000 = Endpoint number: 0
    URB transfer type: URB_CONTROL (0x02)
    Packet Data Length: 8
    [Response in: 14032]
    Control transfer stage: Setup (0)
    [bInterfaceClass: Unknown (0xffff)]
Setup Data
    bmRequestType: 0xc0
        1... .... = Direction: Device-to-host
        .10. .... = Type: Vendor (0x2)
        ...0 0000 = Recipient: Device (0x00)
    bRequest: 65
    wValue: 0x0d00
    wIndex: 257 (0x0101)
    wLength: 5

No.     Time           Source                Destination           Protocol Length Info
  14032 16.917532      1.13.0                host                  USB      33     URB_CONTROL in

Frame 14032: 33 bytes on wire (264 bits), 33 bytes captured (264 bits) on interface \\.\USBPcap1, id 0
    Section number: 1
    Interface id: 0 (\\.\USBPcap1)
        Interface name: \\.\USBPcap1
        Interface description: USBPcap1
    Encapsulation type: USB packets with USBPcap header (152)
    Arrival Time: Jun 22, 2025 19:19:26.124396000 Central Europe Daylight Time
    UTC Arrival Time: Jun 22, 2025 17:19:26.124396000 UTC
    Epoch Arrival Time: 1750612766.124396000
    [Time shift for this packet: 0.000000000 seconds]
    [Time delta from previous captured frame: 0.000237000 seconds]
    [Time delta from previous displayed frame: 0.000237000 seconds]
    [Time since reference or first frame: 16.917532000 seconds]
    Frame Number: 14032
    Frame Length: 33 bytes (264 bits)
    Capture Length: 33 bytes (264 bits)
    [Frame is marked: False]
    [Frame is ignored: False]
    [Protocols in frame: usb]
USB URB
    [Source: 1.13.0]
    [Destination: host]
    USBPcap pseudoheader length: 28
    IRP ID: 0xffffde073c430a70
    IRP USBD_STATUS: USBD_STATUS_SUCCESS (0x00000000)
    URB Function: URB_FUNCTION_CONTROL_TRANSFER (0x0008)
    IRP information: 0x01, Direction: PDO -> FDO
        0000 000. = Reserved: 0x00
        .... ...1 = Direction: PDO -> FDO (0x1)
    URB bus id: 1
    Device address: 13
    Endpoint: 0x80, Direction: IN
        1... .... = Direction: IN (1)
        .... 0000 = Endpoint number: 0
    URB transfer type: URB_CONTROL (0x02)
    Packet Data Length: 5
    [Request in: 14031]
    [Time from request: 0.000237000 seconds]
    Control transfer stage: Complete (3)
    [bInterfaceClass: Unknown (0xffff)]
CONTROL response data: 0492000200

No.     Time           Source                Destination           Protocol Length Info
  14033 16.917543      host                  1.13.0                USB      36     URB_CONTROL out

Frame 14033: 36 bytes on wire (288 bits), 36 bytes captured (288 bits) on interface \\.\USBPcap1, id 0
    Section number: 1
    Interface id: 0 (\\.\USBPcap1)
        Interface name: \\.\USBPcap1
        Interface description: USBPcap1
    Encapsulation type: USB packets with USBPcap header (152)
    Arrival Time: Jun 22, 2025 19:19:26.124407000 Central Europe Daylight Time
    UTC Arrival Time: Jun 22, 2025 17:19:26.124407000 UTC
    Epoch Arrival Time: 1750612766.124407000
    [Time shift for this packet: 0.000000000 seconds]
    [Time delta from previous captured frame: 0.000011000 seconds]
    [Time delta from previous displayed frame: 0.000011000 seconds]
    [Time since reference or first frame: 16.917543000 seconds]
    Frame Number: 14033
    Frame Length: 36 bytes (288 bits)
    Capture Length: 36 bytes (288 bits)
    [Frame is marked: False]
    [Frame is ignored: False]
    [Protocols in frame: usb]
USB URB
    [Source: host]
    [Destination: 1.13.0]
    USBPcap pseudoheader length: 28
    IRP ID: 0xffffde073c430a70
    IRP USBD_STATUS: USBD_STATUS_SUCCESS (0x00000000)
    URB Function: URB_FUNCTION_VENDOR_DEVICE (0x0017)
    IRP information: 0x00, Direction: FDO -> PDO
        0000 000. = Reserved: 0x00
        .... ...0 = Direction: FDO -> PDO (0x0)
    URB bus id: 1
    Device address: 13
    Endpoint: 0x00, Direction: OUT
        0... .... = Direction: OUT (0)
        .... 0000 = Endpoint number: 0
    URB transfer type: URB_CONTROL (0x02)
    Packet Data Length: 8
    [Response in: 14034]
    Control transfer stage: Setup (0)
    [bInterfaceClass: Unknown (0xffff)]
Setup Data
    bmRequestType: 0x40
        0... .... = Direction: Host-to-device
        .10. .... = Type: Vendor (0x2)
        ...0 0000 = Recipient: Device (0x00)
    bRequest: 65
    wValue: 0x0d04
    wIndex: 257 (0x0101)
    wLength: 0

No.     Time           Source                Destination           Protocol Length Info
  14034 16.917615      1.13.0                host                  USB      28     URB_CONTROL out

Frame 14034: 28 bytes on wire (224 bits), 28 bytes captured (224 bits) on interface \\.\USBPcap1, id 0
    Section number: 1
    Interface id: 0 (\\.\USBPcap1)
        Interface name: \\.\USBPcap1
        Interface description: USBPcap1
    Encapsulation type: USB packets with USBPcap header (152)
    Arrival Time: Jun 22, 2025 19:19:26.124479000 Central Europe Daylight Time
    UTC Arrival Time: Jun 22, 2025 17:19:26.124479000 UTC
    Epoch Arrival Time: 1750612766.124479000
    [Time shift for this packet: 0.000000000 seconds]
    [Time delta from previous captured frame: 0.000072000 seconds]
    [Time delta from previous displayed frame: 0.000072000 seconds]
    [Time since reference or first frame: 16.917615000 seconds]
    Frame Number: 14034
    Frame Length: 28 bytes (224 bits)
    Capture Length: 28 bytes (224 bits)
    [Frame is marked: False]
    [Frame is ignored: False]
    [Protocols in frame: usb]
USB URB
    [Source: 1.13.0]
    [Destination: host]
    USBPcap pseudoheader length: 28
    IRP ID: 0xffffde073c430a70
    IRP USBD_STATUS: USBD_STATUS_SUCCESS (0x00000000)
    URB Function: URB_FUNCTION_CONTROL_TRANSFER (0x0008)
    IRP information: 0x01, Direction: PDO -> FDO
        0000 000. = Reserved: 0x00
        .... ...1 = Direction: PDO -> FDO (0x1)
    URB bus id: 1
    Device address: 13
    Endpoint: 0x00, Direction: OUT
        0... .... = Direction: OUT (0)
        .... 0000 = Endpoint number: 0
    URB transfer type: URB_CONTROL (0x02)
    Packet Data Length: 0
    [Request in: 14033]
    [Time from request: 0.000072000 seconds]
    Control transfer stage: Complete (3)
    [bInterfaceClass: Unknown (0xffff)]

No.     Time           Source                Destination           Protocol Length Info
  14035 16.917673      host                  1.13.0                USB      36     URB_CONTROL out

Frame 14035: 36 bytes on wire (288 bits), 36 bytes captured (288 bits) on interface \\.\USBPcap1, id 0
    Section number: 1
    Interface id: 0 (\\.\USBPcap1)
        Interface name: \\.\USBPcap1
        Interface description: USBPcap1
    Encapsulation type: USB packets with USBPcap header (152)
    Arrival Time: Jun 22, 2025 19:19:26.124537000 Central Europe Daylight Time
    UTC Arrival Time: Jun 22, 2025 17:19:26.124537000 UTC
    Epoch Arrival Time: 1750612766.124537000
    [Time shift for this packet: 0.000000000 seconds]
    [Time delta from previous captured frame: 0.000058000 seconds]
    [Time delta from previous displayed frame: 0.000058000 seconds]
    [Time since reference or first frame: 16.917673000 seconds]
    Frame Number: 14035
    Frame Length: 36 bytes (288 bits)
    Capture Length: 36 bytes (288 bits)
    [Frame is marked: False]
    [Frame is ignored: False]
    [Protocols in frame: usb]
USB URB
    [Source: host]
    [Destination: 1.13.0]
    USBPcap pseudoheader length: 28
    IRP ID: 0xffffde0739be27c0
    IRP USBD_STATUS: USBD_STATUS_SUCCESS (0x00000000)
    URB Function: URB_FUNCTION_VENDOR_DEVICE (0x0017)
    IRP information: 0x00, Direction: FDO -> PDO
        0000 000. = Reserved: 0x00
        .... ...0 = Direction: FDO -> PDO (0x0)
    URB bus id: 1
    Device address: 13
    Endpoint: 0x00, Direction: OUT
        0... .... = Direction: OUT (0)
        .... 0000 = Endpoint number: 0
    URB transfer type: URB_CONTROL (0x02)
    Packet Data Length: 8
    [Response in: 14036]
    Control transfer stage: Setup (0)
    [bInterfaceClass: Unknown (0xffff)]
Setup Data
    bmRequestType: 0x40
        0... .... = Direction: Host-to-device
        .10. .... = Type: Vendor (0x2)
        ...0 0000 = Recipient: Device (0x00)
    bRequest: 65
    wValue: 0x0e00
    wIndex: 257 (0x0101)
    wLength: 0

No.     Time           Source                Destination           Protocol Length Info
  14036 16.917741      1.13.0                host                  USB      28     URB_CONTROL out

Frame 14036: 28 bytes on wire (224 bits), 28 bytes captured (224 bits) on interface \\.\USBPcap1, id 0
    Section number: 1
    Interface id: 0 (\\.\USBPcap1)
        Interface name: \\.\USBPcap1
        Interface description: USBPcap1
    Encapsulation type: USB packets with USBPcap header (152)
    Arrival Time: Jun 22, 2025 19:19:26.124605000 Central Europe Daylight Time
    UTC Arrival Time: Jun 22, 2025 17:19:26.124605000 UTC
    Epoch Arrival Time: 1750612766.124605000
    [Time shift for this packet: 0.000000000 seconds]
    [Time delta from previous captured frame: 0.000068000 seconds]
    [Time delta from previous displayed frame: 0.000068000 seconds]
    [Time since reference or first frame: 16.917741000 seconds]
    Frame Number: 14036
    Frame Length: 28 bytes (224 bits)
    Capture Length: 28 bytes (224 bits)
    [Frame is marked: False]
    [Frame is ignored: False]
    [Protocols in frame: usb]
USB URB
    [Source: 1.13.0]
    [Destination: host]
    USBPcap pseudoheader length: 28
    IRP ID: 0xffffde0739be27c0
    IRP USBD_STATUS: USBD_STATUS_SUCCESS (0x00000000)
    URB Function: URB_FUNCTION_CONTROL_TRANSFER (0x0008)
    IRP information: 0x01, Direction: PDO -> FDO
        0000 000. = Reserved: 0x00
        .... ...1 = Direction: PDO -> FDO (0x1)
    URB bus id: 1
    Device address: 13
    Endpoint: 0x00, Direction: OUT
        0... .... = Direction: OUT (0)
        .... 0000 = Endpoint number: 0
    URB transfer type: URB_CONTROL (0x02)
    Packet Data Length: 0
    [Request in: 14035]
    [Time from request: 0.000068000 seconds]
    Control transfer stage: Complete (3)
    [bInterfaceClass: Unknown (0xffff)]

No.     Time           Source                Destination           Protocol Length Info
  14037 16.917747      host                  1.13.0                USB      36     URB_CONTROL out

Frame 14037: 36 bytes on wire (288 bits), 36 bytes captured (288 bits) on interface \\.\USBPcap1, id 0
    Section number: 1
    Interface id: 0 (\\.\USBPcap1)
        Interface name: \\.\USBPcap1
        Interface description: USBPcap1
    Encapsulation type: USB packets with USBPcap header (152)
    Arrival Time: Jun 22, 2025 19:19:26.124611000 Central Europe Daylight Time
    UTC Arrival Time: Jun 22, 2025 17:19:26.124611000 UTC
    Epoch Arrival Time: 1750612766.124611000
    [Time shift for this packet: 0.000000000 seconds]
    [Time delta from previous captured frame: 0.000006000 seconds]
    [Time delta from previous displayed frame: 0.000006000 seconds]
    [Time since reference or first frame: 16.917747000 seconds]
    Frame Number: 14037
    Frame Length: 36 bytes (288 bits)
    Capture Length: 36 bytes (288 bits)
    [Frame is marked: False]
    [Frame is ignored: False]
    [Protocols in frame: usb]
USB URB
    [Source: host]
    [Destination: 1.13.0]
    USBPcap pseudoheader length: 28
    IRP ID: 0xffffde073c724010
    IRP USBD_STATUS: USBD_STATUS_SUCCESS (0x00000000)
    URB Function: URB_FUNCTION_VENDOR_DEVICE (0x0017)
    IRP information: 0x00, Direction: FDO -> PDO
        0000 000. = Reserved: 0x00
        .... ...0 = Direction: FDO -> PDO (0x0)
    URB bus id: 1
    Device address: 13
    Endpoint: 0x00, Direction: OUT
        0... .... = Direction: OUT (0)
        .... 0000 = Endpoint number: 0
    URB transfer type: URB_CONTROL (0x02)
    Packet Data Length: 8
    [Response in: 14038]
    Control transfer stage: Setup (0)
    [bInterfaceClass: Unknown (0xffff)]
Setup Data
    bmRequestType: 0x40
        0... .... = Direction: Host-to-device
        .10. .... = Type: Vendor (0x2)
        ...0 0000 = Recipient: Device (0x00)
    bRequest: 65
    wValue: 0x0f00
    wIndex: 257 (0x0101)
    wLength: 0

No.     Time           Source                Destination           Protocol Length Info
  14038 16.917809      1.13.0                host                  USB      28     URB_CONTROL out

Frame 14038: 28 bytes on wire (224 bits), 28 bytes captured (224 bits) on interface \\.\USBPcap1, id 0
    Section number: 1
    Interface id: 0 (\\.\USBPcap1)
        Interface name: \\.\USBPcap1
        Interface description: USBPcap1
    Encapsulation type: USB packets with USBPcap header (152)
    Arrival Time: Jun 22, 2025 19:19:26.124673000 Central Europe Daylight Time
    UTC Arrival Time: Jun 22, 2025 17:19:26.124673000 UTC
    Epoch Arrival Time: 1750612766.124673000
    [Time shift for this packet: 0.000000000 seconds]
    [Time delta from previous captured frame: 0.000062000 seconds]
    [Time delta from previous displayed frame: 0.000062000 seconds]
    [Time since reference or first frame: 16.917809000 seconds]
    Frame Number: 14038
    Frame Length: 28 bytes (224 bits)
    Capture Length: 28 bytes (224 bits)
    [Frame is marked: False]
    [Frame is ignored: False]
    [Protocols in frame: usb]
USB URB
    [Source: 1.13.0]
    [Destination: host]
    USBPcap pseudoheader length: 28
    IRP ID: 0xffffde073c724010
    IRP USBD_STATUS: USBD_STATUS_SUCCESS (0x00000000)
    URB Function: URB_FUNCTION_CONTROL_TRANSFER (0x0008)
    IRP information: 0x01, Direction: PDO -> FDO
        0000 000. = Reserved: 0x00
        .... ...1 = Direction: PDO -> FDO (0x1)
    URB bus id: 1
    Device address: 13
    Endpoint: 0x00, Direction: OUT
        0... .... = Direction: OUT (0)
        .... 0000 = Endpoint number: 0
    URB transfer type: URB_CONTROL (0x02)
    Packet Data Length: 0
    [Request in: 14037]
    [Time from request: 0.000062000 seconds]
    Control transfer stage: Complete (3)
    [bInterfaceClass: Unknown (0xffff)]

No.     Time           Source                Destination           Protocol Length Info
  14039 16.917840      host                  1.13.0                USB      36     URB_CONTROL out

Frame 14039: 36 bytes on wire (288 bits), 36 bytes captured (288 bits) on interface \\.\USBPcap1, id 0
    Section number: 1
    Interface id: 0 (\\.\USBPcap1)
        Interface name: \\.\USBPcap1
        Interface description: USBPcap1
    Encapsulation type: USB packets with USBPcap header (152)
    Arrival Time: Jun 22, 2025 19:19:26.124704000 Central Europe Daylight Time
    UTC Arrival Time: Jun 22, 2025 17:19:26.124704000 UTC
    Epoch Arrival Time: 1750612766.124704000
    [Time shift for this packet: 0.000000000 seconds]
    [Time delta from previous captured frame: 0.000031000 seconds]
    [Time delta from previous displayed frame: 0.000031000 seconds]
    [Time since reference or first frame: 16.917840000 seconds]
    Frame Number: 14039
    Frame Length: 36 bytes (288 bits)
    Capture Length: 36 bytes (288 bits)
    [Frame is marked: False]
    [Frame is ignored: False]
    [Protocols in frame: usb]
USB URB
    [Source: host]
    [Destination: 1.13.0]
    USBPcap pseudoheader length: 28
    IRP ID: 0xffffde0739be27c0
    IRP USBD_STATUS: USBD_STATUS_SUCCESS (0x00000000)
    URB Function: URB_FUNCTION_VENDOR_DEVICE (0x0017)
    IRP information: 0x00, Direction: FDO -> PDO
        0000 000. = Reserved: 0x00
        .... ...0 = Direction: FDO -> PDO (0x0)
    URB bus id: 1
    Device address: 13
    Endpoint: 0x00, Direction: OUT
        0... .... = Direction: OUT (0)
        .... 0000 = Endpoint number: 0
    URB transfer type: URB_CONTROL (0x02)
    Packet Data Length: 8
    [Response in: 14040]
    Control transfer stage: Setup (0)
    [bInterfaceClass: Unknown (0xffff)]
Setup Data
    bmRequestType: 0x40
        0... .... = Direction: Host-to-device
        .10. .... = Type: Vendor (0x2)
        ...0 0000 = Recipient: Device (0x00)
    bRequest: 65
    wValue: 0x1002
    wIndex: 257 (0x0101)
    wLength: 0

No.     Time           Source                Destination           Protocol Length Info
  14040 16.917956      1.13.0                host                  USB      28     URB_CONTROL out

Frame 14040: 28 bytes on wire (224 bits), 28 bytes captured (224 bits) on interface \\.\USBPcap1, id 0
    Section number: 1
    Interface id: 0 (\\.\USBPcap1)
        Interface name: \\.\USBPcap1
        Interface description: USBPcap1
    Encapsulation type: USB packets with USBPcap header (152)
    Arrival Time: Jun 22, 2025 19:19:26.124820000 Central Europe Daylight Time
    UTC Arrival Time: Jun 22, 2025 17:19:26.124820000 UTC
    Epoch Arrival Time: 1750612766.124820000
    [Time shift for this packet: 0.000000000 seconds]
    [Time delta from previous captured frame: 0.000116000 seconds]
    [Time delta from previous displayed frame: 0.000116000 seconds]
    [Time since reference or first frame: 16.917956000 seconds]
    Frame Number: 14040
    Frame Length: 28 bytes (224 bits)
    Capture Length: 28 bytes (224 bits)
    [Frame is marked: False]
    [Frame is ignored: False]
    [Protocols in frame: usb]
USB URB
    [Source: 1.13.0]
    [Destination: host]
    USBPcap pseudoheader length: 28
    IRP ID: 0xffffde0739be27c0
    IRP USBD_STATUS: USBD_STATUS_SUCCESS (0x00000000)
    URB Function: URB_FUNCTION_CONTROL_TRANSFER (0x0008)
    IRP information: 0x01, Direction: PDO -> FDO
        0000 000. = Reserved: 0x00
        .... ...1 = Direction: PDO -> FDO (0x1)
    URB bus id: 1
    Device address: 13
    Endpoint: 0x00, Direction: OUT
        0... .... = Direction: OUT (0)
        .... 0000 = Endpoint number: 0
    URB transfer type: URB_CONTROL (0x02)
    Packet Data Length: 0
    [Request in: 14039]
    [Time from request: 0.000116000 seconds]
    Control transfer stage: Complete (3)
    [bInterfaceClass: Unknown (0xffff)]

No.     Time           Source                Destination           Protocol Length Info
  14041 16.917975      host                  1.13.0                USB      36     URB_CONTROL out

Frame 14041: 36 bytes on wire (288 bits), 36 bytes captured (288 bits) on interface \\.\USBPcap1, id 0
    Section number: 1
    Interface id: 0 (\\.\USBPcap1)
        Interface name: \\.\USBPcap1
        Interface description: USBPcap1
    Encapsulation type: USB packets with USBPcap header (152)
    Arrival Time: Jun 22, 2025 19:19:26.124839000 Central Europe Daylight Time
    UTC Arrival Time: Jun 22, 2025 17:19:26.124839000 UTC
    Epoch Arrival Time: 1750612766.124839000
    [Time shift for this packet: 0.000000000 seconds]
    [Time delta from previous captured frame: 0.000019000 seconds]
    [Time delta from previous displayed frame: 0.000019000 seconds]
    [Time since reference or first frame: 16.917975000 seconds]
    Frame Number: 14041
    Frame Length: 36 bytes (288 bits)
    Capture Length: 36 bytes (288 bits)
    [Frame is marked: False]
    [Frame is ignored: False]
    [Protocols in frame: usb]
USB URB
    [Source: host]
    [Destination: 1.13.0]
    USBPcap pseudoheader length: 28
    IRP ID: 0xffffde073c724010
    IRP USBD_STATUS: USBD_STATUS_SUCCESS (0x00000000)
    URB Function: URB_FUNCTION_VENDOR_DEVICE (0x0017)
    IRP information: 0x00, Direction: FDO -> PDO
        0000 000. = Reserved: 0x00
        .... ...0 = Direction: FDO -> PDO (0x0)
    URB bus id: 1
    Device address: 13
    Endpoint: 0x00, Direction: OUT
        0... .... = Direction: OUT (0)
        .... 0000 = Endpoint number: 0
    URB transfer type: URB_CONTROL (0x02)
    Packet Data Length: 8
    [Response in: 14042]
    Control transfer stage: Setup (0)
    [bInterfaceClass: Unknown (0xffff)]
Setup Data
    bmRequestType: 0x40
        0... .... = Direction: Host-to-device
        .10. .... = Type: Vendor (0x2)
        ...0 0000 = Recipient: Device (0x00)
    bRequest: 65
    wValue: 0x110b
    wIndex: 257 (0x0101)
    wLength: 0

No.     Time           Source                Destination           Protocol Length Info
  14042 16.918041      1.13.0                host                  USB      28     URB_CONTROL out

Frame 14042: 28 bytes on wire (224 bits), 28 bytes captured (224 bits) on interface \\.\USBPcap1, id 0
    Section number: 1
    Interface id: 0 (\\.\USBPcap1)
        Interface name: \\.\USBPcap1
        Interface description: USBPcap1
    Encapsulation type: USB packets with USBPcap header (152)
    Arrival Time: Jun 22, 2025 19:19:26.124905000 Central Europe Daylight Time
    UTC Arrival Time: Jun 22, 2025 17:19:26.124905000 UTC
    Epoch Arrival Time: 1750612766.124905000
    [Time shift for this packet: 0.000000000 seconds]
    [Time delta from previous captured frame: 0.000066000 seconds]
    [Time delta from previous displayed frame: 0.000066000 seconds]
    [Time since reference or first frame: 16.918041000 seconds]
    Frame Number: 14042
    Frame Length: 28 bytes (224 bits)
    Capture Length: 28 bytes (224 bits)
    [Frame is marked: False]
    [Frame is ignored: False]
    [Protocols in frame: usb]
USB URB
    [Source: 1.13.0]
    [Destination: host]
    USBPcap pseudoheader length: 28
    IRP ID: 0xffffde073c724010
    IRP USBD_STATUS: USBD_STATUS_SUCCESS (0x00000000)
    URB Function: URB_FUNCTION_CONTROL_TRANSFER (0x0008)
    IRP information: 0x01, Direction: PDO -> FDO
        0000 000. = Reserved: 0x00
        .... ...1 = Direction: PDO -> FDO (0x1)
    URB bus id: 1
    Device address: 13
    Endpoint: 0x00, Direction: OUT
        0... .... = Direction: OUT (0)
        .... 0000 = Endpoint number: 0
    URB transfer type: URB_CONTROL (0x02)
    Packet Data Length: 0
    [Request in: 14041]
    [Time from request: 0.000066000 seconds]
    Control transfer stage: Complete (3)
    [bInterfaceClass: Unknown (0xffff)]

No.     Time           Source                Destination           Protocol Length Info
  14043 16.918080      host                  1.13.0                USB      39     URB_CONTROL out

Frame 14043: 39 bytes on wire (312 bits), 39 bytes captured (312 bits) on interface \\.\USBPcap1, id 0
    Section number: 1
    Interface id: 0 (\\.\USBPcap1)
        Interface name: \\.\USBPcap1
        Interface description: USBPcap1
    Encapsulation type: USB packets with USBPcap header (152)
    Arrival Time: Jun 22, 2025 19:19:26.124944000 Central Europe Daylight Time
    UTC Arrival Time: Jun 22, 2025 17:19:26.124944000 UTC
    Epoch Arrival Time: 1750612766.124944000
    [Time shift for this packet: 0.000000000 seconds]
    [Time delta from previous captured frame: 0.000039000 seconds]
    [Time delta from previous displayed frame: 0.000039000 seconds]
    [Time since reference or first frame: 16.918080000 seconds]
    Frame Number: 14043
    Frame Length: 39 bytes (312 bits)
    Capture Length: 39 bytes (312 bits)
    [Frame is marked: False]
    [Frame is ignored: False]
    [Protocols in frame: usb]
USB URB
    [Source: host]
    [Destination: 1.13.0]
    USBPcap pseudoheader length: 28
    IRP ID: 0xffffde0739be27c0
    IRP USBD_STATUS: USBD_STATUS_SUCCESS (0x00000000)
    URB Function: URB_FUNCTION_CLASS_ENDPOINT (0x001c)
    IRP information: 0x00, Direction: FDO -> PDO
        0000 000. = Reserved: 0x00
        .... ...0 = Direction: FDO -> PDO (0x0)
    URB bus id: 1
    Device address: 13
    Endpoint: 0x00, Direction: OUT
        0... .... = Direction: OUT (0)
        .... 0000 = Endpoint number: 0
    URB transfer type: URB_CONTROL (0x02)
    Packet Data Length: 11
    [Response in: 14044]
    Control transfer stage: Setup (0)
    [bInterfaceClass: Vendor Specific (0xff)]
Setup Data
    bmRequestType: 0x22
        0... .... = Direction: Host-to-device
        .01. .... = Type: Class (0x1)
        ...0 0010 = Recipient: Endpoint (0x02)
    bRequest: 1
    wValue: 0x0100
    wIndex: 134 (0x0086)
    wLength: 3
    Data Fragment: 80bb00

No.     Time           Source                Destination           Protocol Length Info
  14044 16.918256      1.13.0                host                  USB      28     URB_CONTROL out

Frame 14044: 28 bytes on wire (224 bits), 28 bytes captured (224 bits) on interface \\.\USBPcap1, id 0
    Section number: 1
    Interface id: 0 (\\.\USBPcap1)
        Interface name: \\.\USBPcap1
        Interface description: USBPcap1
    Encapsulation type: USB packets with USBPcap header (152)
    Arrival Time: Jun 22, 2025 19:19:26.125120000 Central Europe Daylight Time
    UTC Arrival Time: Jun 22, 2025 17:19:26.125120000 UTC
    Epoch Arrival Time: 1750612766.125120000
    [Time shift for this packet: 0.000000000 seconds]
    [Time delta from previous captured frame: 0.000176000 seconds]
    [Time delta from previous displayed frame: 0.000176000 seconds]
    [Time since reference or first frame: 16.918256000 seconds]
    Frame Number: 14044
    Frame Length: 28 bytes (224 bits)
    Capture Length: 28 bytes (224 bits)
    [Frame is marked: False]
    [Frame is ignored: False]
    [Protocols in frame: usb]
USB URB
    [Source: 1.13.0]
    [Destination: host]
    USBPcap pseudoheader length: 28
    IRP ID: 0xffffde0739be27c0
    IRP USBD_STATUS: USBD_STATUS_SUCCESS (0x00000000)
    URB Function: URB_FUNCTION_CONTROL_TRANSFER (0x0008)
    IRP information: 0x01, Direction: PDO -> FDO
        0000 000. = Reserved: 0x00
        .... ...1 = Direction: PDO -> FDO (0x1)
    URB bus id: 1
    Device address: 13
    Endpoint: 0x00, Direction: OUT
        0... .... = Direction: OUT (0)
        .... 0000 = Endpoint number: 0
    URB transfer type: URB_CONTROL (0x02)
    Packet Data Length: 0
    [Request in: 14043]
    [Time from request: 0.000176000 seconds]
    Control transfer stage: Complete (3)
    [bInterfaceClass: Vendor Specific (0xff)]

No.     Time           Source                Destination           Protocol Length Info
  14045 16.918264      host                  1.13.0                USB      39     URB_CONTROL out

Frame 14045: 39 bytes on wire (312 bits), 39 bytes captured (312 bits) on interface \\.\USBPcap1, id 0
    Section number: 1
    Interface id: 0 (\\.\USBPcap1)
        Interface name: \\.\USBPcap1
        Interface description: USBPcap1
    Encapsulation type: USB packets with USBPcap header (152)
    Arrival Time: Jun 22, 2025 19:19:26.125128000 Central Europe Daylight Time
    UTC Arrival Time: Jun 22, 2025 17:19:26.125128000 UTC
    Epoch Arrival Time: 1750612766.125128000
    [Time shift for this packet: 0.000000000 seconds]
    [Time delta from previous captured frame: 0.000008000 seconds]
    [Time delta from previous displayed frame: 0.000008000 seconds]
    [Time since reference or first frame: 16.918264000 seconds]
    Frame Number: 14045
    Frame Length: 39 bytes (312 bits)
    Capture Length: 39 bytes (312 bits)
    [Frame is marked: False]
    [Frame is ignored: False]
    [Protocols in frame: usb]
USB URB
    [Source: host]
    [Destination: 1.13.0]
    USBPcap pseudoheader length: 28
    IRP ID: 0xffffde073c724010
    IRP USBD_STATUS: USBD_STATUS_SUCCESS (0x00000000)
    URB Function: URB_FUNCTION_CLASS_ENDPOINT (0x001c)
    IRP information: 0x00, Direction: FDO -> PDO
        0000 000. = Reserved: 0x00
        .... ...0 = Direction: FDO -> PDO (0x0)
    URB bus id: 1
    Device address: 13
    Endpoint: 0x00, Direction: OUT
        0... .... = Direction: OUT (0)
        .... 0000 = Endpoint number: 0
    URB transfer type: URB_CONTROL (0x02)
    Packet Data Length: 11
    [Response in: 14046]
    Control transfer stage: Setup (0)
    [bInterfaceClass: Vendor Specific (0xff)]
Setup Data
    bmRequestType: 0x22
        0... .... = Direction: Host-to-device
        .01. .... = Type: Class (0x1)
        ...0 0010 = Recipient: Endpoint (0x02)
    bRequest: 1
    wValue: 0x0100
    wIndex: 2 (0x0002)
    wLength: 3
    Data Fragment: 80bb00

No.     Time           Source                Destination           Protocol Length Info
  14046 16.918377      1.13.0                host                  USB      28     URB_CONTROL out

Frame 14046: 28 bytes on wire (224 bits), 28 bytes captured (224 bits) on interface \\.\USBPcap1, id 0
    Section number: 1
    Interface id: 0 (\\.\USBPcap1)
        Interface name: \\.\USBPcap1
        Interface description: USBPcap1
    Encapsulation type: USB packets with USBPcap header (152)
    Arrival Time: Jun 22, 2025 19:19:26.125241000 Central Europe Daylight Time
    UTC Arrival Time: Jun 22, 2025 17:19:26.125241000 UTC
    Epoch Arrival Time: 1750612766.125241000
    [Time shift for this packet: 0.000000000 seconds]
    [Time delta from previous captured frame: 0.000113000 seconds]
    [Time delta from previous displayed frame: 0.000113000 seconds]
    [Time since reference or first frame: 16.918377000 seconds]
    Frame Number: 14046
    Frame Length: 28 bytes (224 bits)
    Capture Length: 28 bytes (224 bits)
    [Frame is marked: False]
    [Frame is ignored: False]
    [Protocols in frame: usb]
USB URB
    [Source: 1.13.0]
    [Destination: host]
    USBPcap pseudoheader length: 28
    IRP ID: 0xffffde073c724010
    IRP USBD_STATUS: USBD_STATUS_SUCCESS (0x00000000)
    URB Function: URB_FUNCTION_CONTROL_TRANSFER (0x0008)
    IRP information: 0x01, Direction: PDO -> FDO
        0000 000. = Reserved: 0x00
        .... ...1 = Direction: PDO -> FDO (0x1)
    URB bus id: 1
    Device address: 13
    Endpoint: 0x00, Direction: OUT
        0... .... = Direction: OUT (0)
        .... 0000 = Endpoint number: 0
    URB transfer type: URB_CONTROL (0x02)
    Packet Data Length: 0
    [Request in: 14045]
    [Time from request: 0.000113000 seconds]
    Control transfer stage: Complete (3)
    [bInterfaceClass: Vendor Specific (0xff)]

No.     Time           Source                Destination           Protocol Length Info
  14047 16.918388      host                  1.13.0                USB      39     URB_CONTROL out

Frame 14047: 39 bytes on wire (312 bits), 39 bytes captured (312 bits) on interface \\.\USBPcap1, id 0
    Section number: 1
    Interface id: 0 (\\.\USBPcap1)
        Interface name: \\.\USBPcap1
        Interface description: USBPcap1
    Encapsulation type: USB packets with USBPcap header (152)
    Arrival Time: Jun 22, 2025 19:19:26.125252000 Central Europe Daylight Time
    UTC Arrival Time: Jun 22, 2025 17:19:26.125252000 UTC
    Epoch Arrival Time: 1750612766.125252000
    [Time shift for this packet: 0.000000000 seconds]
    [Time delta from previous captured frame: 0.000011000 seconds]
    [Time delta from previous displayed frame: 0.000011000 seconds]
    [Time since reference or first frame: 16.918388000 seconds]
    Frame Number: 14047
    Frame Length: 39 bytes (312 bits)
    Capture Length: 39 bytes (312 bits)
    [Frame is marked: False]
    [Frame is ignored: False]
    [Protocols in frame: usb]
USB URB
    [Source: host]
    [Destination: 1.13.0]
    USBPcap pseudoheader length: 28
    IRP ID: 0xffffde073c724010
    IRP USBD_STATUS: USBD_STATUS_SUCCESS (0x00000000)
    URB Function: URB_FUNCTION_CLASS_ENDPOINT (0x001c)
    IRP information: 0x00, Direction: FDO -> PDO
        0000 000. = Reserved: 0x00
        .... ...0 = Direction: FDO -> PDO (0x0)
    URB bus id: 1
    Device address: 13
    Endpoint: 0x00, Direction: OUT
        0... .... = Direction: OUT (0)
        .... 0000 = Endpoint number: 0
    URB transfer type: URB_CONTROL (0x02)
    Packet Data Length: 11
    [Response in: 14048]
    Control transfer stage: Setup (0)
    [bInterfaceClass: Vendor Specific (0xff)]
Setup Data
    bmRequestType: 0x22
        0... .... = Direction: Host-to-device
        .01. .... = Type: Class (0x1)
        ...0 0010 = Recipient: Endpoint (0x02)
    bRequest: 1
    wValue: 0x0100
    wIndex: 134 (0x0086)
    wLength: 3
    Data Fragment: 80bb00

No.     Time           Source                Destination           Protocol Length Info
  14048 16.918543      1.13.0                host                  USB      28     URB_CONTROL out

Frame 14048: 28 bytes on wire (224 bits), 28 bytes captured (224 bits) on interface \\.\USBPcap1, id 0
    Section number: 1
    Interface id: 0 (\\.\USBPcap1)
        Interface name: \\.\USBPcap1
        Interface description: USBPcap1
    Encapsulation type: USB packets with USBPcap header (152)
    Arrival Time: Jun 22, 2025 19:19:26.125407000 Central Europe Daylight Time
    UTC Arrival Time: Jun 22, 2025 17:19:26.125407000 UTC
    Epoch Arrival Time: 1750612766.125407000
    [Time shift for this packet: 0.000000000 seconds]
    [Time delta from previous captured frame: 0.000155000 seconds]
    [Time delta from previous displayed frame: 0.000155000 seconds]
    [Time since reference or first frame: 16.918543000 seconds]
    Frame Number: 14048
    Frame Length: 28 bytes (224 bits)
    Capture Length: 28 bytes (224 bits)
    [Frame is marked: False]
    [Frame is ignored: False]
    [Protocols in frame: usb]
USB URB
    [Source: 1.13.0]
    [Destination: host]
    USBPcap pseudoheader length: 28
    IRP ID: 0xffffde073c724010
    IRP USBD_STATUS: USBD_STATUS_SUCCESS (0x00000000)
    URB Function: URB_FUNCTION_CONTROL_TRANSFER (0x0008)
    IRP information: 0x01, Direction: PDO -> FDO
        0000 000. = Reserved: 0x00
        .... ...1 = Direction: PDO -> FDO (0x1)
    URB bus id: 1
    Device address: 13
    Endpoint: 0x00, Direction: OUT
        0... .... = Direction: OUT (0)
        .... 0000 = Endpoint number: 0
    URB transfer type: URB_CONTROL (0x02)
    Packet Data Length: 0
    [Request in: 14047]
    [Time from request: 0.000155000 seconds]
    Control transfer stage: Complete (3)
    [bInterfaceClass: Vendor Specific (0xff)]

No.     Time           Source                Destination           Protocol Length Info
  14049 16.918595      host                  1.13.0                USB      36     URB_CONTROL in

Frame 14049: 36 bytes on wire (288 bits), 36 bytes captured (288 bits) on interface \\.\USBPcap1, id 0
    Section number: 1
    Interface id: 0 (\\.\USBPcap1)
        Interface name: \\.\USBPcap1
        Interface description: USBPcap1
    Encapsulation type: USB packets with USBPcap header (152)
    Arrival Time: Jun 22, 2025 19:19:26.125459000 Central Europe Daylight Time
    UTC Arrival Time: Jun 22, 2025 17:19:26.125459000 UTC
    Epoch Arrival Time: 1750612766.125459000
    [Time shift for this packet: 0.000000000 seconds]
    [Time delta from previous captured frame: 0.000052000 seconds]
    [Time delta from previous displayed frame: 0.000052000 seconds]
    [Time since reference or first frame: 16.918595000 seconds]
    Frame Number: 14049
    Frame Length: 36 bytes (288 bits)
    Capture Length: 36 bytes (288 bits)
    [Frame is marked: False]
    [Frame is ignored: False]
    [Protocols in frame: usb]
USB URB
    [Source: host]
    [Destination: 1.13.0]
    USBPcap pseudoheader length: 28
    IRP ID: 0xffffde0739be27c0
    IRP USBD_STATUS: USBD_STATUS_SUCCESS (0x00000000)
    URB Function: URB_FUNCTION_CLASS_ENDPOINT (0x001c)
    IRP information: 0x00, Direction: FDO -> PDO
        0000 000. = Reserved: 0x00
        .... ...0 = Direction: FDO -> PDO (0x0)
    URB bus id: 1
    Device address: 13
    Endpoint: 0x80, Direction: IN
        1... .... = Direction: IN (1)
        .... 0000 = Endpoint number: 0
    URB transfer type: URB_CONTROL (0x02)
    Packet Data Length: 8
    [Response in: 14050]
    Control transfer stage: Setup (0)
    [bInterfaceClass: Vendor Specific (0xff)]
Setup Data
    bmRequestType: 0xa2
        1... .... = Direction: Device-to-host
        .01. .... = Type: Class (0x1)
        ...0 0010 = Recipient: Endpoint (0x02)
    bRequest: 129
    wValue: 0x0100
    wIndex: 134 (0x0086)
    wLength: 3

No.     Time           Source                Destination           Protocol Length Info
  14050 16.918759      1.13.0                host                  USB      31     URB_CONTROL in

Frame 14050: 31 bytes on wire (248 bits), 31 bytes captured (248 bits) on interface \\.\USBPcap1, id 0
    Section number: 1
    Interface id: 0 (\\.\USBPcap1)
        Interface name: \\.\USBPcap1
        Interface description: USBPcap1
    Encapsulation type: USB packets with USBPcap header (152)
    Arrival Time: Jun 22, 2025 19:19:26.125623000 Central Europe Daylight Time
    UTC Arrival Time: Jun 22, 2025 17:19:26.125623000 UTC
    Epoch Arrival Time: 1750612766.125623000
    [Time shift for this packet: 0.000000000 seconds]
    [Time delta from previous captured frame: 0.000164000 seconds]
    [Time delta from previous displayed frame: 0.000164000 seconds]
    [Time since reference or first frame: 16.918759000 seconds]
    Frame Number: 14050
    Frame Length: 31 bytes (248 bits)
    Capture Length: 31 bytes (248 bits)
    [Frame is marked: False]
    [Frame is ignored: False]
    [Protocols in frame: usb]
USB URB
    [Source: 1.13.0]
    [Destination: host]
    USBPcap pseudoheader length: 28
    IRP ID: 0xffffde0739be27c0
    IRP USBD_STATUS: USBD_STATUS_SUCCESS (0x00000000)
    URB Function: URB_FUNCTION_CONTROL_TRANSFER (0x0008)
    IRP information: 0x01, Direction: PDO -> FDO
        0000 000. = Reserved: 0x00
        .... ...1 = Direction: PDO -> FDO (0x1)
    URB bus id: 1
    Device address: 13
    Endpoint: 0x80, Direction: IN
        1... .... = Direction: IN (1)
        .... 0000 = Endpoint number: 0
    URB transfer type: URB_CONTROL (0x02)
    Packet Data Length: 3
    [Request in: 14049]
    [Time from request: 0.000164000 seconds]
    Control transfer stage: Complete (3)
    [bInterfaceClass: Vendor Specific (0xff)]
CONTROL response data: 80bb00

No.     Time           Source                Destination           Protocol Length Info
  14051 16.918800      host                  1.13.0                USB      36     URB_CONTROL in

Frame 14051: 36 bytes on wire (288 bits), 36 bytes captured (288 bits) on interface \\.\USBPcap1, id 0
    Section number: 1
    Interface id: 0 (\\.\USBPcap1)
        Interface name: \\.\USBPcap1
        Interface description: USBPcap1
    Encapsulation type: USB packets with USBPcap header (152)
    Arrival Time: Jun 22, 2025 19:19:26.125664000 Central Europe Daylight Time
    UTC Arrival Time: Jun 22, 2025 17:19:26.125664000 UTC
    Epoch Arrival Time: 1750612766.125664000
    [Time shift for this packet: 0.000000000 seconds]
    [Time delta from previous captured frame: 0.000041000 seconds]
    [Time delta from previous displayed frame: 0.000041000 seconds]
    [Time since reference or first frame: 16.918800000 seconds]
    Frame Number: 14051
    Frame Length: 36 bytes (288 bits)
    Capture Length: 36 bytes (288 bits)
    [Frame is marked: False]
    [Frame is ignored: False]
    [Protocols in frame: usb]
USB URB
    [Source: host]
    [Destination: 1.13.0]
    USBPcap pseudoheader length: 28
    IRP ID: 0xffffde0739be27c0
    IRP USBD_STATUS: USBD_STATUS_SUCCESS (0x00000000)
    URB Function: URB_FUNCTION_VENDOR_DEVICE (0x0017)
    IRP information: 0x00, Direction: FDO -> PDO
        0000 000. = Reserved: 0x00
        .... ...0 = Direction: FDO -> PDO (0x0)
    URB bus id: 1
    Device address: 13
    Endpoint: 0x80, Direction: IN
        1... .... = Direction: IN (1)
        .... 0000 = Endpoint number: 0
    URB transfer type: URB_CONTROL (0x02)
    Packet Data Length: 8
    [Response in: 14052]
    Control transfer stage: Setup (0)
    [bInterfaceClass: Unknown (0xffff)]
Setup Data
    bmRequestType: 0xc0
        1... .... = Direction: Device-to-host
        .10. .... = Type: Vendor (0x2)
        ...0 0000 = Recipient: Device (0x00)
    bRequest: 73
    wValue: 0x0000
    wIndex: 0 (0x0000)
    wLength: 1

No.     Time           Source                Destination           Protocol Length Info
  14052 16.918957      1.13.0                host                  USB      29     URB_CONTROL in

Frame 14052: 29 bytes on wire (232 bits), 29 bytes captured (232 bits) on interface \\.\USBPcap1, id 0
    Section number: 1
    Interface id: 0 (\\.\USBPcap1)
        Interface name: \\.\USBPcap1
        Interface description: USBPcap1
    Encapsulation type: USB packets with USBPcap header (152)
    Arrival Time: Jun 22, 2025 19:19:26.125821000 Central Europe Daylight Time
    UTC Arrival Time: Jun 22, 2025 17:19:26.125821000 UTC
    Epoch Arrival Time: 1750612766.125821000
    [Time shift for this packet: 0.000000000 seconds]
    [Time delta from previous captured frame: 0.000157000 seconds]
    [Time delta from previous displayed frame: 0.000157000 seconds]
    [Time since reference or first frame: 16.918957000 seconds]
    Frame Number: 14052
    Frame Length: 29 bytes (232 bits)
    Capture Length: 29 bytes (232 bits)
    [Frame is marked: False]
    [Frame is ignored: False]
    [Protocols in frame: usb]
USB URB
    [Source: 1.13.0]
    [Destination: host]
    USBPcap pseudoheader length: 28
    IRP ID: 0xffffde0739be27c0
    IRP USBD_STATUS: USBD_STATUS_SUCCESS (0x00000000)
    URB Function: URB_FUNCTION_CONTROL_TRANSFER (0x0008)
    IRP information: 0x01, Direction: PDO -> FDO
        0000 000. = Reserved: 0x00
        .... ...1 = Direction: PDO -> FDO (0x1)
    URB bus id: 1
    Device address: 13
    Endpoint: 0x80, Direction: IN
        1... .... = Direction: IN (1)
        .... 0000 = Endpoint number: 0
    URB transfer type: URB_CONTROL (0x02)
    Packet Data Length: 1
    [Request in: 14051]
    [Time from request: 0.000157000 seconds]
    Control transfer stage: Complete (3)
    [bInterfaceClass: Unknown (0xffff)]
CONTROL response data: 10

No.     Time           Source                Destination           Protocol Length Info
  14053 16.918985      host                  1.13.0                USB      36     URB_CONTROL out

Frame 14053: 36 bytes on wire (288 bits), 36 bytes captured (288 bits) on interface \\.\USBPcap1, id 0
    Section number: 1
    Interface id: 0 (\\.\USBPcap1)
        Interface name: \\.\USBPcap1
        Interface description: USBPcap1
    Encapsulation type: USB packets with USBPcap header (152)
    Arrival Time: Jun 22, 2025 19:19:26.125849000 Central Europe Daylight Time
    UTC Arrival Time: Jun 22, 2025 17:19:26.125849000 UTC
    Epoch Arrival Time: 1750612766.125849000
    [Time shift for this packet: 0.000000000 seconds]
    [Time delta from previous captured frame: 0.000028000 seconds]
    [Time delta from previous displayed frame: 0.000028000 seconds]
    [Time since reference or first frame: 16.918985000 seconds]
    Frame Number: 14053
    Frame Length: 36 bytes (288 bits)
    Capture Length: 36 bytes (288 bits)
    [Frame is marked: False]
    [Frame is ignored: False]
    [Protocols in frame: usb]
USB URB
    [Source: host]
    [Destination: 1.13.0]
    USBPcap pseudoheader length: 28
    IRP ID: 0xffffde073e26e560
    IRP USBD_STATUS: USBD_STATUS_SUCCESS (0x00000000)
    URB Function: URB_FUNCTION_VENDOR_DEVICE (0x0017)
    IRP information: 0x00, Direction: FDO -> PDO
        0000 000. = Reserved: 0x00
        .... ...0 = Direction: FDO -> PDO (0x0)
    URB bus id: 1
    Device address: 13
    Endpoint: 0x00, Direction: OUT
        0... .... = Direction: OUT (0)
        .... 0000 = Endpoint number: 0
    URB transfer type: URB_CONTROL (0x02)
    Packet Data Length: 8
    [Response in: 14054]
    Control transfer stage: Setup (0)
    [bInterfaceClass: Unknown (0xffff)]
Setup Data
    bmRequestType: 0x40
        0... .... = Direction: Host-to-device
        .10. .... = Type: Vendor (0x2)
        ...0 0000 = Recipient: Device (0x00)
    bRequest: 73
    wValue: 0x0030
    wIndex: 0 (0x0000)
    wLength: 0

No.     Time           Source                Destination           Protocol Length Info
  14054 16.919214      1.13.0                host                  USB      28     URB_CONTROL out

Frame 14054: 28 bytes on wire (224 bits), 28 bytes captured (224 bits) on interface \\.\USBPcap1, id 0
    Section number: 1
    Interface id: 0 (\\.\USBPcap1)
        Interface name: \\.\USBPcap1
        Interface description: USBPcap1
    Encapsulation type: USB packets with USBPcap header (152)
    Arrival Time: Jun 22, 2025 19:19:26.126078000 Central Europe Daylight Time
    UTC Arrival Time: Jun 22, 2025 17:19:26.126078000 UTC
    Epoch Arrival Time: 1750612766.126078000
    [Time shift for this packet: 0.000000000 seconds]
    [Time delta from previous captured frame: 0.000229000 seconds]
    [Time delta from previous displayed frame: 0.000229000 seconds]
    [Time since reference or first frame: 16.919214000 seconds]
    Frame Number: 14054
    Frame Length: 28 bytes (224 bits)
    Capture Length: 28 bytes (224 bits)
    [Frame is marked: False]
    [Frame is ignored: False]
    [Protocols in frame: usb]
USB URB
    [Source: 1.13.0]
    [Destination: host]
    USBPcap pseudoheader length: 28
    IRP ID: 0xffffde073e26e560
    IRP USBD_STATUS: USBD_STATUS_SUCCESS (0x00000000)
    URB Function: URB_FUNCTION_CONTROL_TRANSFER (0x0008)
    IRP information: 0x01, Direction: PDO -> FDO
        0000 000. = Reserved: 0x00
        .... ...1 = Direction: PDO -> FDO (0x1)
    URB bus id: 1
    Device address: 13
    Endpoint: 0x00, Direction: OUT
        0... .... = Direction: OUT (0)
        .... 0000 = Endpoint number: 0
    URB transfer type: URB_CONTROL (0x02)
    Packet Data Length: 0
    [Request in: 14053]
    [Time from request: 0.000229000 seconds]
    Control transfer stage: Complete (3)
    [bInterfaceClass: Unknown (0xffff)]
